99951,414,王志凯,2019-01-25 10:36:04,6,8,2,我TM真是醉了，没人来上课，不点名，公平吗？给分真是日了狗了，垃圾的一批。真是别选，财政系主任就这水平？
100400,414,王志凯,2019-01-26 05:15:18,3,6,3,真的sb老师 讲课吗？垃圾老师 这个是浙大老师吗？给分？不要想高分 选这老师你已经准备重修。
108064,414,王志凯,2019-05-14 03:15:28,5,5,0,超级无敌垃圾
108121,414,王志凯,2019-05-15 08:33:13,11,11,0,财政系主任？？？？？
108183,414,王志凯,2019-05-16 06:15:16,3,3,0,不好啊
109368,414,王志凯,2019-06-13 11:28:01,3,3,0,自学，没论文，不点名，适合已经会了又不想上课又不想写论文的同学
125029,414,王志凯,2020-08-15 16:42:48,4,4,0,讲课烂，全靠自学
129035,414,王志凯,2020-12-29 03:48:19,3,3,0,講得很生硬， 吸引不了人 反正現在看到大家的評分那麼低有點慌
131743,414,王志凯,2021-01-28 16:19:57,-3,2,5,非常感谢老师，老师是很温柔的人。还有非常感谢助教hc小哥哥(´，，•ω•，，)！！
142314,414,王志凯,2021-11-10 06:08:25,-2,1,3,社会实践还不错
143616,414,王志凯,2021-11-29 03:44:21,3,3,0,低分怪
148465,414,王志凯,2022-01-12 14:45:45,6,6,0,讲课很烂\n\n给分非常求是，求是到我真的想骂人
150817,414,王志凯,2022-02-19 03:20:53,10,10,0,就这水平还当系主任？！
152055,414,王志凯,2022-03-24 08:27:28,9,12,3,如果一个房间里有希特勒，墨索里尼和wzk，给我一把枪和两颗子弹，我会杀wzk两次。
152766,414,王志凯,2022-04-19 11:30:11,1,6,5,就一点给分极其求是。助教告诉我期末卷子拿90几的样子，平时作业一次没少交全部认真完整，结果卡我绩不给5是咋样？
158912,414,王志凯,2022-07-03 08:13:22,9,10,1,怎么还不退休
167615,414,王志凯,2023-01-17 15:49:21,0,1,1,给分真的巨差
186033,414,王志凯,2024-01-08 02:34:52,0,0,0,上课讲的不太清楚，优点是点名少，平时作业少，期末还没考不知道给分怎么样，别给我挂了就行
186128,414,王志凯,2024-01-08 18:49:28,1,1,0,想要事儿少就选，给分不清楚现在。求你了别求是乱给
188246,414,王志凯,2024-01-18 13:23:02,0,0,0,事儿很少，分也少
188372,414,王志凯,2024-01-19 00:25:00,1,2,1,很惊讶的是满了，一直听隔壁蔡爹的课！所以选上的同学其实不用担心，因为事情很少！期末考试好好考就好了～
188485,414,王志凯,2024-01-19 05:29:39,0,1,1,当时选了王老师的课就看到了极低的评分，有点怕，但是出于对经济学知识的好奇，还是义无反顾地去上了课。\n\n出乎意料的，王老师虽然被说得很差，但其实见识很广，解释课本原理的时候能联系很多事例出来，讲的课是活课，不是死课。对经济学理解差的，能更好理解；对经济学理解好的，能借此机会试着把原理运用到现实中去分析经济问题。因此每节课都有（包括我在内的）十几个同学始终坐在前三排认真听课。\n\n但是客观地说，王老师教学时比较随心所欲，这是毋庸置疑的。就连我都吐槽过他从一开始的三节课讲九页到最后一节课讲将近200页（（。就他所说，这是因为这学期学校要求加的3节网课占用了他授课的时间（其实还是合理的理由，因为网课没法继续学下去，只能看原来的，进程就被拖延了）。另外，王老师讲解经济模型的时候通常是用着他自己非常连贯的逻辑一口气讲下去的，而下面的一群宏观经济学小白只能瑟瑟发抖，我认为如果他愿意把计算题放到对应章节做，应该能让大家更方便理解。\n\n说好话：事少（一个学期一次作业），分不知道高不高，从来不点名（虽然隐隐“威胁”了好几次自己要点名，但是都没有硬点，一共只记录了三次课到课的情况，其中一次还是专门讲计算题的考前补课，而且点名不在平时分里）。\n\n王老师讲课比较高屋建瓴，如果脑子稍差可能不太跟得上（我当时就感叹过：这玩意不可能是给大一的新生上的课吧），但是毋庸置疑是一个德才配位的好教授。
210525,414,王志凯,2025-01-09 10:00:03,2,2,0,选了老师的宏经，当时一看查老师和朵朵感觉挺担心的，但后来想着自己成绩也不会再差到哪里去了就硬着头皮上了。老师上课人肉眼可见的少（或许大家都知道老师风评不好，我这个班只有27人，其他班都是80+，而且就这样到课率也基本没有一半），所有老师偶尔就会问问我们教什么名字，基本上我们的名字他都记得，所以可能这样子最后平时分给的很高吧哈哈哈哈。考试前准备了两三天，最后差一分满了，对我这种菜鸡来说老师真的很不错了。平时只有两次大作业，无慕课无论文无测验。
4095,452,蔡庆兵,2015-06-17 16:47:29,181,191,10,好喜欢蔡老师！
4269,452,蔡庆兵,2015-06-18 12:50:36,121,127,6,百年一遇的良心老师
4356,452,蔡庆兵,2015-06-19 11:11:39,63,68,5,房地产的课不点名。老师很认真。但是我不认真。。。给分很赞很赞。写论文课中最高的一门课
5037,452,蔡庆兵,2015-07-02 11:38:21,49,53,4,业界良心！\n\n
5297,452,蔡庆兵,2015-07-06 10:09:04,96,100,4,老师人好好！非常细心 很为同学们着想！棒棒棒 上课也很幽默，就是语速有点慢。。
9491,452,蔡庆兵,2015-10-29 01:51:01,43,47,4,老师超好！上课讲的很详细都不会困
14922,452,蔡庆兵,2016-01-11 03:39:32,37,37,0,真的好老师
15647,452,蔡庆兵,2016-01-16 03:36:58,28,31,3,业界良心
16783,452,蔡庆兵,2016-01-19 03:09:28,38,39,1,老师人很好讲课也棒 会讲课本之外的实际宏观经济 可是后半学期不是他上的好可惜
18811,452,蔡庆兵,2016-01-22 14:48:30,33,34,1,天了，大写的赞，不仅上课棒给分还好！！
18813,452,蔡庆兵,2016-01-22 14:51:53,49,52,3,真的超级好的老师！！讲课很好有意思！学生邮件问问题都会认真回复，还会把一些分享在公共邮箱给所有学生。给分有按时交作业平时就是满分，会提分。
18971,452,蔡庆兵,2016-01-23 01:25:26,26,27,1,给分还不错
18981,452,蔡庆兵,2016-01-23 02:00:40,33,34,1,怎么有这么好的老师！！！
19257,452,蔡庆兵,2016-01-23 16:16:23,15,16,1,良心老师
19553,452,蔡庆兵,2016-01-24 16:02:08,18,19,1,讲的真的很好！时时考虑到学生！
21271,452,蔡庆兵,2016-02-28 01:39:28,15,17,2,超级认真！上课非常有趣！条理分明！给分还超好！大写的赞！
21662,452,蔡庆兵,2016-02-29 13:15:26,14,16,2,好到极致
21692,452,蔡庆兵,2016-02-29 17:18:22,18,19,1,很好的老师，讲得很细
22571,452,蔡庆兵,2016-03-08 05:37:58,14,17,3,老师特别特别好！
23896,452,蔡庆兵,2016-04-20 11:19:56,17,18,1,老师人真的超nice
24187,452,蔡庆兵,2016-04-28 07:11:29,20,21,1,非常好的老师，拿与课程内容无关的问题请教他都特别认真地回复，很nice，给分也超好。
24208,452,蔡庆兵,2016-04-28 10:03:26,20,22,2,业界良心啊啊啊啊！每次发邮件都会秒回，上课巨负责，娓娓道来，超级关心同学，热心，用心！
25145,452,蔡庆兵,2017-03-28 02:40:14,19,22,3,老师给分好 上课和课后都很认真
25783,452,蔡庆兵,2016-07-02 08:53:27,105,114,9,好老师。  期末卷面92分，平时分30分。 折算下来94.4分，老师给我满绩。这种老师不仅课上得好，人是真心善良啊！（不仅体现在分数上）
26114,452,蔡庆兵,2016-06-16 01:43:54,26,27,1,听老师的房地产 老师讲的很有趣 结合实际 还会教同学买房子kk 最后不用考试只写论文 给分意想不到的高?
26773,452,蔡庆兵,2016-06-21 05:41:14,29,32,3,会在凌晨回复你邮件问题，回复不了还会在课上解答的老师。会把课堂知识跟中国现状结合，总之能能学到东西
27641,452,蔡庆兵,2016-06-27 06:12:46,16,17,1,老师真的很好啊 讲课也好对学生也好 是那种看去就很好的老师 分数还没出 但是很感激这个学期来的学习
28114,452,蔡庆兵,2016-06-28 08:07:22,13,14,1,认真负责讲课好的好老师
28139,452,蔡庆兵,2016-06-28 08:09:18,12,13,1,还是比较满意
28861,452,蔡庆兵,2016-06-29 00:39:27,15,17,2,不能再好了，详细又有趣，拯救了我的宏经
28875,452,蔡庆兵,2016-06-29 02:18:28,7,11,4,给分又好讲得又清楚！\n\n
29035,452,蔡庆兵,2016-06-29 06:59:02,47,50,3,本来想把正面评论都点一遍赞的，结果发现零差评，就给所有回答都点了赞，嘿嘿。辅修以来遇到过最好的老师，没有之一。宏经讲得超级棒，就是考试选择题出得有点难。
29151,452,蔡庆兵,2016-06-29 09:57:30,16,18,2,老师很nice，把学的内容和实际联系起来，循循善诱，同学的问题也都用心回答。就是我的分数为什么还没出。。
29503,452,蔡庆兵,2016-06-30 01:50:43,13,15,2,讲课超级有意思，一点不死板～人也特别好，不为难学生，裂墙推荐！
29530,452,蔡庆兵,2016-06-30 02:40:06,15,16,1,好人一生平安
32830,452,蔡庆兵,2016-07-16 10:54:47,10,14,4,浙大好老师
33474,452,蔡庆兵,2016-09-19 12:37:23,10,12,2,好好好!\n\n
33639,452,蔡庆兵,2016-09-20 14:18:51,9,12,3,上课没有睡意 也不会想玩手机
34339,452,蔡庆兵,2016-10-04 08:16:28,10,12,2,非常好
35261,452,蔡庆兵,2017-01-16 04:03:04,-57,6,63,上的太水太水了
38560,452,蔡庆兵,2016-12-08 13:44:58,10,11,1,蔡老师课上得既认真又风趣非常精彩
41049,452,蔡庆兵,2017-01-08 22:38:02,8,11,3,精彩，挺有收获的。
44020,452,蔡庆兵,2017-01-17 08:17:02,11,12,1,老师真的讲的好人也超好啊！虽然现在分数还没出 但还是毫不犹豫给10分！下学期还有他的房地产 开心！
44091,452,蔡庆兵,2017-01-17 09:11:52,8,9,1,上课完全不走神 超级有兴趣！！想嫁！
45215,452,蔡庆兵,2017-01-19 07:13:32,7,7,0,老师棒棒哒
46323,452,蔡庆兵,2017-01-21 08:28:22,8,9,1,真的好！讲课透彻而又有趣！回邮件的时候超详细超耐心还会说复习辛苦了，还有其他很多的细节都能看出蔡老师的细致，让人超安心的老师
46330,452,蔡庆兵,2017-01-21 08:39:46,14,18,4,本学期最爱的专业课就是蔡老师的宏经啦，虽然有同学觉得语速太慢有点催眠 但我觉得很照顾自己这种反应慢的人耶，讲解简单易懂，书上两页蔡老师几句话还巨清楚，宏经重考悲剧了，但还是给蔡老师一个?
48453,452,蔡庆兵,2017-03-04 13:42:13,0,6,6,宏经重考已跪，现在希望我最喜欢的蔡老师能同情一下新学期认真复习却还是漏掉这次考点的可怜虫
48530,452,蔡庆兵,2017-03-06 23:49:33,9,9,0,超级棒
48540,452,蔡庆兵,2017-03-07 02:52:22,9,9,0,蔡老师认真负责，真的很棒。还想选他的房地产
48807,452,蔡庆兵,2017-03-13 10:44:50,-11,3,14,这个胖子真可爱 好像唐马儒啊~
49137,452,蔡庆兵,2017-03-27 11:44:28,5,7,2,绝对的好老师\n\n
49147,452,蔡庆兵,2017-03-27 16:13:04,3,5,2,好老师！
49150,452,蔡庆兵,2017-03-28 00:34:17,6,7,1,好老师！
49152,452,蔡庆兵,2017-03-28 01:50:24,7,7,0,认真负责的老师。给分好
49155,452,蔡庆兵,2017-03-28 02:03:02,4,7,3,老师很好，讲课有趣易懂，给分据说很好，那可能是我太渣了哭瞎
49162,452,蔡庆兵,2017-03-28 05:19:30,8,9,1,期末给分好 平时分给的也很高 讲的也好 总之好老师！
49199,452,蔡庆兵,2017-03-29 06:45:05,11,11,0,耐心负责 讲得也非常好
49512,452,蔡庆兵,2017-04-17 10:25:10,7,8,1,非常棒的一个老师，能说会道，谈笑风生，上课很有趣
52370,452,蔡庆兵,2017-06-19 07:19:22,5,7,2,良心好老师（我还不知道我的得分），一生推
53900,452,蔡庆兵,2018-09-01 05:16:55,-135,3,138,讲课清楚题目简单，我就复习了一天，虽然比想象中难一点但是题目类型清楚直白也很简单。希望比味精97分高吧?
55394,452,蔡庆兵,2017-07-01 12:13:26,4,5,1,老师真的好！百年一遇的良心老师，讲课深入浅出，还引用事例，一点也不枯燥
55397,452,蔡庆兵,2017-07-01 12:19:19,9,10,1,怎么说呢 大概就是这节课你提前半小时来只能坐最后吧^O^\n\n老师真的特别认真！每次上课都是大汗淋漓！而且给分超好！
55398,452,蔡庆兵,2017-07-01 12:21:14,4,5,1,虽然学期后半段没有认真听课，但是考试成绩满满的师生情让我泪流满面~蔡老师最棒了
55403,452,蔡庆兵,2017-07-01 12:30:31,3,4,1,老师太棒了！
55680,452,蔡庆兵,2017-07-02 07:23:08,5,6,1,超级有趣的老师，用经济学原理解读生活现象深入浅出。期末考的比较难，可能是春夏修宏经的原因吧，单独出卷。但是，师生情太浓了！！
55866,452,蔡庆兵,2017-07-02 13:53:25,4,5,1,蔡老师讲课一级棒！给分超级好！反正宏经选他没有错！
57381,452,蔡庆兵,2017-07-07 05:38:21,1,4,3,好，好，好。
60222,452,蔡庆兵,2017-10-14 04:06:18,5,5,0,光头男神！快下课时经常会讲好笑的段子。答疑邮件秒回。最最最重要的是因为有点胖所以很！萌！啊！(≧▽≦)
60281,452,蔡庆兵,2017-10-16 12:36:22,2,4,2,两年里遇到的最好的老师，没有之一！
65570,452,蔡庆兵,2018-01-06 10:50:51,1,2,1,真的很好阿
67177,452,蔡庆兵,2018-01-20 11:45:28,1,2,1,讲课挺认真负责的
67205,452,蔡庆兵,2018-01-27 10:30:30,6,9,3,给分好，耐心讲解，关心学生，很难得的好老师
68941,452,蔡庆兵,2018-01-24 06:49:39,6,7,1,只想问为啥蔡老师不是十分
70597,452,蔡庆兵,2018-01-27 09:14:54,5,5,0,蔡老师真的讲课好！人有风度！作业内容也很扎实真的能学到超级多知识！！！给分真的超级好！！！！男神
70598,452,蔡庆兵,2018-01-27 09:17:02,3,4,1,太棒啦！老师教学真的很负责，经常在群里回答问题，给分简直好到爆炸！给老师打call！
70601,452,蔡庆兵,2018-01-27 09:28:12,3,4,1,蔡老师真的太太太好了!!!老师上课非常认真仔细，讲的很有条理，干货满满。课后老师会在群里积极为我们答疑，前一天的问题，老师可能没时间回答，但是却在凌晨4点微信为我解答!真的是感动死了!第一次遇上这么负责的老师!老师给分也是真的很好，浓浓师生情!超级爱老师，作为一名其他专业的学生，这学期真的学到了很多新知识!谢谢老师!
70604,452,蔡庆兵,2018-01-27 09:34:33,2,3,1,上课认真负责！！！！给分无敌好
70605,452,蔡庆兵,2018-01-27 09:34:48,3,6,3,给分好到哭！！?！！
70609,452,蔡庆兵,2018-01-27 09:41:11,0,3,3,老师真的好任性很负责，真的很佩服。
70620,452,蔡庆兵,2018-01-27 09:51:27,2,4,2,讲的特别好，很乐于解答同学的问题，给分超好！良心老师一生推～
70641,452,蔡庆兵,2018-01-27 10:23:09,6,8,2,蔡老师太棒了非常非常棒  讲课深入浅出听着不累而且挺幽默的  没有什么大作业什么的 只有三次课堂作业都是对最后的考试有帮助的  给分超赞！满绩！
70656,452,蔡庆兵,2018-01-27 10:39:36,4,5,1,良心好老师！
70672,452,蔡庆兵,2018-01-27 10:53:19,7,8,1,经院杠把子老师
70676,452,蔡庆兵,2018-01-27 11:03:18,2,5,3,太棒了太棒了！！！
70719,452,蔡庆兵,2018-01-27 12:31:17,4,5,1,为什么会有蔡老师那么好的老师！！！不仅上课超级棒，答疑超级耐心，平时还自己给同学批作业，期末给大家打气，给分超级赞！！！轻松满绩！！！
70730,452,蔡庆兵,2018-01-27 12:41:21,37,43,6,在浙大的这两年我遇到了很多让我感动的好老师，但我把第一次学习帝评价老师献给蔡庆兵老师.就事论事，蔡老师是我见过的最能站在学生的立场备课和组织讲课逻辑的老师.上课的逻辑线相当连贯（作为一个没有任何经济学基础的工科生听得很享受），能把很复杂的问题深入浅出化难为易，这是蔡老师讲课水平的体现.\n\n蔡老师也是我见过最没有架子，最照顾和尊重学生的老师.发邮件问问题，哪怕是一些事后看起来很傻很没水准的问题，他也会以最快的速度回复你，还会把有质量的问题共享到公邮.课下与他交流问题，哪怕与课程关系不大，他也会以平等的身份认真与你交流.\n\n很感谢我宏经能拿5.0，更感谢我能在浙大遇到蔡老师.
70747,452,蔡庆兵,2018-01-27 13:01:53,3,4,1,舒服，给分赞，人好
70854,452,蔡庆兵,2018-01-27 15:43:31,6,6,0,老师上课超好玩的哈哈，绝不会照本宣科，按自己的风格来，很容易理解。
73661,452,蔡庆兵,2018-02-02 10:35:00,4,4,0,浙大见过最为学生考虑的老师 上课全然不觉时间流逝
73824,452,蔡庆兵,2018-02-03 07:31:07,1,4,3,仔细耐心，给分超棒！
74309,452,蔡庆兵,2018-02-10 10:50:06,8,9,1,记得有一次因为各种调课 宏经停了大约一个月 那以后就没有好好听课了…不过我一般都是用录音大法，最后期末1.7倍速度播放，不要太爽…
74748,452,蔡庆兵,2018-03-05 12:05:29,4,6,2,好老师，讲的很清楚！！
76089,452,蔡庆兵,2018-03-26 12:43:28,5,6,1,超棒超棒，每次上课时间溜的飞快！
77242,452,蔡庆兵,2018-05-04 05:59:42,7,7,0,房地产给分很好
79040,452,蔡庆兵,2018-05-21 10:12:18,19,22,3,晚饭吃外卖的时候看到蔡老师在休息区睡着了...老师辛苦了?
79388,452,蔡庆兵,2018-06-03 03:28:17,2,5,3,良心！！！
80437,452,蔡庆兵,2018-06-26 12:11:06,5,5,0,棒！讲课很仔细，也挺有趣。
81071,452,蔡庆兵,2018-07-12 14:38:35,12,13,1,哇，看到成绩那一刻，我只有一个感觉，我不配，真的谢谢蔡老师这学期的教导。中宏一定好好做人。
83375,452,蔡庆兵,2019-01-15 12:08:12,13,17,4,趁着还没出分来评价，真的很棒的老师啊而且个人觉得给分会很好(毕竟上课也是diss过正太的哈哈哈) 最后期末爆炸了真的不怪老师了，主要后面几节课都没好好听，感觉学的好的同学一定可以做的很好的，老师对不起呜呜呜我明年中宏一定好好学……以及，那个微经97的，您的微经出分可真快呦，我周围的所有上微经的大概3个老师都还没出，这样刷存在感有意思吗？
84321,452,蔡庆兵,2018-07-12 14:37:20,5,6,1,老师爱您不多说了，看到分数真的激动的哭出来。想念您油光发亮的头哈哈哈哈哈哈
84340,452,蔡庆兵,2018-07-12 15:05:32,3,3,0,呜呜呜老师真的好，讲课很好，给分也超好
84345,452,蔡庆兵,2018-07-12 15:20:01,3,5,2,给所有夸蔡老师的都点了赞。\n\n蔡老师讲课好，给分极好!
84367,452,蔡庆兵,2018-07-12 15:55:23,0,3,3,蔡老师讲课真的好认真负责，真的谢谢蔡老师一个学期的指导
84372,452,蔡庆兵,2018-07-12 16:07:24,7,8,1,吹爆老师 这种师生情是真实存在的吗 计算题错了一道 选择好几个乱选的 居然还有4.8 讲课负责老师人也超好
84376,452,蔡庆兵,2018-07-12 16:10:15,1,3,2,超好的老师啊啊啊啊啊。最后一门非专业课真的给我太好的印象
84383,452,蔡庆兵,2018-07-12 16:29:51,2,3,1,良心老师，给分好上课也好
84384,452,蔡庆兵,2018-07-12 16:30:38,3,5,2,怎么会有这么完美的老师！！！
84386,452,蔡庆兵,2018-07-12 16:35:21,5,6,1,老师实在太给力了，可讲的好，给分简直是惊喜！点赞
84387,452,蔡庆兵,2018-07-12 16:39:10,4,5,1,我的天哪老师给分太好了真的从我把挂科深渊救了回来，这一波哇真的！！！感谢老师！！！真的谢谢老师！！！！
84388,452,蔡庆兵,2018-07-12 16:44:52,2,4,2,只要听，。没有听不懂的，只要学，没有学不会的。老师给分不要太好！！！！！！
84402,452,蔡庆兵,2018-07-12 18:49:32,4,6,2,谢谢蔡老师的满绩 还是个99 给分好人更是没的说
84418,452,蔡庆兵,2018-07-12 22:40:56,4,6,2,这次的宏经，选择题是多选，最后一道分析考BP曲线，基本全空，做完感觉很糟糕，以为自己都要挂科了。。考完还给老师发了邮件，结果成绩一出，86。。别问，问就是蔡老师牛逼
84429,452,蔡庆兵,2018-07-12 23:45:40,6,6,0,老师真的超好！！！上课很风趣，并且直抓重点，最重要的是给分太好了吧！！
84739,452,蔡庆兵,2018-07-13 16:43:18,2,6,4,考完试好几选择题都是蒙的，简答题里面的加速数和米德冲突也没很好的想起来，计算题也没啥把握，最后竟然给了92，老师给分太好了！
85055,452,蔡庆兵,2018-07-15 06:55:54,-1,4,5,满分老师，非专业课里第一名
85399,452,蔡庆兵,2018-07-17 11:41:36,3,3,0,蔡老师上课讲的超级清楚，对宏观经济的理解也很深刻，给分也很考虑学生的感受，一生推
89481,452,蔡庆兵,2019-01-25 09:12:04,33,37,4,没有上过蔡老师的课，你对宏经的理解是不够深刻的。
92367,452,蔡庆兵,2019-01-14 16:03:53,18,18,0,今天是老师的最后一节宏经，真的好舍不得老师的课，真的太好了，语言不足以表达的好。问完题之后想要老师在课本第一页签名，但最后还是没好意思开口，回寝的时候看见老师带着小帽子背着书包骑单车离开西区，在心底默默祝福这样的好老师能够每天开心幸福！当您的学生就是幸运和缘分！
92986,452,蔡庆兵,2019-01-06 14:59:59,5,6,1,百年一遇好老师！！！发邮件问问题总是讲解得特别详细！！讲课也讲得很有水平！！\n\n还没考试，先给十分！！！
93839,452,蔡庆兵,2019-01-14 03:32:22,1,2,1,老师太棒啦，很暖心
94456,452,蔡庆兵,2019-01-18 01:52:04,20,21,1,不说了\n\n感谢蔡老师教得这么好甚至还我遇见了喜欢的女孩子\n\n满分！
94789,452,蔡庆兵,2019-01-18 06:57:51,2,3,1,太好了
97071,452,蔡庆兵,2019-01-21 15:43:01,3,3,0,好评，不解释，强烈推荐
97072,452,蔡庆兵,2019-01-21 15:44:20,3,4,1,宏经讲的很有意思，作业就交两次，考试猜重点超准，大赞。
97075,452,蔡庆兵,2019-01-21 15:45:17,0,2,2,蔡老师 我太爱你了!!!啊啊啊啊 超级好
97077,452,蔡庆兵,2019-01-21 15:46:07,4,5,1,老师超级好！一个没有一点基础的辅修的人都听懂了还取得了满意的成绩！
97079,452,蔡庆兵,2019-01-21 15:49:31,-2,1,3,老师讲的超级好!很有条理!超耐性在QQ群里为大家解答问题!来到浙大一来遇到的最好的老师，没有之一!!!强烈推荐
97080,452,蔡庆兵,2019-01-21 15:51:03,0,2,2,呜呜呜我吹爆！必须满分！听的最认真的一个课了老师讲的真的很好 平时作业也很少 以为自己考的不咋的了结果出来老师给分真的巨好啊！！都给我选！！
97083,452,蔡庆兵,2019-01-21 15:54:35,1,2,1,感谢老师，让我爱上经济学
97084,452,蔡庆兵,2019-01-21 15:56:39,5,5,0,老师讲的很好，每次理论课结束会联系实际，学到了很多东西，而且给分很好！又有干货，又有高绩点的老师，哈哈哈哈！
97087,452,蔡庆兵,2019-01-21 15:57:43,2,3,1,怎一个好字了得
97088,452,蔡庆兵,2019-01-21 15:59:48,8,8,0,必须满分，不只因为给分好，更因为老师的专业、耐心和负责！
97090,452,蔡庆兵,2019-01-21 15:59:59,0,2,2,老师上课很投入认真 讲解分析深入浅出 真的很棒
97097,452,蔡庆兵,2019-01-21 16:03:40,4,4,0,老师真的太棒了！
97098,452,蔡庆兵,2019-01-21 16:03:57,2,3,1,非常好
97099,452,蔡庆兵,2019-01-21 16:04:04,3,4,1,一生推，大爱蔡老师。如果不是蔡老师讲的这么好我中途就弃修了，呜呜呜给分感动到爆炸。如果你没选上蔡老师的课，一定要旁听啊！
97102,452,蔡庆兵,2019-01-21 16:05:46,3,5,2,蔡老师是一个认真有趣耐心负责的老师，超爱！味精学得不好，本来不想再学拿宏经当个性了，但是蔡老师让我重新燃起了对经济学的兴趣哈哈～平时作业认真完成，上课好好听，每次课前花一点点时间复习一下，期末考再照着老师给的课件和重点来，成绩不会差的！再吹爆老师简洁的课件和深入浅出的讲解，感恩，笔芯?
97104,452,蔡庆兵,2019-01-21 16:06:26,1,3,2,不说别的，完全享受，经济学基础课程感觉全校所有专业都可以选，当然要认准蔡庆兵老师！
97106,452,蔡庆兵,2019-01-21 16:08:15,1,3,2,太棒啦
97107,452,蔡庆兵,2019-01-21 16:08:32,2,5,3,强推蔡老师！只要认真听真的没有什么听不懂！但是要记得及时把思路记下来。老师人很好也很专业，在群里会认真解答大家的问题，还会心疼同学们复习辛苦提醒同学们考试周早点休息之类的，超级暖！总之强推就是了！
97108,452,蔡庆兵,2019-01-21 16:09:51,4,4,0,课讲得真好
97109,452,蔡庆兵,2019-01-21 16:11:13,1,3,2,蔡老师男神啊！讲课赞，有激情又有深度，作业落实到位，给分好，嗯，毫无缺点。
97112,452,蔡庆兵,2019-01-21 16:12:53,1,3,2,100%好老师！宏经完全能听懂跟下来，然而练习全靠自觉，对不起老师
97135,452,蔡庆兵,2019-01-21 17:26:24,3,4,1,呜呜呜呜太好了真的太好了 讲得太好了 给分也太好了 老师我爱你！
97170,452,蔡庆兵,2019-01-21 23:31:58,2,3,1,老师上课讲课真的非常清楚，作业不多，给分超好！！！
