评论id,老师id,老师姓名,发表时间,点赞减去点踩数量,点赞量,点踩量,内容
14581,1276,俞欢军,2016-01-08 01:11:13,0,11,11,真不知道在讲什么
14630,1276,俞欢军,2018-01-20 15:45:36,-10,15,25,不好好管实验仪器，来教c语言祸害一方。另外，这老师c语言是自学的。
23264,1276,俞欢军,2016-03-23 06:24:11,30,44,14,挺关心学生的。老师人也挺好
23454,1276,俞欢军,2016-06-18 13:59:50,25,34,9,胖胖的大叔，我喜欢。人很好，备课很用心，看不懂前面两条差评怎么来的
26401,1276,俞欢军,2016-06-18 01:40:08,1,5,4,人真的挺好的，很关心学生
27001,1276,俞欢军,2016-06-22 06:33:00,8,12,4,水平有限\n\n
30576,1276,俞欢军,2016-07-02 03:59:15,10,31,21,讲几句公道话吧！这个老师c语言水平的确一般，讲习题的时候，有的时候自己都不确定。但态度很好，很关心学生其实我觉得可以选这个老师去听别老师的课，竞争没有那么激烈
38438,1276,俞欢军,2016-12-26 14:36:35,-18,7,25,老师没耐心，在群里问问题答着答着还生气
39653,1276,俞欢军,2016-12-26 14:35:04,8,12,4,老师人很好
44984,1276,俞欢军,2017-01-18 17:25:59,-10,3,13,一般般，上课挺水的，给分不怎么样。
45059,1276,俞欢军,2017-01-19 02:01:39,5,8,3,老师挺好的，人品特别好，讲课略水，不过大家讲课不都是很水吗？俞老师基本没有什么作业，考前还认真帮大家解答问题，浓浓师生情\n\n
47734,1276,俞欢军,2017-02-22 08:15:27,0,7,7,人好  给分不错
48876,1276,俞欢军,2017-03-15 09:02:39,0,6,6,真的好老师
49543,1276,俞欢军,2017-04-18 06:29:16,-8,6,14,简直是要死，为什么会有这样的老师，学校真的是缺老师了吗
51184,1276,俞欢军,2017-05-23 07:21:47,-15,6,21,你知道什么叫?️?嘛？来听他的c语言吧
51497,1276,俞欢军,2017-06-06 13:41:45,-11,2,13,真的菜
52076,1276,俞欢军,2017-06-14 12:29:24,16,23,7,人特别好，在qq上答疑特别耐心，最重要的是，他每次布置的上机作业都只有三四道题！！！每次我室友都面对自己的十来道题瑟瑟发抖我都想仰天大笑哈哈哈哈哈哈！而且除了上机就没有别的作业了哈哈哈哈哈哈室友都在苦逼的写课后习题哈哈哈哈哈哈
52442,1276,俞欢军,2017-06-20 05:54:00,2,4,2,很关心学生
55359,1276,俞欢军,2017-07-01 10:46:41,0,5,5,很好的老师，赞?
56747,1276,俞欢军,2017-07-04 13:42:16,18,27,9,据说会私戳挂科的同学\n\n还会说是自己辜负同学的信任 \n\n瞬间被圈粉。。。\n\n老师c语言确实不太熟练吧\n\n我觉得很正常啊\n\n然而很耐心啊 问问题有问必答 好老师
57419,1276,俞欢军,2017-07-07 12:47:24,23,27,4,人很好，不知道评分怎么只有这么点。比那些评分高而徒有虚名的老师好太多了
57487,1276,俞欢军,2017-07-08 16:36:53,5,6,1,老师真的对学生很负责，很负责。绝对是个好老师，老师可能水平上限不是很高，但是教c完全足够了。
59078,1276,俞欢军,2017-09-19 10:48:25,0,2,2,好老师，会给你耐心讲题目
59369,1276,俞欢军,2017-09-21 05:01:28,0,4,4,虽然还是挂了 补考也没过
61030,1276,俞欢军,2017-11-07 07:02:17,3,4,1,有点水，不错了，当休息\n\n\n\n
65343,1276,俞欢军,2018-01-03 07:07:23,11,13,2,很关心学生的老师，不会让学生做那些形式上的作业，无用功少，超棒的老师，强烈安利！！
67302,1276,俞欢军,2018-01-20 15:47:01,2,4,2,很负责任的老师，对学生真的很好，虽然讲课的水平可能不是特别高，应付考试还是足足够的
73228,1276,俞欢军,2018-02-01 08:07:00,0,3,3,虽然上课水了一点（大计基这门课一般都这样），但给分还是不错的，自己看看书就行了，老师还会给课后和模拟卷答案，很好的。
73420,1276,俞欢军,2018-02-01 14:18:35,1,2,1,老师上课挺水的，作业很少，不用花太多的时间，考试前做一下模拟卷，看一遍书就好了，老师给分很好很好(✪▽✪)，谢谢老师o(^o^)o
74469,1276,俞欢军,2018-02-27 00:59:47,6,8,2,老师人不错，上他的课很轻松。但是一昧的轻松学不到东西。而且老师水平也有限吧。
74622,1276,俞欢军,2018-03-05 01:19:36,5,15,10,上课频频出现各种技术错误？连语句都没记住，怎么教学生？很多东西他都不太会，上课非常的累，认真听却听不到什么好的。C语言选他有点失望
80035,1276,俞欢军,2018-06-19 06:22:14,6,13,7,我的天哪他大概是不会讲课吧，听他讲课太累了，balabala说一大堆没用的，一直在用力解释没用的东西，丝毫没有逻辑，还热衷于补课……老师您补课的时候先想想自己会不会讲课好吗……我去了我第一次见这种上课自己在上面写一堆奇奇怪怪的程序然后解释为什么出错的老师？
81844,1276,俞欢军,2018-07-06 09:52:30,1,3,2,来自一个大二重修狗——在老师班上重修（重修终于过了qaq）。虽然老师的能力在很多同学看来是有限的，但是作为c程的基础教学还是足够的。\n\n老师在群里和大家互动挺多，同学们的提出的很多问题老师都能够解答，而且老师很负责任很细心，不失为一个好老师！
81939,1276,俞欢军,2018-07-06 14:03:10,0,1,1,很轻松，老师很关心学生
82068,1276,俞欢军,2018-07-13 13:07:55,0,3,3,虽然被卡绩，到上四了！真的谢谢老师！这也太好了吧！一直以为自己会下八十！
84482,1276,俞欢军,2018-07-13 03:07:10,0,1,1,出分呀
84649,1276,俞欢军,2018-07-13 12:25:24,1,2,1,虽然老师c程序的能力不是特别专业，但老师会和学生一起互动一起讨论，我觉得老师特别关心学生特别亲切。另外老师会调分，拯救了我的绩点！
84653,1276,俞欢军,2018-07-13 12:30:11,0,1,1,给分真的mua了，总之谢谢老师
84654,1276,俞欢军,2018-07-13 12:33:05,0,2,2,世界上怎么会有这么好的老师!原本以为挂科的，结果还有3多，世界上怎么会有这么好的老师!
84661,1276,俞欢军,2018-07-13 12:49:24,0,0,0,不得不说给分真是好……虽然学习(自学)过程贼痛苦…
84666,1276,俞欢军,2018-07-13 12:56:19,0,1,1,老师很负责
84672,1276,俞欢军,2018-07-13 13:07:38,0,1,1,很负责的老师，给分很棒
84800,1276,俞欢军,2018-07-14 01:57:26,4,7,3,感天动地好老师！上课如果要点名都会提前在QQ群发公告说“明天上课点名学号xxx”，第一次课上直接跟我们说，如果同一时间有更好的老师在上C，他允许我们去别的老师那听；QQ群答疑可以做到秒回，有问必答，有共性的问题也会发公告提醒大家；虽然有时候确实讲得不太清楚，但他自己都会意识到，一遍遍反复解释超耐心；作业贼少，别人都是PTA上的题目全做，我们班是挑几题来做；要是作业一不小心过了截止时间，期末还可以以复习为借口让他再放出来，悄悄补上嘻嘻嘻；老师人特别可爱，有些时候会突然幽默一把，看得出来平时是非常有趣和我们很有共同语言的老师；期末调分了！我看自己理论成绩55都没到，以为要挂科，结果居然3.6！！（我猜是因为实验满分，加上平时所有作业，包括他没有布置的，只要PTA上有，我全给做了，所以分调高了很多吧）感动得泪流满面！QQ群里都在跪谢老师。。。（第一次来查老师评价，因为老师人实在太好了呜呜）
87525,1276,俞欢军,2018-10-01 10:31:35,1,2,1,嘤嘤嘤
89221,1276,俞欢军,2018-11-17 04:02:35,7,11,4,真的全凭自学，上课不知道他在讲什么
92671,1276,俞欢军,2019-01-03 12:42:13,3,5,2,要死了，真的不是大佬的话别选
99834,1276,俞欢军,2019-01-25 08:12:10,9,11,2,水平有限是真的，人还蛮好的，经常在群里或者上机时现场会指导问题，嗯(ಥ_ಥ)助教是什么?我们没有助教。作业一般很水，最后几星期都没有作业了，但是如果自己不找题做会很生疏的，期末考试基本全靠自学。自己就是偷懒没有找题练习快挂了，明年重修做人。
100608,1276,俞欢军,2019-01-26 11:37:41,1,4,3,10分好评 在这里发自内心的感谢这位和蔼的老师 真的很关心学生 学生有什么问题困难都可以找他 老师都会很耐心的解答 在我期末考试后感觉自己有可能挂科时 老师仔细的询问我情况 并关心我 真的是一个良心好老师?
100947,1276,俞欢军,2019-01-27 07:35:47,0,5,5,吹爆，老师人超好。胖胖的大叔很耐心，感觉特别有爱。没上过其他老师的课不知道水平相比怎么样，但俞老师真的超负责，周一的课周日会发完整的课件，超级认真准备的那种，对我这种菜鸡很友好，感觉在老师的课上收获很多。出成绩后，大家在群里刷感谢，老师突然来了句:感谢同学，同学自习辛苦了。哈哈哈，超级妙，评分为什么不是9.9呢?
100954,1276,俞欢军,2019-03-01 06:05:51,-1,3,4,老师人挺好的，平时分都给满了……部分被卡绩的同学（比如卡4.2）可能是因为按照正常平时分给是3.9，给满了也没能上4.5的情况啦。老师确实水平有限，但是老师人超棒的！谢谢同学们自习辛苦了也超可爱的哈哈哈
103562,1276,俞欢军,2019-03-01 06:03:43,-2,5,7,说真的，\n\n如果对C没有基础不要选，\n\n真的，\n\n第一节课就扯那么远，完全不按课本讲\n\n上课前面dl还呼应，\n\n抢个前排看旁边的人都ssfd。\n\n别选，这个老师是c中挂科率最高的
103927,1276,俞欢军,2019-03-07 09:19:54,1,3,2,我想告诉各位，c程想学好自己靠自己去摸索，我从连编译器都不知道的小白，到4.2的绩点，我付出了很多
106728,1276,俞欢军,2019-04-29 06:22:56,1,3,2,宽松，做题靠自己吧。但是老师真实BUG调试员? ，经常讲编写不规范的后果。
109475,1276,俞欢军,2019-06-15 14:04:15,10,10,0,老师是真的好老师，不过确实讲得不太好……建议大家平时多写写代码（不是多看看书，是多写写代码）\n\n但是能保证平时分给得足够高了。分享一个小事：在2018秋冬学期后期，有一个叫“夜月明”（后来发现不是我们班的）的在群里搞事说要公布一下平时分，老师把他移除群之后，跟大家说平时分公布了就不能再调高了，不能和大家说，这样大家就不会被卡绩了……\n\n总之老师真的很可爱！
112786,1276,俞欢军,2019-07-05 03:10:30,1,1,0,求求老师给过呜呜呜
112984,1276,俞欢军,2019-07-05 17:15:24,14,18,4,老师上课水平有限，而且某几次作业量巨多无比，但是熬过来以后结果总是好的！C程真的靠自己！外加群里有dl全程答疑带飞全场?
113029,1276,俞欢军,2019-07-05 18:05:03,3,3,0,老师很和蔼，上课到重点会提醒你听他讲提醒你看ppt，老师讲的内容的话，我感觉对我来讲是一些比较零碎的知识点，如果跟好老师的脚步还是能收获些东西的，不过c程是真的在自己的学习的，而且老师答疑很迅速很和蔼很耐心，不知道是不是助教？同学，答疑也很耐心很负责任！最后老师给分超级好呀！！
113038,1276,俞欢军,2019-07-05 19:17:07,7,7,0,呜呜呜，我以为自己理论考炸惨，上机做对一道题必挂了，我都准备好去补考了。。。结果老师拯救了我，居然还有68，天哪，我惭愧，以前老是说老师讲的不好，，Ծ^Ծ，，我真的错了? ，凭他最后让我不挂我都要给10分，跪谢老师不挂之恩(≧∇≦)真的感谢
113094,1276,俞欢军,2019-07-05 23:16:45,0,1,1,被老师捞起来了。。。
113128,1276,俞欢军,2019-07-06 00:02:05,0,0,0,谢谢老师捞理论考炸的我...
113179,1276,俞欢军,2019-07-06 01:12:28,0,0,0,感谢老师
113299,1276,俞欢军,2019-07-06 04:51:56,0,1,1,本来以为要挂定了，结果被捞上岸惹555浓浓师生情\n\nps.大学学习还是得靠自己，自己不学，谁也救不了你
121700,1276,俞欢军,2020-01-21 02:23:25,12,12,0,俞老师是真滴好，上课点名提前在群里通知，绝不会故意查人，作业贼少，但是做做应付期末考试还是足够。（但是水平限制，可能对以后需要修c大程的同学不利）\n\n总之，俞老师极大地锻炼了同学们的自学能力（手动🐶）。
124020,1276,俞欢军,2020-06-20 15:02:57,3,10,7,选你选了个寂寞？？？？wjj讲课你干啥？体验极差
125655,1276,俞欢军,2020-09-12 14:56:53,2,6,4,为什么不自己上课！！！！！！！！！！！！！！！！！！！！！！！！！！！！！！！！！！！！！！！！！！！！！！！！！！！！！！！！！！！！！！！！！！！！！！！！！！！！！！！！！！！！！！！！！！！！！！！！！！！！！！！！！！！！！！！！！！！！！！！！！！！！！！！！！！！！！！！！！！！！！！！！！！！！！！！！！！！！！！！！！！！！
126049,1276,俞欢军,2020-09-17 02:56:44,7,7,0,打分极极极好
126050,1276,俞欢军,2020-09-17 03:10:23,5,5,0,老师人巨好，大作做的可以但是理论裂开，多亏老师捞，10分奉上
126051,1276,俞欢军,2020-09-17 03:14:00,7,7,0,室友被捞起来了，真不错，他可以继续做他的苏联坦克爹
126075,1276,俞欢军,2020-09-17 06:06:16,5,5,0,9月17日，大雨，心情晴，谢谢老师海底捞！
126469,1276,俞欢军,2020-09-28 01:46:44,2,3,1,可爱的老师
132047,1276,俞欢军,2021-01-30 04:15:04,11,11,0,2020秋冬，C小程\n\n期末理论炸了，本来对绩点不抱啥希望了，结果没想到，被老师捞起来了(我猜，老师平时分给的相当好)，最后绩点还挺好。真心感谢老师~
139041,1276,俞欢军,2021-07-12 08:53:49,5,5,0,老师永远的神 真海底捞 我爱他！
139043,1276,俞欢军,2021-07-12 08:54:06,3,3,0,真的海底捞，老师非常好。究极善良以为要挂了还能上三。
139249,1276,俞欢军,2021-07-13 18:35:06,1,2,1,海底捞呜呜呜
145453,1276,俞欢军,2021-12-29 23:52:34,4,4,0,最让我感动的是期末考前老师关心我们的举动。虽然还不知道绩点怎样，但我先打满分了。
146070,1276,俞欢军,2022-01-05 10:54:08,8,9,1,现在回想起来，发现俞老师是真的很关心学生。（虽然他课讲得不是很清楚，但是俞老师还是很努力给我们讲课的），平时问问题基本都是秒回的。C程考完，看着俞老师的笑脸，我不禁有些后悔这么好的老师，以前为什么没有好好听他的课。能选上俞老师的C程课是我的荣幸。还有，助教小姐姐yyds。
148849,1276,俞欢军,2022-01-13 17:29:25,5,5,0,我只能给满分了 俞老师实在太好，像一位慈父一般关怀着我们
149329,1276,俞欢军,2022-01-15 05:53:52,4,4,0,俞老师超级好！\n\n我补选申请了免听通过以后，问问题老师经常非常耐心的回答，而且还给了我很多学业上的帮助！
159831,1276,俞欢军,2022-09-05 05:15:14,1,1,0,好老师，非常推荐
160385,1276,俞欢军,2022-09-21 03:45:06,3,3,0,不要问我可以不可以，你想不来就可以不来！爱了
163214,1276,俞欢军,2022-12-10 03:20:58,5,5,0,讲课不说很好但绝对不烂。人挺和善的，可以正视不同水平学生的需求，允许你不来上课。每次上课如果点名会提前告知。爱死了！10分
165812,1276,俞欢军,2023-01-10 01:05:38,4,4,0,很棒的老师哦
165841,1276,俞欢军,2023-01-10 05:23:58,4,4,0,超级超级棒的大叔！
165895,1276,俞欢军,2023-01-10 08:52:10,4,4,0,俞老师人真的超级好，点名会提前通知。虽然上课有时候会讲错，但是还是有许许多多重要有趣的知识。考试前还会在群里发一些坑点，真的超级好。点名也会提前通知。
165917,1276,俞欢军,2023-01-10 10:55:57,4,6,2,老师真的非常好！记得老师开学时说过如果你们考的不好，我也没面子之类的话。\n\n没听过其他老师的课，正如前面评论所说，老师的课就算不能算是顶尖水平，也绝对一点都不能说是差，认真听课消化完全足够，且讲的详细适合零基础的同学。\n\n今年期末考试理论比较难且实验第二题坑人，本以为要很低的绩点，结果却收获了比预期高了2-3档的绩点！另外金助教也很负责，问他问题都会及时回复。\n\n感谢俞老师和助教的辛苦付出！
166261,1276,俞欢军,2023-01-11 15:00:09,14,14,0,虽然偶尔会讲错，但是很快也反应过来了，我觉得这是自己打代码教学无可避免的错误。c程还是要选一个代码教学而不是ppt的老师，然后我看到很多人说老师c水平不高，老师钉钉上部门显示是采购中心的，c程是他自学的，但是俞老师职称是教授，自学能力没得说，这学期亲身感受，他的能力很强，和几年前评论得不太一样，时间过去了那么久，老师水平已经有长足进步。老师看起来是一个可爱的大叔，但是我看到了他内在的幽默，特别是他发的群消息（非通知），每一句都很值得回味。比如有次作业开了两回，有同学问我两次都做了，哪次算平时分呢？他回：较差的那次。然后发一条消息：不算，算较好的那次。类似这种，我觉得好好笑。老师期末的时候会把作业的题目和答案都在群里发出来，特别便于自学，真的，我觉得光这个就是必选不可的理由，我们这学期碰上疫情，转运，隔离，封寝，俞老师会问：大家都还好吧？太温暖了，哭！俞老师期末也会捞的，uu们过斩杀线了就不用太担心成绩。谢谢俞老师一学期的教诲，浓浓师生情！
166625,1276,俞欢军,2023-01-13 04:51:29,4,4,0,人好事少，期末会捞
167629,1276,俞欢军,2023-01-18 00:45:45,1,1,0,好老师，真的在为学生的绩点着想
170441,1276,俞欢军,2023-03-05 03:18:15,3,3,0,如果自己有基础，不听课也能自己学好的可以放心选老师的课。老师在成绩方面是非常好的，小测基本都是程序题，只要自己会了平时基本可以不准备。期末的时候平时分也会尽量给满。但是老师自身的水平可能不是很高，如果自己不擅长程序的话要慎重。
170861,1276,俞欢军,2023-03-10 15:13:09,3,3,0,人好事少，海底捞，点名提前通知
180977,1276,俞欢军,2023-09-30 10:31:52,15,15,0,对学生很负责，会私戳挂科的同学，会帮助差生。但是最大的问题就是水平不足，稍微有一点难度的问题就回答不上来，比如说scanf中出现一个空格有什么特殊含义（正确答案：一个空格即可表示若干个“ ”、“\n”或者“\t”。然而老师却说，出现几个空格就是几个空格的意思……），甚至第一节课配置IDE环境配置了大半节课都配置不明白。总而言之，师德高尚，能力不足。
184616,1276,俞欢军,2023-12-22 03:15:03,0,0,0,比较水
185504,1276,俞欢军,2024-01-02 06:38:08,5,5,0,讲课水平比较差，但允许你上课不来，点名提前通知（不过以后可能要点一半次数以上的名），作业也不多，小测蛮水的，建议听翁恺的mooc即可，考前复习课重点梳理的不错
185550,1276,俞欢军,2024-01-02 06:25:27,2,4,2,老师好老师好老师特别特别好都来选老师的课别逼我求你们！！！老师平时分狂捞！！我来给老师刷十分谢谢老师！本学期结束还看不到老师评分升高我会伤心的ok？
185551,1276,俞欢军,2024-01-02 06:21:09,4,4,0,老师人真的很好，还特地说“考得好，平时分就该给高点，考得不好，平时分就该捞捞，所以，大家不要担心平时分，都很高。”老师也不怎么点名，但是他说以后要督促同学多点名了，但也没什么坏处，毕竟是为大家学习着想。好评捏！
185563,1276,俞欢军,2024-01-02 07:32:38,1,1,0,人超好！
187615,1276,俞欢军,2024-01-17 00:22:08,2,2,0,老师nb！爱死俞老师了！给分特别特别好！平时课堂十分自由快乐！课下找老师答疑聊天也很热情！谢谢老师！
187938,1276,俞欢军,2024-01-18 00:31:43,3,3,0,答疑很及时，给分很捞！
188052,1276,俞欢军,2024-01-18 06:04:06,0,0,0,给分很好，点名会提前通知。上课水平很一般，但是冲这个给分就给10分啦！
188267,1276,俞欢军,2024-01-18 13:55:33,2,2,0,俞老师人很好，很尊重关心学生，平和的中年大叔形象完全没有架子非常和善。每次点名都会在群里提前通知，充分尊重大家的自主性。备考那几天，老师回信息非常及时，很负责任。我虽然一般不去线下听老师的课，都在智云上看倍速回放，但老师讲得挺好的。很喜欢这样善良朴实的老师
135449,5396,冯建跃,2021-05-11 00:58:57,0,0,0,给分真的好！
171919,5396,冯建跃,2023-04-12 12:47:12,0,0,0,德高望重，亲和，大家风范！
196062,8319,张银珠,2024-07-01 10:45:55,0,0,0,实验室安全与防护烂烂烂
