164043,2627,杨明英,2022-12-17 11:56:31,-12,1,13,【丝绸的过去、现在及未来】真的很好！\n\n从来没听过\n\n去了一次博物馆一次实验室（学缫丝）\n\n助教姐姐超好超温柔\n\n从来不点名\n\n是组长\n\n一个pre一次辩论期末开卷\n\npre很水，辩论没上场就帮忙查了点资料，开卷考发的资料很多但是基本没用，就打印上课ppt就可以了，大家基本都不大会的没关系\n\n最后4.5，还交到了好朋友\n\n吹爆！！！
164661,2627,杨明英,2022-12-22 16:25:47,3,5,2,什么都认真搞了，结果被绩杀。。。。无语
180451,2627,杨明英,2023-09-21 16:11:49,1,3,2,丝绸过去。老师很和蔼，科研能力感觉很强。上的是水课，所以不清楚讲课能力。给分还不错，只要积极参加辩论、论文，事不多，在通识课中比较值得选。）助教姐姐很温柔，很负责。当然，分组很重要🐶别太认真投入，不需要。
182936,2627,杨明英,2023-11-21 07:09:15,2,2,0,上课比较水，建议多发言，有做实验，有辩论赛，有组织去博物馆，还挺有意思的，就是要多刷网课，多评论，最后期末考可以准备纸质材料，但基本上没用，大家都是一条起跑线，最后就是助教jj又好看又温柔，蛮建议选的
183051,2627,杨明英,2023-11-22 02:27:15,0,2,2,助教姐姐人美心善，给分友好\n\n和往年风评大不相同\n\n参观博物馆，辩论赛......类似于这种小活动如果比较喜欢的话可以去上这门课\n\n唯一比较烦的是挂网课\n\n偶尔举手发一两次言，答非所问都行，可以适当加分\n\n最后绩点4.5，还行吧，就是事有点小多
184226,2627,杨明英,2023-12-13 11:22:19,1,1,0,老师几乎全程不在场，事情有点多，有花活才能得高分，最后3.9
202597,2627,杨明英,2024-11-13 09:23:00,0,0,0,给分超棒的，还可以去丝绸博物馆，考试前还会发大纲，老师人也好，还有实验课，超棒的
203314,2627,杨明英,2024-11-19 05:46:53,0,0,0,别读研
204535,2627,杨明英,2024-11-26 12:57:02,1,1,0,这学期八节课，杨明英上了两节（？），其余大部分情况都是助教上或者小组展示。小组展示+两千余字论文+智慧树+期末闭卷考，上课确实水，课下哭成鬼。给分似乎就是3.9和4.2两档，就没想过这样真的挺不公平的吗？！不推荐，选上了尽早退吧，不然被绩杀的时候你会后悔的。
207050,2627,杨明英,2024-12-19 05:33:20,0,0,0,课很水 事有点多 但是最后给分还不错
207299,2627,杨明英,2024-12-20 08:21:40,0,0,0,课水，好玩，事略多，分高，推荐
25460,2683,王佳堃,2016-05-20 08:43:31,1,1,0,毫无防备被秀一脸恩爱的感受谁懂23333 总的来说很和蔼很负责的老师。
104427,2683,王佳堃,2019-03-20 05:45:52,1,1,0,很不错
132191,2683,王佳堃,2021-01-31 01:48:44,4,5,1,老师对自己的出卷水平和客观改卷能力十分自信，30＊3（90）分的论述题，大概好好感受一下。\n\n还有希望老师能注意一下考试和小组讨论（在辩论时）打断我们和我们磕唠这一习惯\n\n给分的话，大家做好心理准备别抱太多期望就是了‹(⁼̴̀д⁼̴́)›
217787,2683,王佳堃,2025-04-16 12:34:48,0,0,0,畜牧学：\n\n关于点到：王老师上课会有数字签到放在第一节课开头，早八起晚而迟到的同学可以课下直接找老师补签不会有额外影响\n\n关于考试：名解+判断+简答+论述，分值合理很多，没有上面2016那条评论夸张。\n\n关于自主实验：大家的小组自主实验题目在开题答辩阶段要好好准备，听王/洪两位老师的意思，每年都会有一两组不达标毙掉了（我们今年有两组，但是都在展示后做了一些修改，最后还是能过的，但是台上会很尴尬）\n\n营养学：\n\n关于考试：简答题现在是20分名词解释（英文，但是是10vs10连线），10个判断题（4英6中）20分，3个20分的简答题。简答题也有点抽象。\n\n\n\n比较难绷的是，这两门考试大题的复习效果很低，押题押了很多，根据历年卷做了很详细的答题模板，结果根本没用上是我没想到的。好在准备答题模板的过程也是我复习的一部分，靠着些微记忆的延伸也能完成考试……如果学弟学妹们期末考试时间安排非常紧张，王老师的这两门课要优先解决客观题的名词解释，然后再想办法归纳一些大题。王老师和其他几位老师简答题的创意还是蛮新的……
60200,2710,牛冬,2017-10-12 16:22:47,0,0,0,哈哈哈哈哈哈哈哈哈哈哈
94915,2710,牛冬,2019-01-18 12:48:42,0,0,0,必须满分，又生动形象听了故事，还真正学到了东西，画重点，给分好。老师太好了！
66109,2737,刘红云,2018-01-12 00:19:05,3,3,0,巨坑的老师
103014,2737,刘红云,2019-02-25 11:23:01,-5,0,5,老师很亲和，很棒，为学生着想。
134290,2737,刘红云,2021-03-23 02:20:31,3,3,0,此老师上课非常傅衍，上课接电话，非常不敬业。哎，希望学校整顿一下教师队伍。
183196,2737,刘红云,2023-11-22 15:11:00,8,8,0,顶级老师，谁选谁知道
183227,2737,刘红云,2023-11-23 03:09:32,6,6,0,很好的老师，奖励你3的绩点
204789,2737,刘红云,2024-11-28 02:15:20,4,4,0,草食大三千万别选，答得很全，3的绩点很甜
111646,2856,刘广绪,2019-07-02 10:08:42,4,4,0,幽默风趣，不犯困
152705,2856,刘广绪,2022-04-18 14:14:54,3,3,0,外专业上的贝类学。老刘上课很有意思，干货满满，能学到不少知识！强烈推荐！
172134,2856,刘广绪,2023-04-20 07:42:39,1,1,0,非常好的一位老师～
172135,2856,刘广绪,2023-04-20 07:43:34,1,1,0,老师人超好！！！
172490,2856,刘广绪,2023-04-27 23:55:51,2,2,0,外专业学生选的刘老师的贝类学\n\n老师讲的真的特别好，幽默风趣，而且课程内容也很有意思，认真学给分很不错！
172756,2856,刘广绪,2023-05-06 07:00:28,5,5,0,老师很有趣，上课内容也很有趣。虽然平时没听，但是期末背的真的很认真，写试卷感觉大部分也都是会的，最后只有3.9，很伤心，还是背的不够熟。选课的uu一定要记得多留几天时间背书，老师ppt最后会发，内容也很全。老师真的很好只是绩点让我很伤心
191823,2856,刘广绪,2024-05-01 00:36:14,2,2,0,超级有意思的老师!!!而且老师本人学识渊博，阅历丰富，认真学，给分也不错!外专业人觉得闭卷考还是稍有挑战的，两次小测也有点完全不会，最后还有4.5真的很惊人
1531,2986,李剑,2015-03-22 11:10:03,30,40,10,年轻的男神♂
1747,2986,李剑,2015-03-24 03:39:55,2,8,6,绝对男神！很亲切！给分很好！上课有趣！
3928,2986,李剑,2015-06-17 10:13:31,0,5,5,长的帅～讲的好～～
4233,2986,李剑,2015-06-18 08:29:22,15,19,4,超赞，很靠谱的专业课。！！！
4832,2986,李剑,2015-06-29 09:40:41,12,18,6,必须满分的对不对！可能长得好也是重要因素，上课特开心
5524,2986,李剑,2015-07-08 04:55:40,2,8,6,很棒 很用心的老师 给分也很好
7407,2986,李剑,2017-06-28 09:01:59,-63,6,69,不咋地
10945,2986,李剑,2015-11-23 11:52:51,0,3,3,男神～给分也好～对学生很好～
12431,2986,李剑,2015-12-23 09:12:12,0,4,4,不仅人帅，而且讲得很棒，必须满分啊！！！
12482,2986,李剑,2015-12-23 11:22:29,0,4,4,就是帅
12736,2986,李剑,2015-12-24 02:51:04,4,7,3,每一节课都是满满的专业知识
13338,2986,李剑,2015-12-27 03:31:49,0,4,4,听三节课，根本不会困
14762,2986,李剑,2016-01-08 17:12:58,2,6,4,非常棒\n\n
26936,2986,李剑,2016-06-21 17:09:22,0,2,2,男神~
39501,2986,李剑,2016-12-23 08:48:55,0,2,2,送男神上9
40243,2986,李剑,2016-12-30 13:32:42,0,2,2,男神，幽默
40276,2986,李剑,2016-12-31 13:01:59,0,1,1,老师帅！上课有趣！送他上10！
40277,2986,李剑,2016-12-31 13:03:03,0,1,1,男神男神！！！！！！不多说！！！！！超可爱www！！！老师新年快乐！！！！！好哈哈哈哈哈哈！！！！！！
40279,2986,李剑,2016-12-31 13:09:03,0,4,4,男神！！！幽默风趣讲课超棒！理论课连上三节完全不困！干货满满！上大学以来听得听的最认真课！理所当然的给男神满分！！！！！！
40933,2986,李剑,2017-01-06 14:00:15,0,1,1,老师超幽默，实验课时超耐心，男神
41282,2986,李剑,2017-01-10 11:44:11,0,1,1,讲课超好～真·男神
41375,2986,李剑,2017-01-11 06:37:29,0,1,1,超级赞，人帅啊！
42282,2986,李剑,2017-01-14 03:26:43,0,0,0,讲得很好
42304,2986,李剑,2017-01-14 03:52:09,0,0,0,男神！
42316,2986,李剑,2017-01-14 04:19:24,10,12,2,我不管男神！男神！男神！不接受反驳！绝对是史上最帅最温柔最有趣最可爱的男神老师！笔芯??
42351,2986,李剑,2017-01-14 05:10:32,2,3,1,老师很耐心，男神，给分也好
42480,2986,李剑,2017-01-14 09:24:02,0,1,1,喜欢老师！\n\n
42484,2986,李剑,2017-01-14 09:26:49,0,1,1,很棒的课！
42485,2986,李剑,2017-01-14 09:26:50,0,0,0,男神哈哈哈哈哈哈哈
42487,2986,李剑,2017-01-14 09:27:28,0,0,0,老师超好人格魅力很强，很为学生着想，让人发自心底地愿意听课。
42512,2986,李剑,2017-01-14 10:07:43,1,2,1,理论课听起来有点吃力但是实验课能学到超级多啊哈哈哈哈哈老师也超级可爱 前排表白男神\n\n
42746,2986,李剑,2017-01-15 04:32:18,0,2,2,超帅超专业超体贴，完全为了学生着想的男神老师。
42911,2986,李剑,2017-01-15 11:59:54,0,2,2,剑哥男神，超有魅力，给分超好，上大学以来学的最认真的一门课，平安夜和跨年夜一起解剖，满满的回忆，学到很多干货
42970,2986,李剑,2017-01-15 14:09:36,0,2,2,老师真的超级好啊！！！年轻风趣！讲得很棒ppt做的也好！！！问题也会很快回答和同学互动也超多超棒！啊剑哥我男神！送剑哥上10！
43706,2986,李剑,2017-01-17 00:17:01,0,1,1,剑哥真的很好
43816,2986,李剑,2017-01-17 04:00:26,0,1,1,助剑哥上10
44287,2986,李剑,2017-01-17 14:17:03,0,1,1,不会犯困，亲切可人
44765,2986,李剑,2017-01-18 08:16:38,0,1,1,男神啦，很有收获
50773,2986,李剑,2017-05-05 06:19:53,0,1,1,男神！
61943,2986,李剑,2017-11-22 01:48:06,0,1,1,老师男神
63652,2986,李剑,2017-12-11 15:05:43,0,1,1,找不到不给10的理由
64627,2986,李剑,2017-12-25 15:53:42,0,3,3,非常非常好，得知老师已经结婚，可以说是非常心碎了
64886,2986,李剑,2017-12-27 15:45:32,2,3,1,不可能！！李剑男神的评分不可能只有9.7！！起码9.9起步的呀！！！刷上去呀同志们！！！
65921,2986,李剑,2018-01-10 08:33:10,0,1,1,想打一百分！
66174,2986,李剑,2018-01-12 11:30:56,0,2,2,我永远喜欢李剑老师
66587,2986,李剑,2018-01-17 11:52:26,3,5,2,棒呆了
66649,2986,李剑,2018-01-18 03:07:35,4,6,2,满分，舍不得……
68840,2986,李剑,2018-01-24 03:20:00,2,3,1,老师上课特别有趣，课堂氛围很好，老师人也很好，积极解答问题，给分也好。给老师满分！
68868,2986,李剑,2018-01-24 04:05:51,0,1,1,超赞的老师！温柔帅气，给分好！
69078,2986,李剑,2018-01-24 08:03:47,0,1,1,很好的老师
72536,2986,李剑,2018-01-30 10:26:30,0,6,6,剑哥很棒！但是外专业甚选哦。。事情挺多的
89444,2986,李剑,2018-11-19 07:18:56,1,2,1,有趣极了
90166,2986,李剑,2018-11-22 09:52:58,0,2,2,男神男神
93034,2986,李剑,2019-01-07 05:13:23,1,3,2,有口才，有知识！
93038,2986,李剑,2019-01-07 05:39:22,0,2,2,老师很棒，是我太菜了！
93582,2986,李剑,2019-01-10 14:23:03,0,2,2,剑哥真是足够用心了
93978,2986,李剑,2019-01-14 14:18:22,1,2,1,剑哥男神啊！！！！
94482,2986,李剑,2019-01-17 00:45:39,0,2,2,李剑老师的课满满的干货，上完解剖学就可以成为专家了哈哈哈
95711,2986,李剑,2019-01-20 02:27:38,4,5,1,温柔风趣 耐心尽责 \n\n超级棒的老师！
97021,2986,李剑,2019-01-21 14:48:58,8,10,2,老师很棒！是我太菜了！
97224,2986,李剑,2019-01-22 00:47:48,-27,5,32,相对来说努力与回报不成正比的课
102976,2986,李剑,2019-02-25 07:30:48,0,1,1,优秀！绝对的优秀！
105583,2986,李剑,2019-04-17 01:55:32,0,2,2,超级喜欢动物解剖学！！！！！
105593,2986,李剑,2019-04-17 03:36:44,0,1,1,特别负责人为学生考虑的老师！
121725,2986,李剑,2020-01-21 07:51:23,0,2,2,剑哥是男神！！！人又有魅力 给分也超好 太爱了
132163,2986,李剑,2021-01-30 17:43:06,0,2,2,课很硬核，人超好，大爱
132189,2986,李剑,2021-01-31 01:28:20,0,2,2,作业不少，但给分很好👍讲课也很好，知识都很实用
133444,2986,李剑,2021-03-01 00:35:06,0,1,1,男神！！
137027,2986,李剑,2021-06-29 13:55:07,0,1,1,10分，必须十分
147049,2986,李剑,2022-01-08 13:58:02,0,1,1,老师真的讲的很好！问很傻的问题也会耐心回复(ง •̀_•́)ง
148624,2986,李剑,2022-01-13 09:38:11,-38,5,43,辣鸡老师，无法理解，平时分给分太差，纯粹坑人
161372,2986,李剑,2022-11-05 08:58:01,0,0,0,剑哥男神！！
161373,2986,李剑,2022-11-05 08:58:15,0,0,0,剑哥男神！
161374,2986,李剑,2022-11-05 08:59:15,0,0,0,真的很不错，李老师很耐心
165193,2986,李剑,2022-12-30 03:28:11,0,1,1,剑哥！yyds
168365,2986,李剑,2023-02-14 05:05:55,0,0,0,超级好的老师
184671,2986,李剑,2023-12-22 06:30:15,0,0,0,好老师  啊啊啊
185080,2986,李剑,2023-12-26 06:27:27,0,0,0,超级好的老师…教学质量很高，而且耐心随和
186305,2986,李剑,2024-01-10 11:57:56,0,0,0,学到挺多的
186476,2986,李剑,2024-01-11 08:32:59,5,5,0,他真的，我哭死，期末考试考到一半实在看不下去我们的答案了就“我们来复习一下啊”，真的很希望学生能学到东西拿到高分
190306,2986,李剑,2024-02-27 15:07:22,0,0,0,剑哥！我的新男神！
190569,2986,李剑,2024-03-09 01:40:20,3,3,0,永远的男神！！剑哥！！！
192541,2986,李剑,2024-05-23 09:36:34,1,1,0,牛逼的
192741,2986,李剑,2024-05-30 02:52:25,0,0,0,呜呜呜剑哥！！
211595,2986,李剑,2025-01-12 03:35:04,1,1,0,让我对高等教育重新产生希望的一位老师
213751,2986,李剑,2025-01-19 12:11:15,0,0,0,李剑老师yyds！！！！😍
216003,2986,李剑,2025-03-09 08:46:39,0,0,0,男神，真的爱他
217492,2986,李剑,2025-04-11 10:34:49,0,0,0,实在是太好了！无需多言
217981,2986,李剑,2025-04-18 17:41:34,4,4,0,老师，我真的复习不完了
108728,2998,郭晓令,2019-06-01 04:06:18,0,0,0,郭老师人好，下课还约乒乓球\n\n爱了(⑉°з°)-♡
108729,2998,郭晓令,2019-06-01 04:07:59,0,1,1,very good 大家去选他课 不亏
204951,2998,郭晓令,2024-11-29 03:19:16,3,3,0,郭老师口头禅：懂了没有？太可爱了，老师，
207503,2998,郭晓令,2024-12-22 12:34:12,1,1,0,上课：听没清楚\n\n下课：钉钉秒回\n\n老师上课有点催眠读ppt但是人很好非常有耐心
207506,2998,郭晓令,2024-12-22 12:36:10,0,0,0,没有架子，平易近人，非常好的老师！
66341,3006,陈玉银,2018-01-15 07:35:29,0,0,0,复习的时候你会崩溃的\n\nlong question long answer hard to understand
90473,3307,杜华华,2018-11-23 15:19:14,4,5,1,昆虫没有听觉？EXO me？老师不要瞎科普，做点功课好吗？
100519,3307,杜华华,2019-01-26 08:40:12,4,7,3,课水事多吧。短学期的课共三次全英文展示，两次小组展示一次个人展示，每节课都点名，一次羊场参观。中文上课英文ppt。课程内容像是动物福利的科普，可以了解到人类是如何残忍对待动物，我觉得痛心和压抑。课程中查询资料时发现动物福利相关网上其实都可以了解到，但是在中国太少人关注这件事。给分的话别人什么情况我不清楚，自认为我的认真程度和回报不成正比。没事就当锻炼自己了，当初就是报着锻炼自己的心态所以没有退课。
115731,3307,杜华华,2019-08-19 12:15:32,-10,0,10,杜老师真好\n\n吹就完事了
116842,3307,杜华华,2019-09-16 12:43:07,-6,3,9,啊啊啊，作为我的班主任，还是蛮好的。
165618,3307,杜华华,2023-01-09 04:27:17,1,3,2,给分很一般，不建议选
203401,3307,杜华华,2024-12-03 13:04:13,14,14,0,诗人握持
203406,3307,杜华华,2024-11-19 12:26:02,5,5,0,真的是什么人都能来浙大当老师了
203407,3307,杜华华,2024-11-19 12:26:14,7,7,0,让研究生上课实在是有点难绷了
203850,3307,杜华华,2024-11-21 13:45:20,11,11,0,实验课让研究生来上，一周两次课，第一节课全是pre，第二节课放她前几年上课的智云录播Σヽ(ﾟД ﾟ; )ﾉ
203851,3307,杜华华,2024-11-22 14:43:59,8,8,0,回消息太慢了
203852,3307,杜华华,2024-11-21 13:51:56,7,7,0,实验课王凤芹老师上课挺不错的
203853,3307,杜华华,2024-11-21 13:52:05,4,4,0,上点心吧
203995,3307,杜华华,2024-11-22 14:45:51,-7,0,7,杜老师人美心善
207505,3307,杜华华,2024-12-22 12:36:05,6,6,0,动科院古娜拉黑暗之神
207507,3307,杜华华,2024-12-22 12:37:04,1,1,0,想一套是一套
219213,3307,杜华华,2025-05-23 04:21:17,3,3,0,声音难听到令人发指。课又水又烂，不如学点有用的
220200,3307,杜华华,2025-06-16 08:45:51,3,3,0,毒硴螖
58272,3476,郑肖娟,2017-08-28 09:43:47,1,2,1,很好，虽然我没有听过
74360,3476,郑肖娟,2018-02-14 02:13:42,9,11,2,老师人特别好，对学生、科研都极有热情，惭愧我没有好好对待微生物这门课从老师身上学到点什么。上课会点名、点名提问，但回答不出也没有什么关系。平时不给ppt，到期末会给。今年考试变难了，单选有很多病毒的英文缩写，都不认识，只好瞎猜。简答题1、SPF鸡胚的病毒有哪些2、PRBV等5个病毒的英文全拼3、大肠杆菌的防治 基本都胡编乱造的。实验课和实验报告占了很多时间，实验课经常持续两三天，前一天的结果要第二天来观察。最后88/4.2已经很感动了，浓浓的师生情啊！
97355,3476,郑肖娟,2019-01-22 08:20:57,1,3,2,郑老师超温柔!
105824,3476,郑肖娟,2019-04-21 11:29:54,11,12,1,老师人很好的，非常好的。我是专门来添一条评论，这学期复习累了，想到了去年的好
118548,3476,郑肖娟,2019-10-28 10:56:49,1,3,2,老师很温柔，人也超级nice！微生物很难，期末考已经考的很简单了，但是原谅我们太菜。看得出老师在拼命捞我们，真的感受到老师对我们很用心了。
119623,3476,郑肖娟,2019-11-14 08:57:16,1,3,2,责任心强，人也超nice，给老师点赞?
129513,3476,郑肖娟,2021-01-06 12:41:37,1,3,2,老师很有趣，没有架子，经常介绍自己和同行的研究，想学好兽微是因为她
161782,3476,郑肖娟,2022-11-13 07:44:10,2,2,0,老师很温柔的
163430,3476,郑肖娟,2022-12-14 09:24:20,0,0,0,老师超级温柔！
164198,3476,郑肖娟,2022-12-19 07:06:20,4,4,0,人真的好
164363,3476,郑肖娟,2022-12-20 11:58:03,0,0,0,老师真的很好很温柔，也非常负责，给分很好很能捞！感觉兽微好好背就差不多了
164622,3476,郑肖娟,2022-12-22 09:13:43,0,0,0,老师非常温柔，也很负责！除了说话声音有点小没什么不好。
168174,3476,郑肖娟,2023-01-31 11:23:30,1,1,0,给分是真的好，我这辈子都不会忘记猪传染性胃肠炎的病原是什么了
169631,3630,黄凌霞,2023-02-27 08:06:59,12,19,7,上的生物资源学，老师是顶好的，但是吧这门课有期末论文，课堂展示期末闭卷（难度不是很大），最关键我上的时候它是两天的早八课，老师吧时间调整一下可能人会多一点
177138,3630,黄凌霞,2023-07-02 01:24:16,-9,4,13,不太行
191856,3630,黄凌霞,2024-05-02 05:47:28,-1,7,8,真的很毒，直接0分。算了一下成绩，我用心写的学习心得，直接给我一半的分，你就喜欢chatgpt的作品是吧。？\n\n别选，快跑
191992,3630,黄凌霞,2024-05-07 03:23:52,12,20,8,老师的创业基础真的事情挺少的，然后给分挺好的，最后满了，就是老师上课会不定期点名滴
200834,3630,黄凌霞,2024-10-23 06:00:10,4,5,1,第一次碰到一个老师能做到创业基础这种水课还每节课都点名的，上课本身因为课程比较空洞，但我看的出来她也试图使课堂活跃起来，中规中矩把，想选课就得做好每节课都来的准备，还没出分暂时打个6分
201378,3630,黄凌霞,2024-11-01 08:50:27,5,6,1,上面评价老师不好的一看就是自己不好好学习拿到很差的成绩的人，比如2102班的班长成绩是我们改的，他卷面分只有60多分，最后还来找老师要分，还有说学习心得给分低的，都是我们研究生改的，我们最低都给的88分，不知道你是怎么成绩那么差的，有时候反思一下自己，而不是一味地苛责别人。
201410,3630,黄凌霞,2024-11-02 06:26:16,3,3,0,老师人挺好的，上课很有意思
202454,3630,黄凌霞,2024-11-12 23:56:49,0,0,0,老师上课讲的很好，给分也很好
202530,3630,黄凌霞,2024-11-13 03:40:54,0,2,2,上的是创业基础课，老师人挺好的，事儿不多，给分也好。跟其他创业基础课的老师比起来是真的很不错了。会纸质点名加上上课偶尔抽一两个人回答问题。期末也就写一篇名义上的论文（实际就800字小作文）真的很不错了
202606,3630,黄凌霞,2024-11-13 10:24:30,1,1,0,事少分高，就是每节课都点名。不过老师人真的挺好的
202650,3630,黄凌霞,2024-11-13 15:23:32,2,2,0,【创业基础】老师很好！上课虽然水水的，但是事情不多，给分很好！会有几次点名，一次小组pre，一份心得作业。
202994,3630,黄凌霞,2024-11-15 16:56:16,-3,0,3,给个8分吧，主要是绩点没有我想象的高，但也还行了
203559,3630,黄凌霞,2024-11-20 04:40:41,3,3,0,事少给分好，每节课点名。
206322,3630,黄凌霞,2024-12-14 07:46:27,5,5,0,出分好久突然想起来给个追评hhh由于我们小组ppt第一最后也拿了4.8，每节课纸质点名只能说有点抽象，但是ppt和期末汇报好好做就能有高分，也可以算事少分好，老师人也不错（我是前面那个说没出分先给6分的，错了orz，现在10分还愿）
206479,3630,黄凌霞,2024-12-15 11:55:44,3,4,1,我的PPT展示分其实不算高，就是每节课坐在第一排＋帮老师计时，可能老师觉得我提交的小论文（或者说心得体会）比较好？最后给了98分
207224,3630,黄凌霞,2024-12-20 02:16:59,3,5,2,我的小组展示的分只是中等，上课根本没听过，也没回答过问题，论文也是chatgpt写的，没想到老师给我95分，让我拿到了人生中第一个满绩，真的十分感谢老师，也感谢老师上课给我们带来的好喝饮料（我白嫖了好多）
217080,3630,黄凌霞,2025-04-22 05:57:08,8,9,1,满绩了，谢谢黄老师！
218217,3630,黄凌霞,2025-04-22 05:53:20,7,7,0,每节课点名，点名形式多样，一个小组展示+一个800-1000字课程心得，事少给分好，感谢黄老师！
218229,3630,黄凌霞,2025-04-22 06:36:37,3,3,0,事少给分多，强烈推荐！！
218231,3630,黄凌霞,2025-04-22 06:39:55,4,4,0,创业基础 2025春 给分很好啊 课后老师会给我们分享创业成功的果汁，老师人很好，课上其实可以很水，只有一篇论文和小组作业！最后还有企业家进课堂，bd！
71527,3816,王华兵,2018-01-28 14:42:28,14,17,3,动物行为科学课很有趣
74050,3816,王华兵,2018-02-04 13:51:33,4,6,2,啊啊啊
74681,3816,王华兵,2018-03-05 05:47:12,-6,3,9,考评不严谨。
80055,3816,王华兵,2018-06-19 09:12:28,28,36,8,老师很可爱了，课上放的视频也很有趣.事情少，只要做一次展示和期末开卷考（老师自己也很厉害）\n\n给分也不错4.5
82554,3816,王华兵,2018-07-08 13:27:05,4,6,2,给分好
83755,3816,王华兵,2018-07-11 07:17:01,-5,3,8,只有3.3啊啊啊啊啊啊啊\n\n
84133,3816,王华兵,2018-07-12 06:04:50,0,6,6,上课还行，每节点名，考试贼烦。不看好，不建议选。
85545,3816,王华兵,2018-07-19 06:28:43,0,3,3,老师的重点有点尬，考试很痛苦
85546,3816,王华兵,2019-03-01 23:20:19,-41,6,47,垃圾老师，就一个事儿精，不划重点，勉强划重点的时候画了整本书，还一副我很仁慈的样子，生怕考试太简单，实际都考的什么鬼，给分极差，生怕大家考太好，想尽办法为难大家。总之这个老师，做做科研是可以的，教课就真的别了吧。
89007,3816,王华兵,2018-11-13 18:08:06,18,20,2,老师人挺好的
90206,3816,王华兵,2018-11-22 12:55:30,19,22,3,老师人很好，做小组ppt时还会私戳指点你。这门课事情不算多吧，一次小组ppt展示，然后自己个人再做一个ppt，我只花了一个小时做了十页，算是很敷衍了；平常上课会给张小纸条写着问题当作签到，可以让课友帮忙写一下，老师不管。期末考试开卷，题目书上都找得到，所以比较简单，最后成绩4.2。
90211,3816,王华兵,2018-11-22 13:02:33,9,10,1,事儿少，就是考试会有点痛苦，因为ppt、书本、试卷在讲同一件事时会用三种讲法。所以哪怕开卷也不好做。老师人超好，超平易近人，助教姐姐超棒！
90333,3816,王华兵,2018-11-23 07:30:10,11,12,1,老师可爱
90932,3816,王华兵,2018-11-27 22:55:44,4,4,0,可以可以
92504,3816,王华兵,2019-01-01 04:06:13,29,33,4,一年半前的课程，今天课程群里老师还发了新年快乐，太可爱了吧
