评论id,老师id,老师姓名,发表时间,点赞减去点踩数量,点赞量,点踩量,内容
76846,4915,吴维东,2018-04-24 12:46:45,2,9,7,有趣呀
78872,4915,吴维东,2018-05-16 03:31:06,2,4,2,没有镜片的眼镜萌萌哒
78873,4915,吴维东,2018-05-16 03:31:17,-1,1,2,比我们还多的头发萌萌哒
88313,4915,吴维东,2018-10-28 08:13:53,-1,3,4,温柔的男人像东哥
108568,4915,吴维东,2019-05-28 17:08:53,-1,0,1,挺好的，不是完全念ppt
112900,4915,吴维东,2019-07-05 09:41:52,6,8,2,也就这样吧，没什么意思，很一般的老师。不像我的思修老师那样善于聆听，也不像我的史纲老师那样有自己的思想，差远了。给分也不高。日常拖课。不过不点名
118662,4915,吴维东,2019-10-30 06:28:46,-1,1,2,老师挺好的
125907,4915,吴维东,2020-09-15 12:52:49,0,1,1,形策出分后给个客观评价：吴老师上课算是比较有自己的思想，不会只念ppt，在时事部分会做延伸。虽然是思政课大家都在水，但是偶尔也能抓住我们的眼球。讲课这里他值得6-7分。\n\n给分今年似乎还可以（？）
193413,4915,吴维东,2024-06-10 03:17:23,1,2,1,在家里一定话都说不上一句吧 在学校也是当上皇帝了
