202148,1199,邬建敏,2024-11-10 05:20:28,5,5,0,哈哈哈，2.4，上课是念PPT的，PPT里是书本的，作业是不批的，平时小测不是等于白做的，因为根本就不批，考试是根本就不捞的，就是一坨，希望大家都来选，肯定给你的大学生涯带来浓墨重彩的一笔，让你的绩点非常的好看，一定都要来听哦，我真的爱死你了。
202149,1199,邬建敏,2024-11-10 05:15:15,1,1,0,上课是飙英文的，作业是不讲的，ppt是什么都没的，作业是期末临时批的，小测是没反馈的，考前复习是没的，唯一的考试提醒是要带计算机
202150,1199,邬建敏,2024-11-10 05:22:53,4,4,0,大家一定要都来选这门课，选这位老师，还不点名哟，可以让你的绩点嘎嘎高，可以看到你课上的同学越来越少，你的绩点越来越高，给了1分好评。诶！0去哪里，原来没有啊，真是可惜。
202164,1199,邬建敏,2024-11-10 08:03:50,0,0,0,被绩点击败
202301,1199,邬建敏,2024-11-11 10:44:38,5,5,0,给分差
202325,1199,邬建敏,2024-11-11 15:28:12,9,9,0,傻逼老乌龟
202328,1199,邬建敏,2024-11-11 15:47:34,2,3,1,我操你妈美国汉奸老乌龟吊毛玩意腿怎么不两天都断了喂狗
202821,1199,邬建敏,2024-11-14 14:10:21,1,1,0,。。。
205509,1199,邬建敏,2024-12-08 10:18:59,4,4,0,傻逼老师
205943,1199,邬建敏,2024-12-13 01:46:37,1,1,0,避雷，讲不明白
206562,1199,邬建敏,2024-12-16 06:14:54,1,1,0,喜提1开头.呃...
206853,1199,邬建敏,2024-12-18 03:19:04,10,10,0,完全讲不明白，毫无重点提醒，一分不调，论高考化学满分的绩点3.0是什么感受
206854,1199,邬建敏,2025-02-14 13:59:55,2,2,0,给分很敷衍，避雷
207001,1199,邬建敏,2024-12-19 02:58:47,0,0,0,讲不明白，给分特别离谱
208616,1199,邬建敏,2024-12-30 05:55:51,4,4,0,老乌龟怎么不两条腿一起断
209436,1199,邬建敏,2025-01-06 02:58:46,4,4,0,纯纯一傻逼，上课秀英语秀留学秀实验室就是不讲知识，平时作业从来不改，给分好似和学生有仇，给分历史最差，逆天东西预置了这逼真他妈晦气
209905,1199,邬建敏,2025-01-07 11:10:54,2,2,0,谁遇上谁倒霉
209965,1199,邬建敏,2025-01-07 15:00:32,1,1,0,给分差到离谱
211090,1199,邬建敏,2025-01-10 14:56:00,1,1,0,差差差差差差
211396,1199,邬建敏,2025-01-11 10:19:56,3,3,0,除了不点名真的一无是处
214612,1199,邬建敏,2025-02-14 14:01:09,2,2,0,气笑了害我转不成专业
215072,1199,邬建敏,2025-02-20 14:41:12,1,1,0,臭傻逼
215951,1199,邬建敏,2025-03-08 03:39:32,0,0,0,就是不点名，其他的等于零
216392,1199,邬建敏,2025-03-15 09:52:20,0,0,0,给分差
216565,1199,邬建敏,2025-03-18 13:29:30,0,0,0,吹牛逼吧
217032,1199,邬建敏,2025-03-31 14:01:51,0,0,0,选他的课这辈子有了
217606,1199,邬建敏,2025-04-14 04:57:06,0,0,0,纯傻逼
218004,1199,邬建敏,2025-04-19 05:02:00,0,0,0,傻孩子们快跑啊
222065,1199,邬建敏,2025-06-29 10:27:38,0,0,0,就是一坨
22779,1273,徐光明,2016-03-11 03:33:28,0,0,0,能扯，interesting
23095,1273,徐光明,2016-03-17 10:29:19,1,1,0,很有意思 讲的也不错\n\n
23955,1273,徐光明,2016-04-22 08:46:59,1,1,0,上课坐在前排只要跟他互动一点点他就会一直跟你有眼神交流别问我怎么知道的
86003,1273,徐光明,2018-08-26 16:11:30,-1,0,1,爽爽爽
93213,1273,徐光明,2019-01-08 06:42:53,0,0,0,超级nice
100370,1273,徐光明,2019-01-26 03:54:42,0,0,0,不错，就是回复比较慢
102617,1273,徐光明,2019-02-14 00:04:20,1,1,0,成天开会，好忙呀\n\n不过老师讲的声音很有磁性
105789,1273,徐光明,2019-04-20 13:29:48,1,1,0,老师上课超有趣，我本来对分析化学没有兴趣的，现在觉得挺有意思
107132,1273,徐光明,2019-05-02 01:06:14,1,1,0,怎么没有人评分啊?那我先来给个十分吧！其实上课讲的还是可以的。给分也还行吧没有楼上说的那么迷。老师人很好的，对待教学和学生也很有热情，而且有点可爱的。
830,1783,黄兆镇,2015-03-17 15:53:21,15,16,1,我们亲切的称呼他为老黄。他是我在浙大最喜欢的老师，也许是我这辈子唯一能接受在我三米内抽烟的人。\n\n
1216,1783,黄兆镇,2015-03-21 16:43:43,8,10,2,老师人很好，可能有时候听不太懂口音。不过是个好老师
1458,1783,黄兆镇,2015-03-22 05:21:10,11,12,1,唯一一个，结课以后我与其拥抱的老师。从心底里敬佩，喜欢。他的思维殿堂如迷宫，转悠着跟他走了好久，却只体味到一星半点他的悲情，哲学与数学的悲情。
1675,1783,黄兆镇,2015-03-23 07:28:57,-9,9,18,我们想去旁听，却被粗暴的赶了出来。\n\n本来以为老师很好亲近，但是真的很让我失望。我不希望老师有多大的架子。
1677,1783,黄兆镇,2015-03-23 07:33:29,-11,6,17,我是和楼上一起被赶出来的，不多评论了
1688,1783,黄兆镇,2015-03-23 08:45:53,8,8,0,老师是个负责诚恳的老师～
2340,1783,黄兆镇,2015-04-23 14:21:28,10,11,1,我在浙大上的第一门印象极其深刻的数学课，讲线性代数渗透了好些抽代的内容，回过来看才发现老黄是故意做了这些铺垫。
52597,1783,黄兆镇,2017-06-21 09:55:32,0,0,0,...
65590,1783,黄兆镇,2018-01-06 18:13:46,1,1,0,老师非常热心，总是自愿在自己的休息时间组织学生的读书讨论班，让大家受益匪浅！
191736,1783,黄兆镇,2024-04-29 08:09:45,2,2,0,黄老师一路走好
6246,1916,方群,2015-07-12 09:57:44,3,5,2,挺逗的一老师
20461,1916,方群,2016-01-27 15:58:13,0,2,2,很喜欢用比喻，讲得清楚明白，上课不无聊，赞
20575,1916,方群,2016-01-28 14:00:08,-1,2,3,好好听课，好好复习，得分会不错的
49061,1916,方群,2017-03-23 02:01:20,-2,0,2,真心好老师
54005,1916,方群,2017-06-28 07:57:14,1,3,2,比其他老师有趣，能把事情讲明白
56972,1916,方群,2017-07-05 05:14:26,0,6,6,给分超级差
69614,1916,方群,2018-01-25 05:28:18,0,2,2,老师很好
81275,1916,方群,2018-07-04 14:00:35,4,6,2,给分真的差
81276,1916,方群,2019-09-24 10:57:58,4,7,3,给分太差了
81279,1916,方群,2018-07-04 14:18:06,4,6,2,上课还行，仪器分析部分确实有点无聊，研究性实验蛮有意思的，就是安排在考试周不太舒服，给分的话，emmm，我觉得有点差。。。
112235,1916,方群,2019-07-03 23:48:59,3,3,0,课上的还不错，但是给分实在有点差了
113909,1916,方群,2019-07-08 00:28:25,2,2,0,老师人还是挺好的，讲课也深入浅出。分数不太好只能怪自己确实背得不够，考点还是考的很细的。\n\n至于平时作业的打分...emmmmmm......
158826,1916,方群,2022-07-02 12:51:22,0,0,0,一言难尽
158827,1916,方群,2022-07-02 12:51:42,2,2,0,大特人
190809,1916,方群,2024-03-20 02:59:41,2,2,0,wm分化二的，正在听着方老师22-23春夏的智云自学分化二，方老师的PPT是纯中文，内容简明而且详实，讲课很吸引人，也比较逗，喜欢说:“我在上学的时候有什么分析技术，发展的什么样”。\n\n建议食用方法:直接把他的笔记内容大致记下来，如有不明白的内容直接讲解此页。如果只看他讲的内容加个翻译器，也足够应付wm的阴间作业了
196668,1916,方群,2024-07-04 17:20:34,2,2,0,老师挺好的，分化2讲得很有意思很清楚
196711,1916,方群,2024-07-05 01:34:00,0,0,0,方老师挺有乐子的
196768,1916,方群,2024-07-05 04:25:03,1,1,0,开铲！
196872,1916,方群,2024-07-05 17:11:00,0,0,0,被捞一档～
201204,1916,方群,2024-10-30 06:12:38,1,2,1,喿尔马畐
88109,3217,范杰,2018-10-22 09:19:32,2,7,5,老师很好，对于很多原理更多的是讲为什么而不是怎么做。会布置课外的思考题，收获很大
88658,3217,范杰,2018-11-05 05:42:36,6,13,7,听不懂。是我太菜了么。
116671,3217,范杰,2019-09-23 03:19:11,-2,1,3,...
117294,3217,范杰,2019-09-22 13:32:08,-8,6,14,PPT与课本相似度极高?
117330,3217,范杰,2019-09-23 03:38:14,2,5,3,延伸到位，应用联系加深理解
118032,3217,范杰,2019-10-19 03:57:32,-2,7,9,上课很无聊，完全不讲本质，只会说PPT上的内容，上课就是在浪费时间
122440,3217,范杰,2020-02-27 12:43:19,1,2,1,老师挺好的，问问题也会耐心解答。
125772,3217,范杰,2020-09-14 06:54:34,3,5,2,好老师，第一节课就非常有意思
128396,3217,范杰,2020-12-22 07:51:10,3,6,3,挺好的，不知道为什么分不高
129321,3217,范杰,2021-01-04 06:41:27,0,2,2,老师上课很有意思，还拓展一些课堂之外有深度的内容，老师真滴很好啊。
129322,3217,范杰,2021-01-04 06:43:56,7,9,2,一个特别好的老师。有先进的教学思维，没有被传统的考试思维束缚，在课堂上会拓展我们的思维和眼界。而且每次作业量适中，还会布置一些有意思的思考题，这种老师不拿高分天理难容！一学期的普化课，最后在一首《只要平凡》中谢幕。
129323,3217,范杰,2021-01-04 06:45:34,0,2,2,进浙大的第一个学期遇到的最好的老师。不仅仅是讲授课本中的内容，会进行最前沿最实时的科研成果普及，会引导我们进行真正的深入思考。声音很温柔很磁性，普化课有一种很轻松的氛围。学到很多，一定会想念他。
129324,3217,范杰,2021-01-04 06:49:50,3,4,1,老师的课时这个学期最喜欢的课。其实大一很多的通识课，考试结束过两周你就不会记得这节课讲了什么知识，但是真的会记得老师带给你的一些思维方式以及习惯性的对社会问题的关切。范杰老师就是这样的老师。第一节课绪论的时候谈到“人类社会的发展史怎么出现差异的”推荐《枪炮病菌与钢铁》，一个理科老师，竟然让人很想去看社科的书；他会在上课的时候普及很多诺贝尔奖的成果、最新发的论文等等，很多知识没有记得，但是在赶一些报告的ddl的时候这些例子就会直接被想起来。回答问题也非常耐心，还会引导你去思考。真的很喜欢老师的课。
129972,3217,范杰,2021-01-14 09:00:23,5,8,3,如果我说我梦到范老师了大家会相信吗
132245,3217,范杰,2021-01-31 08:17:53,2,2,0,范老师博学多才，对诺贝尔奖得主了如指掌，即将获得下一届诺贝尔博物学奖。开玩笑啦，老师上课非常有趣，能从多个角度切入主题，物化生文艺都有涉猎，既能学普化，又能拓宽知识面，好评！
133771,3217,范杰,2021-03-05 02:43:48,4,5,1,超级棒的老师！上学期刚上他的课时来看评分居然只有6分多我真的惊了，这学期过来看就9分多了，超级开心！！老师是很优秀也很有趣的人！！【针对之前说不讲本质内容的评价，我觉得这应该是普化这门课本身的问题，这课本身要求就不高，老师讲得也就不深，不过同时还能做到有趣的延展，真的非常棒了
141731,3217,范杰,2021-10-23 10:08:22,0,0,0,老师很渊博，但是讲课有点快，也可能是我的问题
144287,3217,范杰,2021-12-21 04:16:13,1,2,1,作为高中没选化学的化学白痴，表示老师讲的好快，根本听不懂啊听不懂，好吧是我太菜了
146921,3217,范杰,2022-01-08 05:04:21,0,2,2,为什么我给分这么低我不理解
153066,3217,范杰,2022-04-24 17:21:03,3,4,1,我是一个理科很菜很菜的家伙，普化课对我来说很不轻松，每节课有听不懂（不是老师的问题，老师节奏很好，完全是我的问题）的地方是基操，下课也经常拿一些很傻很基础甚至很奇怪的问题去问老师。现在我已经大三了，还记得老师总是微笑着很耐心地跟我一步步讲，思考的时候又是认真脸哈哈哈。助教xgg我也经常拿问题，甚至是很多基础的课后题去骚扰，也好耐心回答我。老师课后也会留下一些思考题，完全是书本之外的，又完全是书本知识深入的东西，在明知我们这种专业不会深入学习化学的同时又很想启发我们。最后一节课结尾，我记得老师给我们放了一首歌，一首童声，唱的什么我不记得了，但是还记得老师对我们说，不是所有人都能所谓的成功还是很厉害啥的，但是到那个时候，也请你接受自己。难得的好老师。
161589,3217,范杰,2022-11-09 08:13:12,1,1,0,好老师，可是普化太难了，呜呜呜
161665,3217,范杰,2022-11-10 07:33:58,1,1,0,喜欢的人会很喜欢，不喜欢的话……可能会很无聊
162473,3217,范杰,2022-11-23 03:33:43,0,1,1,不错的
168327,3217,范杰,2023-02-11 14:43:09,0,1,1,最喜欢的老师之一，虽然课程是普通化学，但对我来说一点都不普通（警惕新型陷阱），每次课上都能对化学界一些问题都能有自己的看法，感觉老师到浙大教课就是一个附带的任务，课上更着重的是对学生的教导，并且大二科研认知还选择了去听他的课题组，整个课题组氛围也很放松
169522,3217,范杰,2023-02-26 15:29:37,0,0,0,这是一个观念比较先进开放的老师，很好很好的老师，普通化学这门课不一定有什么很大收获，但这个老师会让你学到挺多。
170078,3217,范杰,2023-03-01 09:33:36,5,5,0,怎么说呢，感觉我的成绩和老师毫无关系
170708,3217,范杰,2023-03-08 08:24:27,14,14,0,建议高中没学化学的不要选范杰的普化甲，因为老师上课讲的更多的是化学前沿的一些拓展而不是教你如何去学化学。没有高中化学基础的人听范杰的课并不能学到任何东西，最后考试前也只能痛苦找别的老师的课程自学普化甲。但是老师捞人还是很给力的。
200940,3217,范杰,2024-10-25 05:27:42,3,3,0,普化甲基本自己，范老师上课喜欢用英语PPT，一边讲中文一边讲英文，难度还是有点被人为加大的◑.◑
206033,3217,范杰,2024-12-13 03:36:24,1,1,0,老师人很好，也很幽默。但是普通化学讲的东西有点超前了，不太适合大一小登
212877,3217,范杰,2025-01-15 06:44:27,0,0,0,不点名，上课讲的比较难听不懂，但是最后狠狠捞狠狠捞狠狠捞
212988,3217,范杰,2025-01-15 12:10:20,3,3,0,海底捞，绝赞！
213157,3217,范杰,2025-01-16 06:59:19,0,0,0,怎么说，我学到的知识和老师没有关系全凭自学，但我最后取得的分数全靠老师的大捞特捞（）\n\n上课不点名，建议上课溜走考前补天，效果绝佳👍
213482,3217,范杰,2025-01-17 18:43:20,0,0,0,上课讲的不细\n\n最后也有点卡绩\n\n但是老师上课还是很真诚的\n\n很喜欢化学\n\n也很喜欢老师！
8812,3295,王秀云,2015-09-28 06:43:32,27,35,8,讲课思维跳跃，重点不清晰
11759,3295,王秀云,2015-12-14 08:07:51,5,10,5,老师很憨…口音让人听起来不舒服…
11871,3295,王秀云,2015-12-19 10:46:04,17,18,1,老师特别可爱，人也很和蔼。\n\n
13864,3295,王秀云,2016-01-01 10:50:33,14,16,2,讲得极好
15578,3295,王秀云,2016-01-15 12:42:47,2,3,1,听不懂
17643,3295,王秀云,2016-01-20 14:27:05,32,35,3,讲课当你会了一样讲 然而给分超好
18182,3295,王秀云,2016-01-21 08:48:16,3,6,3,老师负责任且认真。\n\n但口音确实有点重。\n\n给分还不错！
18581,3295,王秀云,2016-01-22 05:24:24,15,18,3,老师字超漂亮，讲的好
31086,3295,王秀云,2016-07-03 08:07:17,5,11,6,讲课不怎么样，但是给分很好，平时交了4次给满分，大二下第一门满绩就是云哥给的
34825,3295,王秀云,2019-09-11 10:02:26,10,14,4,老师尽力了，不过讲的真的不是很好。人很好的
37817,3295,王秀云,2016-12-05 06:41:19,8,9,1,口音～北方人表示蓝瘦
43934,3295,王秀云,2017-01-17 06:44:23,2,6,4,虽然口音有点重，但是数学都是靠自学嘛，没关系啦。
46095,3295,王秀云,2017-01-20 15:10:16,27,28,1,讲得其实还是不错的，当然前提是你懂他在讲什么...
46617,3295,王秀云,2017-01-22 04:09:03,4,6,2,老师啥时候出分啊啊啊
46670,3295,王秀云,2017-01-22 06:18:36,4,5,1,老师给分超棒！！！
46683,3295,王秀云,2017-01-22 07:07:08,8,11,3,老师虽然有口音，但是对于一个南方人来说，其实完全听得懂，讲得很细致 给分也好，谢谢老师！
46824,3295,王秀云,2017-01-22 11:30:02,1,4,3,听不懂
46828,3295,王秀云,2017-01-22 11:36:54,-41,8,49,虽然有点口音， 讲课可能也可能不是特别好。不过给分很好。我又满了。。。
47439,3295,王秀云,2017-01-26 10:51:37,3,3,0,很nice啊！
48010,3295,王秀云,2017-02-28 04:11:49,4,5,1,今天第一次听老师的课，其实在之前已经预习过概统，然而在第一节还是学到很多新东西，绝不是完全念课本，虽然有口音但不影响听讲。很不错
48416,3295,王秀云,2017-03-03 03:35:52,4,4,0,老师讲课很认真负责，而且给分很好！
49385,3295,王秀云,2017-12-27 04:44:16,451,481,30,他的概统课不建群，有喜欢的妹子根本不能要联系方式，真的很郁闷。或许这次错过，就是一辈子的遗憾。?
49412,3295,王秀云,2018-06-12 13:42:51,8,9,1,求老师讲例题的时候慢一点……至少在课上给大家试着做一做的机会啊……题目出来马上就讲答案了完全来不及自己思考啊
51431,3295,王秀云,2017-06-05 11:38:02,5,5,0,老师讲的还算是不错的，认真听课会有收获，给分感觉不错\n\nP.S.老师不会建群，课件也要主动找他要
55848,3295,王秀云,2017-07-02 12:57:00,0,0,0,给分好，好老师
56446,3295,王秀云,2017-07-04 00:28:45,0,0,0,还可以
57528,3295,王秀云,2017-07-09 10:37:17,4,4,0,老师超nice，给分很好，不过统计部分可能会让人难以理解一些，老师会经常说“这个你们自己体会一下???”。概率论部分真的很好，统计么确实需要自己脑子里构建模型嘛~反正最后老师为了让我不掉档把我小测，作业全拉满了，简直开森~
59531,3295,王秀云,2019-09-09 07:13:55,83,90,7,大家好，我们终于有群了！
63798,3295,王秀云,2017-12-15 03:25:31,-4,0,4,实在不知道在讲啥
63871,3295,王秀云,2017-12-18 06:16:23,1,2,1,数理统计部分真的听不懂……
65279,3295,王秀云,2018-01-02 08:34:23,0,2,2,不知所云\n\n
65517,3295,王秀云,2018-01-05 03:36:19,50,53,3,有一种秀叫做王秀云的秀。\n\n讲课速度可以说像是坐了火箭，不仅上了天，而且用不停步。\n\n复习课，你有体验过一节课复习完6章的嘛？\n\n王老师真的好，下次我还会再来。
65685,3295,王秀云,2018-01-08 08:27:49,-1,1,2,概统课的讲授不注重对内容的理解
66518,3295,王秀云,2018-01-17 06:32:29,13,15,2,每天上课，挥舞着他的魔仙棒，坐在后面完全听不到，节奏平缓，体验不错，下次再来。
67000,3295,王秀云,2018-01-19 23:49:14,2,2,0,时间序列挺给力的，人很好，不过考试难，哭泣…
68901,3295,王秀云,2018-01-24 05:34:59,4,4,0,讲课速度真是王秀云老师的秀\n\n个人觉得他的ppt质量真的是挺不错的 \n\n思路很清晰\n\n大概这样一来我们自学起来就会轻松点吧...
70357,3295,王秀云,2018-01-26 13:44:42,1,1,0,给分很好 我爱老师 谢老师抬我一手
70403,3295,王秀云,2018-01-26 14:43:46,3,3,0,老师讲的真好^O^
70430,3295,王秀云,2018-06-13 10:47:28,16,17,1,对我这个听过唐炳康微积分的人来说，王老师的口音真的算不了啥hhh
70448,3295,王秀云,2018-01-26 15:48:58,0,1,1,老师讲得超级快，不过很可爱！\n\n
70586,3295,王秀云,2018-01-27 09:00:19,2,5,3,讲得很好，总评99，期末满了，谢谢云哥
70729,3295,王秀云,2018-01-27 12:41:04,5,6,1,快！\n\n秀！\n\n自学了一个学期，个人觉得难度不大，没什么问题，按时作业、小测，最后就满了。\n\n感谢秀哥培养我的自学能力！秀哥给分还是挺好的！
76656,3295,王秀云,2018-04-17 08:59:29,0,0,0,有没有同学知道老师办公室在哪或者老师联系方式？谢谢！
80516,3295,王秀云,2018-06-27 10:54:55,1,1,0,很可爱呀
83324,3295,王秀云,2018-07-10 05:53:19,1,1,0,大爱秀云老师 很可爱 给分超好！期末会调分的！
85009,3295,王秀云,2018-07-15 03:11:31,0,0,0,人可爱～出分慢
85012,3295,王秀云,2018-07-15 03:16:36,0,0,0,谢谢老师！
85097,3295,王秀云,2018-07-15 09:48:47,1,1,0,讲得挺好的，标志动作中指推眼镜，超级可爱！
85106,3295,王秀云,2018-07-15 11:21:24,1,1,0,王老师讲课很快，上课想听懂并且跟得上挺难的，不过给分真的好，只复习了4章奔着及格去的我居然考了74，谢谢王老师！
85470,3295,王秀云,2018-07-18 07:09:37,0,0,0,说实话 觉得老师讲的不是特别清楚 要自己看的 给分和人都挺好的
85641,3295,王秀云,2018-07-23 19:53:49,1,1,0,给分妙啊
85774,3295,王秀云,2018-08-06 07:48:09,3,3,0,老师讲的挺不错的，条例清楚，要点明确，最后还会有复习。顺便分享一下学习概统的经验，上课时只要理清思路，当时不会做题目没关系的，重点是知识点思路要明确！考试的时候再话一两天刷题，满绩不是梦，概统真心不难
87504,3295,王秀云,2018-09-30 03:17:30,13,16,3,时间序列是什么神仙课程。。。
87512,3295,王秀云,2018-09-30 04:24:58,23,25,2,时间序列就是在刁难我胖虎
87551,3295,王秀云,2018-10-04 13:16:21,12,13,1,时间序列谁退课谁是狗
88999,3295,王秀云,2018-11-13 14:13:45,1,1,0,概率论轻松愉快
89486,3295,王秀云,2018-11-19 09:51:01,1,1,0,真的超秀了！
89499,3295,王秀云,2018-11-19 10:28:38,0,0,0,老师很不错。讲课很清楚，不过稍微有些枯燥
89590,3295,王秀云,2018-11-20 01:38:36,0,0,0,讲课一般，但是真香
89635,3295,王秀云,2018-11-20 05:37:39,2,2,0,概率论建群的，还给课件！
89756,3295,王秀云,2018-11-20 15:23:00,1,1,0,老师人超好，不过讲课确实有点快，但答疑什么的都特别有耐心，赞
90193,3295,王秀云,2018-11-22 11:42:45,1,1,0,上课当你什么都会，不过概率论只要把例题弄懂考试就没问题，课后题比较变态。
98194,3295,王秀云,2019-01-23 07:27:16,8,8,0,我只想问问什么时候出分
100462,3295,王秀云,2019-01-26 07:08:06,2,2,0,出分前来攒人品，老师人很好，讲课很努力，可能自己太菜，所以有些没听明白
100636,3295,王秀云,2019-01-26 13:00:42,0,2,2,老师很好，但是又被卡了一分。三分一档真的智障。
100648,3295,王秀云,2019-01-26 13:22:16,2,2,0,老师人很棒完全没有架子的那种，就是上课速度有点秀，最后给分也还行吧
100711,3295,王秀云,2019-01-26 15:12:33,-36,6,42,学期第三门满绩，谢谢老师!
100828,3295,王秀云,2019-01-27 01:40:51,1,1,0,老师人真的很可爱，超级喜欢～给分也好
101229,3295,王秀云,2019-01-28 02:27:05,-7,0,7,考卷完全不考虑学生有没有学过复数相关的内容，出了一大堆谱密度，让人很憋屈
101403,3295,王秀云,2019-01-28 06:53:56,0,2,2,我想和那位穿aj4xkaws和yeezy750的帅哥当兄弟
113883,3295,王秀云,2019-07-07 23:06:08,0,0,0,讲课思路清晰，十分推荐，唯一的缺点是讲拓展书上没有，也不知道考不考。。。\n\n
113889,3295,王秀云,2019-07-07 23:34:46,3,4,1,给分超好，满绩了，开心
113890,3295,王秀云,2019-07-07 23:37:33,0,1,1,给分不错，挺体贴学生的，划得重点挺靠谱的，相比之下csp就呵呵了……
113893,3295,王秀云,2019-07-07 23:48:57,0,1,1,给分好，上课一直在强调不要挂科，就是讲得有点快。
113955,3295,王秀云,2019-07-08 02:33:48,1,1,0,老师真的给分超好啊！！而且上课时候太萌了，吹爆pua松分布、平均wei转时间～反正真的太可爱了
114491,3295,王秀云,2019-07-10 05:51:55,0,1,1,大类课随机过程，老师讲得很仔细，不要求的内容也会讲，是个好老师。这门课很简单，因为考试有套路，和概统一样。复习课认真听！但从学习角度来说考试和作业还是太单一了，课后可以自己专研一下
114533,3295,王秀云,2019-07-10 11:31:30,1,2,1,随机过程不是很难，老师口音比唐炳康重，亲测，给分不错
117247,3295,王秀云,2019-09-21 07:08:04,0,0,0,非常喜欢
117732,3295,王秀云,2019-09-30 03:08:29,7,10,3,高分怎么来的？我觉得他讲的很累，讲的也不是很清楚啊……
118878,3295,王秀云,2019-11-07 09:48:59,-8,3,11,垃圾课程毁我青春，讲的比火箭还快，考的比偏微分还难
119123,3295,王秀云,2019-11-10 14:47:11,3,3,0,我也觉得老师讲的一般，但是这次考试不难，甚至可以说偏简单，楼上过激了
119149,3295,王秀云,2019-11-11 01:36:58,0,0,0,很认真呐
119564,3295,王秀云,2019-11-14 00:12:57,1,2,1,虽然啥都听不懂但是给分还是挺好的（雾
119764,3295,王秀云,2019-11-15 12:12:25,3,3,0,上课讲重点！every single word he said will be in the exam！
119847,3295,王秀云,2019-11-16 05:34:40,0,0,0,懵懵懂懂
120478,3295,王秀云,2019-12-09 06:40:45,2,2,0,emmm老师人不错也挺负责，平时真的很认真的在讲课了，但速度太快了，而且效果也不好，基本靠自学。但给分挺好的！给分好！！
120683,3295,王秀云,2020-01-15 07:28:01,1,1,0,老师还是挺好的，虽然我根本听不懂..
121787,3295,王秀云,2020-01-22 01:44:30,1,1,0,王老师海底捞，我这种菜鸡居然过了。感觉讲得很好，是我太菜了，作业也没好好做，出分真的感受到浓浓师生情。
