127589,3695,赵沛,2020-11-24 23:38:47,3,4,1,老师太棒了，讲课幽默生动，而且力学导论给分也很给力，只要认真写论文，分不会差
127590,3695,赵沛,2020-11-24 23:59:15,5,6,1,老师人太好了，尽量都给了学生高的绩点，吹爆。考评标准的话，今年和前年大不一样，改为20%上课签到分，30&mooc测试分，50%翻译一篇自己专业的经典英文论文并说明为什么认为它经典。
127603,3695,赵沛,2020-11-25 02:49:07,1,2,1,满绩漂过，老师人很棒
127610,3695,赵沛,2020-11-25 04:18:35,3,4,1,内容充实作业合理给分也高5555555
127621,3695,赵沛,2020-11-25 05:33:38,1,2,1,真的真的太有趣了!!无论是杨卫老师还是赵沛老师，讲的东西都真的很有趣。慕课的线上考试也是只要认真听没什么问题，并且给分很好!!直接爱了
127622,3695,赵沛,2020-11-25 05:36:25,1,2,1,老师真的太好了！！！上课很有趣内容也很丰富！！给分真的很好老师非常善解人意！！
127627,3695,赵沛,2020-11-25 05:56:27,4,5,1,墙裂墙裂推荐，事少老师好给分好讲的有意思，不选这个选哪个？别被课程名字骗了，文科生完全可！！！
127637,3695,赵沛,2020-11-25 06:47:45,0,5,5,来自秋天的第一轮绩杀
127658,3695,赵沛,2020-11-25 12:26:34,1,1,0,很好的老师
127756,3695,赵沛,2020-11-26 10:40:30,3,3,0,事情很少，真的很少，冲这一点真的很推荐！给分可以的，会尽量合理地分布和满足大部分人的需求，但说实话论文给分没什么标准
130119,3695,赵沛,2021-01-17 11:43:33,1,1,0,事少分高，老师人超好，讲的也很有意思，强烈推荐
132042,3695,赵沛,2021-01-30 04:03:42,2,3,1,力学导论是一门很有价值的课，讲了很多全球前沿的研究方向，极大开拓理工学生的视野。老师不断改进课程考核机制，感觉是一位对大学教育很有想法的老师，风趣幽默，能学到很多的科普课（对文科生相当友好）。大学生涯第一个满绩，给了一个新生未来学习发展莫大的激励。每到选课的时候，脑子里就不断回想起赵老师。
134920,3695,赵沛,2021-04-22 10:44:56,-3,3,6,是给分最好的老师 30％的人满绩 80％的人4.5以上 完全按照正态的最高档给分 至于3.3被正态的真的没办法 老师已经给分这么好了
138409,3695,赵沛,2021-07-09 03:34:33,7,8,1,给分很差很差很差，快跑，课讲的还行
138748,3695,赵沛,2021-07-10 16:02:02,14,14,0,也不知道材料力学甲卷子是他出的还是王宏涛出的，最高3.0。三分一的人挂科，两周一小测，原地裂开
139886,3695,赵沛,2021-08-09 08:48:20,8,8,0,请问480块材力重修费能报销不，这给分就没给活路😥
140626,3695,赵沛,2021-09-14 12:28:10,6,6,0,赵老师讲的不错，但是绩点真的是不堪入目，平时会突击用小测来点名，我们专业很多挂科的，几乎都在60分往上一点。。。
142840,3695,赵沛,2021-11-17 00:49:41,16,17,1,课没怎么听不评价，但今年这个考核确实有一点离谱，占30的客观题，说是闭卷，结果有多少人在查手机？虽然是受到那个卖答案的傻逼的影响，但希望成绩的评价方式能早点稳定下来，真的做到公平。
142865,3695,赵沛,2021-11-17 03:29:20,0,2,2,力学导论还不错吖，本来是开卷的客观题最后闭卷了。准备了好久加上课认真听满了，事情感觉真不多，就客观题（这个真的要仔细看ppt加做笔记）加三道主观题，主观题搜索资料感觉没太难？？最后美美满了。（而且给分很好，每个档老师都会给到最高分）
142874,3695,赵沛,2021-11-17 04:30:45,0,0,0,力学生，专业课，怎么说，比较难受。\n\n怎么说呢，虽然其他评论说这门课理工科成分太多，但说实话感觉就是文科啊。。。学习的内容基本是力学的历史进展等等，之前非常期待有一些初步的内容的，结果整个课没有讲授任何理论的内容，可以说对文科生已经非常非常友好了，然后考试内容占大头的也是主观题，憨憨理科生实在无能为力了。\n\n赵老师非常好，就是碍于这个通识课的限制，还有学校这个机制，没有办法了。\n\n虽然成绩不是很好，也很满意了。
142876,3695,赵沛,2021-11-17 04:44:07,0,2,2,力学导论绝对是浙大良心好课，事情少分数高，虽然受到卖MOOC答案的傻逼影响降低了课程体验，但这门课的质量还是非常高的，想水可以水，想学也能学到很多知识。
161829,3695,赵沛,2022-11-14 07:54:31,1,1,0,课是好课，但是考试很离谱
163689,3695,赵沛,2022-12-16 03:01:56,1,1,0,讲故事，很有意思
163828,3695,赵沛,2022-12-16 07:48:03,2,3,1,老师超好~~讲课很有意思\n\n力学导论课是杨卫院士和赵沛教授一块上的，一人四节。强推这节课！！！！！\n\n期末考核点名5%（钉钉签到，不要求到课），45%客观题（在学在浙大上有选择有填空，都是讲课的内容，建议课还是听一听，但如果你手速足够快百度很熟练也行。好多人说做不完，确实题量很大），50%主观题（给出几个问题，挑三个回答，都比较偏理科，有的是那种任意想象型的，大部分网上都能找到）。\n\n给分也贼好。从没听过课，就靠着好好答主观题，提前看一遍PPT加上百度很熟练，就满绩了。
171066,3695,赵沛,2023-03-15 11:27:35,3,5,2,小测好贱啊
173040,3695,赵沛,2023-05-12 00:32:43,3,4,1,看到评论都是从通识课来的，不是很理解为什么几乎没有专业课的人来评论。从材料力学（乙）来的，他自己把15分平时分作为小测（其他老师都没小测），到课率有5分，应该要测五次（目前第11周，测了3次）。他自己出的题和作业题的形式很不一样，解题所必须的条件会很隐晦地告诉你，或者说暗示。然后小测给分，只有在思路和公式和答案全对才会得到这一个得分点的分，不知道期末怎么给分。吐槽结束之后，真心说他上课讲的还不错。（我的评论显示不出来吗）
175088,3695,赵沛,2023-06-21 12:48:29,-2,4,6,材力乙来的，建议跑。给分稀烂
175113,3695,赵沛,2023-06-21 14:38:36,1,1,0,好老师，上课幽默有趣，干货十足，给分也不错
176658,3695,赵沛,2023-06-29 15:19:20,1,2,1,材力乙讲课很好，给分一般，平时分扣得偏多了
181922,3695,赵沛,2023-11-05 11:55:26,1,1,0,顶真顶
182082,3695,赵沛,2023-11-09 15:24:55,1,1,0,是上力学导论的，短学期八节课里只有后四节是赵老师上，但是我觉得老师讲的真的很好，虽然看上去是艰深的力学，但其中也有很多容易了解到的，很有趣的知识。
182931,3695,赵沛,2023-11-21 07:01:13,5,6,1,力学导论 伟大。。。。。。。
182935,3695,赵沛,2023-11-21 07:08:40,0,2,2,上了老师的力学导论，老师人超级好，给分也很棒，平时只需要签到就好了，最后考试是开卷的，答案都在PPT上，快选！！！
182937,3695,赵沛,2023-11-21 07:12:24,0,1,1,我天我爱死爱死爱死爱死爱死 爱的死心塌地呜呜呜呜呜呜呜呜呜呜
182938,3695,赵沛,2023-11-21 07:12:56,0,0,0,力学导论给分很好，老师讲的也很有意思
182941,3695,赵沛,2023-11-21 07:35:39,0,0,0,老师人好好
182947,3695,赵沛,2023-11-21 07:44:39,0,0,0,给分真心不错
182964,3695,赵沛,2023-11-21 08:43:51,3,4,1,力学导论，我本人是学工程力学的，前前任校长杨卫（清华工程力学的教授）前四节课，赵老师后四节，让我对这个专业又燃起了那么一点希望，讲的东西很前沿很有趣，老师上课轻松幽默，事少分高，航院的同学欲购从速，其他工科的同学都可以报这门通识，真的不错，还能见一见前前任校长，体验体验院士上课
182998,3695,赵沛,2023-11-21 11:31:05,0,0,0,给分很好，老师讲课也很不错
183029,3695,赵沛,2023-11-21 15:07:21,1,1,0,zp老师真的很好。。。会认真根据学生的反馈调整课程细节，超级难得了
183032,3695,赵沛,2023-11-21 15:43:41,0,0,0,老师人很好，很耐心。
183043,3695,赵沛,2023-11-21 23:59:53,0,0,0,本科生选就完了
183133,3695,赵沛,2023-11-22 10:54:14,0,0,0,很好的老师！
183571,3695,赵沛,2023-11-27 11:59:18,0,0,0,就这么说吧，回邮件很耐心，老师人很好
193697,3695,赵沛,2024-06-15 13:02:19,0,0,0,很好很好
194858,3695,赵沛,2024-06-25 17:40:50,0,1,1,给我爹献上满分十分
195418,3695,赵沛,2024-06-28 03:55:44,-1,0,1,伟大无须多言
199486,3695,赵沛,2024-09-24 13:03:07,7,8,1,课真的是好课给了我非常大的震撼，真的重燃了对科学的热爱，赵老师也非常非常好，像个老前辈一样把力学的一切娓娓道来。但是屁事真tm多，三个网站rz东西都有作业，写作业时间莫名其妙。要绩点的赶快逃吧，做这课的nc作业的两三个小时认真学学主干课不好吗？（当然如果是能聚合在一个网站上量少一点真的是完美的）
199823,3695,赵沛,2024-09-30 13:14:57,1,2,1,补选前发邮件给赵老师，他立马就把我加到力学导论了，超级感动。\n\n课程是真的很不错，我对力学等科学的观念也因此慢慢建立起来，才会发现自己原来对其有很大的误解。\n\n超喜欢赵老师！！！
200736,3695,赵沛,2024-10-21 14:33:49,4,5,1,真的强推，大二选的这门课。大一上了这么多通识课，没有一门我是完全好好听的，要么写作业要么玩手机（doge \n\n虽然这门课我也写了作业（要怪就怪数学物理方法也在周一），不过我最多写一节课，之后都全程抬头听。最近的几周课都没写作业了，主要感觉这么好的课就要结束了，作业下课以后也能写，课错过了就错过了。\n\n课程本身分为三个部分，力学往事、力学今生、力学未来。其中我主观感觉大部分人最感兴趣的应该是力学未来，主要介绍了软物质、机器人、机器学习、人工智能相关的一些内容。有很多前沿的东西，也有很多生活中的例子。\n\n力学往事也挺有趣的，主要就是介绍力学学科的起源发展，最有趣的部分是介绍到近代的人，从高斯、欧拉、拉普拉斯、拉格朗日、普朗特、冯卡门最终可以学术传承到杨卫院士，反正学工科的再之后的理论力学材料力学的学习中少不了他们，想到他们各种方程，似乎没那么有趣了\n\n力学今生主要是流体力学、固体力学、材料力学。都是从具体的实例比如大飞机出发讲的，基本是介绍大飞机的结构然后顺便介绍相关的流体力学知识。\n\n下周还有最后的一次课，先来评论了
201094,3695,赵沛,2024-11-23 01:20:09,4,7,3,力学导论\n\n下雨了，同学们可以晚点来\n\n最后一节课放了最伟大的作品改编为量子力学的版本\n\n事少，给分很好！喜提4.8\n\n老师很负责，很有情怀\n\n敬佩！！！
201099,3695,赵沛,2024-10-28 13:56:54,-3,6,9,你踏码设置的期末考试合理吗，真没亩啊
201102,3695,赵沛,2024-10-28 14:03:37,2,3,1,宇宙第一无敌神中神 不给老师打十分的人注定只能度过一个失败的人生 老师我爱你🥵🥵😍😍🥰🥰
201221,3695,赵沛,2024-11-21 01:57:00,3,4,1,赵沛老师的力学导论是我大一上的第一门通识课，虽然还没出分，期末小测也确实有些紧凑了，但不论是课程安排还是老师的个人形象，都是当之无愧的10分。\n\n“到浙大来做什么？”\n\n赵老师帮助我形成了一个良好的科学观和世界观的认知，就凭这点，10分\n\n更新：出分了，群里很多人在感谢老师，我也是受益者，但我想说，这里面有没有期末考崩了然后跑到查老师骂的自己清楚，人前人后两套皮，小心哪天漏了，那些骂人的还拿了好绩点的好自为之。
201310,3695,赵沛,2024-12-04 07:16:06,3,3,0,力学导论：课是可以一节不听的，人是可以一次都不到的，ppt是可以一页都不看的，mooc是可以一题都不做的——只需要考试的时候chatgpt/Google 快点就行了
203722,3695,赵沛,2024-11-21 00:00:08,2,2,0,老师人很好，力学导论和科普讲座一样，哪怕坐里面划水偶尔听一点也有收获，超值。作为通识课来说，真的啥事没有，只有主观题和客观题。前者可以随便搜资料，主要得体现自己的思考吧（？），后者确实得拼手速拼网速拼gpt能力。只要你态度端正的话给分超级无敌好……强推
203724,3695,赵沛,2024-11-21 00:08:22,3,3,0,笨人上的力学导论，今年杨卫院士退休了，原来两位老师一起上的课变成了赵老师一人讲。课程设置超有意思，赵老师讲的也很好，给分更好！在这门课上，赵老师会从墨子和亚里士多德时代的自然哲学讲到量子力学甚至人工智能，涉及到航空航天、土木建筑等工程技术和理论物理等科学理论，深入浅出。无论是文科还是理工科的同学很推荐。就是力学专业的同学需要额外做几百道选择题，有点小累。不过老师确实给分好，推荐选力导！
203726,3695,赵沛,2025-01-12 09:47:22,-4,2,6,还有比赵沛老师更好的老师吗，给分还好，力学导论真的好
203736,3695,赵沛,2024-11-21 01:41:58,4,4,0,对于力学导论这门课，单从最后的结果来看，给分确实很好，至少也是付出和回报成正相关的，平时的任务也不多，只用写几个主观题即可。从听课的感受上来看，老师一开始会帮你搭建一个比较合理的科学体系，之后讲一些力学或者说是科学技术的发展史，最后用力学的一些知识和想法去解释很多领域的问题。因此虽然这门课叫做力学导论，但是很多专业的同学都可以在其中找到自己熟悉的地方。赵老师的授课风格也很亲切，内容我个人感觉十分有趣，不舍得缺席任何一节课。虽然最后的考试时间比较紧张，但是如果平时有好好听课（其实也不用额外下功夫），在考试前复习一下老师给的PPT，取得一个相对的好成绩是不难的（之所以说相对，是因为这里的成绩有按最高分归一化的处理，也是比较科学的一面）。总而言之，这是一门充满干货，同时给分也很好的通识课。
203737,3695,赵沛,2024-11-21 01:38:31,0,0,0,伟大，无须多言
203740,3695,赵沛,2024-11-21 02:03:11,0,0,0,伟大无需多言
203748,3695,赵沛,2024-11-21 02:24:18,0,0,0,捞了我12分居然
203797,3695,赵沛,2024-11-21 06:13:15,1,1,0,人好事少分高，伟大无需多言
203799,3695,赵沛,2024-11-21 06:16:12,1,1,0,😘😘😘😘😘😘😘😘😘😘
203833,3695,赵沛,2024-11-21 10:41:39,0,0,0,听了98上同学说的只刷了题库，没看ppt，交卷的时候天塌了，没做完，结果出分4.5，神中神
203848,3695,赵沛,2024-11-21 13:37:27,0,0,0,真的是好老师，力学导论相当好
203911,3695,赵沛,2024-11-22 02:42:18,0,0,0,爱死赵老师了！
204467,3695,赵沛,2024-11-26 05:26:58,0,0,0,力学导论\n\n100/5.0，收获人生第一门满分满绩。表白赵沛老师。不要看热门评论，课程之初考核方式还有待完善，还有正态的加持，现在的评分都超好的。上课偶尔听一下，考前看一遍PPT，期末客观基本上都做得出来。主观题是在题库里选答小论文，有比较硬的也有比较文的，对各科学生都挺友好的，强推！考试以外，上课也能收获许多，上第一节课就会明白的。
204534,3695,赵沛,2024-11-26 12:50:46,0,0,0,强烈推荐赵沛老师的力学导论通识课，无论是什么专业都狠狠推荐一波。赵老师风趣幽默，活少给分好，上赵老师的课会让你不自觉沉浸其中而忘了水课（笑）。你不仅能学到力学领域的相关基础知识，而且还能收获人生观价值观的提升。总而言之，赵沛老师的力学导论课，你值得拥有！！！
205021,3695,赵沛,2024-11-29 17:29:28,0,0,0,讲课好给分好，伟大无需多言
205866,3695,赵沛,2024-12-12 11:22:06,0,0,0,力学导论 4.5 文科生\n\n起初看查老师我还以为人人都可以满绩哈哈，但是现在看来4.5已经很不错了，本人完全不懂力学，三篇论文几乎都靠ai整理思路，25道题对了11道，全靠ai，4.5真的很捞了。。。老师从哲学开讲，文科生听爽了，后来就有点听不明白，但是对小测影响不大（反正是ai做），文科生完全可以选哦，老师儒雅随和且捞😊
208113,3695,赵沛,2024-12-25 15:45:09,1,1,0,赵老师我的神！！！三个主观题一题300字，期末考复习了一下午，最后赋分98！
213109,3695,赵沛,2025-01-16 04:12:46,0,0,0,力学导论\n\n捞捞课，基本上签个到就走了...\n\n最后给分真的很好，很轻松就拿到了高绩点。
216489,3695,赵沛,2025-03-17 09:44:08,0,0,0,大恩不言谢，怎么忘记给赵老师打十分了
221678,3695,赵沛,2025-06-25 08:04:48,0,0,0,赵老师讲课很认真，教的很好。\n\n材料力学yi有一个期中考，比较简单，没有其他事。
25164,3710,陈彬,2016-05-06 13:46:35,0,1,1,6666666\n\n
25899,3710,陈彬,2016-06-28 14:13:25,2,4,2,很优秀的老师
51093,3710,陈彬,2017-05-17 01:00:33,1,1,0,容易睡着
54336,3710,陈彬,2017-06-29 06:16:12,1,2,1,老师很无聊，给分很差就是了，还有，笑声很诡异，看你们不喜欢上他的课，“那给你们一块硬骨头啃一啃”。。。
54799,3710,陈彬,2017-06-30 08:43:04,2,2,0,给分呵呵
54962,3710,陈彬,2017-06-30 13:34:29,2,4,2,给分还能再差些吗，相比于别的老师的课，有小论文就不说了。竟然还是拉分的？what？
57989,3710,陈彬,2017-07-21 01:49:32,-1,1,2,考试改分极严，平时分给分极差，平时分中的小论文居然是用来拉分的，一不小心总评就先扣掉10分绝不危言耸听，考试有一些步骤写不明白直接扣分不为学生着想，推荐选到他的课直接补选别班
84760,3710,陈彬,2018-07-13 22:37:33,1,1,0,给分不错 上课因为说不让我们写大作业了所以很开心！
196075,3710,陈彬,2024-07-01 12:28:21,0,0,0,材料力学（乙）\n\n老师负责后半部分的讲解，老师很和蔼，教的也是结合题型的，跟着学绩点不会很低。\n\n前半部分的庄国志老师比较活泼，不过前半部分内容确实不多，问题不大。\n\n平时分给的很高，但是作业分是会考虑正确率的，大家要好好写作业。
201954,3710,陈彬,2024-11-07 19:14:11,2,2,0,真的是很好的老师！！！讲的很细致，逻辑很清晰，很全面，现在学结构力学一点压力没有
43581,3726,解利军,2017-01-16 14:46:57,-10,3,13,好，给了我满绩
69693,3726,解利军,2018-01-25 08:28:57,1,1,0,上课挺无聊的，声音很小，事情不多，可能因为我是外专业的吧，给的分很低
83630,3726,解利军,2018-07-11 00:56:44,0,0,0,当个性拿学分很简单，但外专业给分很差
167388,3726,解利军,2023-01-16 02:14:14,0,0,0,上课很小声，没有什么意思，学不到太多东西\n\n开卷考试，出分极慢，给分极差
167389,3726,解利军,2023-01-16 02:21:16,0,0,0,学弟学妹们快跑
176380,3726,解利军,2023-06-28 15:16:03,2,2,0,给分极差 开卷考
208817,3726,解利军,2025-01-02 08:26:28,1,1,0,还没出分，先给9分\n\n1在空气动力学卷子难上天的情况下，不怎么需要复习就都会写的卷子多么让人心安\n\n2老师虽然讲课没什么激情，但是会虚心接受错误，课间有同学提出PPT的问题他一上课就改了\n\n3事事有回应，我们大作业不会做的时候老师课上花了两节课，一节讲过程，一节回答问题，人非常和蔼\n\n4会点名，特别是人少的时候，建议不要翘早八\n\n5作业少，只布置了三次书面作业一次大作业，而且书面作业都及时讲解，也很简单。\n\n6考试水，8道多选，6道简答，其中3道简答都可以翻PPT，一个是大作业步骤，另外两个都是小作业换汤不换药\n\n7复习方法，只要作业会做，就不用复习，打印完PPT和作业就代表复习完了
213341,3726,解利军,2025-01-17 04:13:26,1,2,1,给分蛮好的，平时作业较少，大作业需要花点时间学习
213352,3726,解利军,2025-01-17 04:25:50,1,1,0,谢谢老师，在我这学期烂到尘埃里的分数中给了我一线希望。\n\n基本没有复习，考前看了三章ppt，剩下的都是没翻开过，课上半只耳朵听讲，感兴趣的听了听，作业认真做了，考试计算题基本和作业一样。\n\n老师上课挺认真的，大作业还会带做，飞设大三上为数不多的好课了
92006,3825,杨波威,2018-12-25 10:40:32,6,6,0,老师上课讲的很好，学到很多东西
122468,3825,杨波威,2020-02-29 03:25:23,7,7,0,杨老师太强了，什么都懂
150219,3825,杨波威,2022-01-20 12:47:02,15,17,2,Python数据分析虽然没有预修要求，但还是需要自己多看多学的，毕竟基础语法都不会肯定没法编。老师懂得很多，但对零基础的人来说，听起来还是比较费力，需要多自学。没有期末考和平时作业，期末大作业多用点心，给分好的！
167390,3825,杨波威,2023-01-16 02:32:36,7,7,0,老师人很好
190278,3825,杨波威,2024-02-27 06:14:44,3,3,0,特别强啊
199912,4034,金小军,2024-10-08 07:02:18,5,6,1,上课真垃圾
170355,4398,莫炯炯,2023-03-03 05:32:19,1,2,1,可爱捏
189978,4976,罗浩,2024-02-05 05:53:51,1,1,0,非常好的老师
77720,5090,库晓珂,2018-05-07 11:53:12,1,1,0,来留名
112658,5090,库晓珂,2019-07-04 23:48:08,5,6,1,老师很儒雅，感觉自己考崩了但给分挺好的
113405,5090,库晓珂,2019-07-06 17:05:26,0,0,0,讲课挺好的，人也挺好的。就是工程热力学这门课的课本框架太乱了，按顺序上课感觉知识点经常重复。
156363,5090,库晓珂,2022-06-19 08:24:11,1,1,0,4.2留名
156368,5090,库晓珂,2022-06-19 08:48:51,0,0,0,给分好，上课耐心温柔，库老师我爱你😍
156369,5090,库晓珂,2022-06-19 08:50:33,3,4,1,人太少才会点名，但好像影响不大，最后一节课会划重点，甚至还有极简版重点，对学生很是关怀。考试题也算友好，在平时的例题里算中等难度，不偏不怪，分布均匀。就是希望以后的作业不要留查图和查书上没有的表的题了..
156372,5090,库晓珂,2022-06-19 09:07:09,0,0,0,哇，收获了大学以来最高成绩，老师太好了
156373,5090,库晓珂,2022-06-19 09:06:09,0,0,0,yyds！
175531,5090,库晓珂,2023-06-25 11:00:28,2,2,0,工程热力学 会点几次名 给分巨好
178119,5090,库晓珂,2023-07-07 05:00:41,0,0,0,老师人巨好
178217,5090,库晓珂,2023-07-08 07:14:27,7,8,1,短学期matlab，干念了五个上午垃圾ppt，然后扔了三道数理方法大题当最后考核，五天签了三天上下午名
72596,5099,李华,2018-01-30 13:09:36,1,2,1,小班上课的感觉很好，老师讲的很清楚
99342,5099,李华,2019-01-24 15:08:03,1,1,0,老师炒鸡炒鸡棒的
119317,5099,李华,2019-11-12 05:08:37,1,2,1,太简单了，我yyx满了
120734,5099,李华,2020-01-16 03:43:40,-12,5,17,上课划水不讲重点，考前啥资料都不给，期末三道大题难的一批，都大二了一门课拉了我将近0.1的GPA，真就绩杀呗，你给我2.1，我也给你个2
148042,5099,李华,2022-01-11 11:46:24,9,10,1,不知道老师PPT上哪里找来那么多搞笑素材的，上课时仔细听会发现一些金句，给分出乎意料的好（航院的李华老师）
148160,5099,李华,2022-01-11 16:42:45,2,3,1,老师挺幽默的，给分很好
153434,5099,李华,2022-04-29 12:59:33,1,2,1,大爱航院的李华老师，兼具幽默与智慧于一身的男神(*'▽'*)♪
200133,5099,李华,2024-10-13 14:03:14,0,1,1,2024.10.13晚\n\n老师钉群发来“午夜密电：明天点名，望周知”\n\n这样的老师大学四年能遇到几个啊😭上课幽默风趣，留的作业也很少，课后能很耐心的回答学生问题。上三节课不知不觉就过去了（真的意犹未尽🤤）\n\n如果有来世，我要做李华老师的🐶！！！
201303,5099,李华,2024-10-31 09:16:36,0,0,0,好好好（航院）
213953,5099,李华,2025-01-22 04:36:05,1,1,0,老师人挺好的，给分出乎意料的高了，应该是期末狠狠捞了
72880,5168,陈丽华,2018-01-31 08:49:31,0,0,0,老师人超好的！讲课调理相当的清晰。速度偏快，但是一个学期上完两本理力，快也没办法。课下请教一些问题超级耐心解答。nice
81952,5168,陈丽华,2018-07-06 15:16:14,-5,3,8,听课可以不用听 但关门点名是真的很骚 还有就是实习课交作业必须要在上课前放在讲台上 否则都算迟交或者漏交 血的教训 辣鸡老师
88972,5168,陈丽华,2018-11-13 02:47:26,4,5,1,说话真的是不流畅，上课思路也比较着急，听着很难受啊
100710,5168,陈丽华,2019-01-26 15:12:27,5,6,1,丽华老师太棒棒棒了!给分超好!!!
100722,5168,陈丽华,2019-01-26 15:30:11,2,2,0,老师人太好啦?虽然上课似乎会有点小紧张（？）但是回答问题耐心为学生考虑，期末考前还很认真叮嘱大家给分也很好
100730,5168,陈丽华,2019-01-26 15:49:54,3,5,2,10分！不能再少了
119155,5168,陈丽华,2019-11-11 02:16:00,0,1,1,很可爱的老师，细心，负责任！
