评论id,老师id,老师姓名,发表时间,点赞减去点踩数量,点赞量,点踩量,内容
579,566,沈宏,2015-03-15 06:00:36,10,18,8,求是 分化卷子难、偏
4287,566,沈宏,2015-06-18 14:58:43,4,5,1,分化不点名的
4440,566,沈宏,2015-06-23 06:12:41,22,25,3,普化老师人好，讲的详细
11981,566,沈宏,2015-12-21 12:23:27,9,9,0,讲的很仔细很有条理 人很温柔\n\n特别喜欢
14388,566,沈宏,2016-01-06 17:00:08,13,23,10,千万别选现代分离分析，千万别选现代分离分析，千万别选现代分离分析，三遍了.\n\n说好的开卷考试，ppt不给带，笔记不给带，只允许五张A4纸
14424,566,沈宏,2016-01-07 03:29:32,30,32,2,普通化学讲的真心好
17064,566,沈宏,2016-01-19 14:08:10,9,10,1,普化上的超好
17730,566,沈宏,2016-01-20 20:08:19,21,21,0,普化讲得很好，每次的“谢谢大家认真听讲”是必备结束语~
19122,566,沈宏,2016-01-23 10:01:18,3,5,2,老师上课很棒，而且不点名，不过不要选现代分离分析！
20041,566,沈宏,2016-01-26 02:55:05,5,5,0,好老师，普化教的很好！！！
21578,566,沈宏,2016-02-29 08:32:54,5,5,0,普化讲的不错，几乎面面俱到，平时看书忽略的上课会讲到。只要认真听，分数不会低。
21763,566,沈宏,2016-03-01 04:29:32,1,1,0,老师讲得很细 人很好
23901,566,沈宏,2016-04-20 12:14:21,29,30,1,“谢谢大家认真听讲”。惭愧啊！
26618,566,沈宏,2016-06-20 11:37:40,7,8,1,老师讲课超级耐心，而且很温和，听他的课不容易走神，很有收获的。
38957,566,沈宏,2016-12-20 03:52:07,4,4,0,普化讲的超级好！人也超级好！
45154,566,沈宏,2017-01-19 05:06:50,4,4,0,有思想，博学，教课认真负责，非常为同学考虑，难得的好老师
47353,566,沈宏,2017-01-25 10:59:12,12,12,0,老师人挺好，给分不水，选分析化学的人复习时多看看仪器和原理的知识点，计算考的少。
47742,566,沈宏,2017-02-22 21:54:08,1,4,3,大一寝室3个人一起上分化，课还没结全跨了大类。。。
49200,566,沈宏,2017-03-29 06:57:40,2,2,0,普化超赞
52566,566,沈宏,2017-06-21 06:28:15,2,3,1,老师人很好 上课也耐心  但是重点不突出  比较容易困...\n\n
61050,566,沈宏,2017-11-07 12:32:41,6,7,1,老师人挺好的 每次下课都说 谢谢同学们认真听讲 挺惭愧的...
63960,566,沈宏,2017-12-20 06:02:22,9,9,0,真心想好好教学的老师，不给10分对不起良心
74422,566,沈宏,2018-02-21 05:39:36,8,8,0,普化讲得真心赞，讲得清楚，耐心，将难以理解的科目变得易于理解。
75432,566,沈宏,2018-03-12 01:45:37,1,1,0,普化讲的真心好
77232,566,沈宏,2018-05-04 05:01:47,2,2,0,老师人超好，上了他的仪器分析。感觉上课很有意思，可能是我太菜了hh，成绩一般。老师是个好老师，超级棒
77277,566,沈宏,2018-05-04 09:41:10,4,4,0,仪器分析讲得很清楚很好\n\n
77492,566,沈宏,2018-05-06 04:09:52,2,2,0,人很好
77570,566,沈宏,2018-05-06 14:30:27,3,3,0,老师真的超级好，建议大家选他，课堂内容很丰富，讲的很详细，老师很温柔
89820,566,沈宏,2018-11-21 02:33:28,0,0,0,666
93028,566,沈宏,2019-01-07 03:51:00,2,10,8,为什么要在期末考试前一周让我们至少找出分化课本上的10个错误？如果一本课本有这么多的错误，那这本书也太失败了吧？
94101,566,沈宏,2019-01-15 07:46:02,2,2,0,明人不说暗话，老铁666
95797,566,沈宏,2019-01-20 05:24:28,2,2,0,老师温柔，有些些啰嗦，然而我还是学不会
97945,566,沈宏,2019-01-25 11:27:14,3,3,0,老师人超棒！
97961,566,沈宏,2019-01-23 02:45:20,1,1,0,老师人很好，很细心。
99900,566,沈宏,2019-01-25 09:20:31,1,1,0,呵呵呵呵
99987,566,沈宏,2019-01-25 11:50:31,5,5,0,论一张A4纸如何救命（褒义）
100000,566,沈宏,2019-01-25 12:17:09,-38,1,39,老师真的很棒\n\n但是期末绩杀 只有4.2
100015,566,沈宏,2019-01-25 12:43:25,-30,5,35,感谢老师半开卷，试卷上要考的都写了，虽说最后也只有4.8，但老师真的超好啦！
100020,566,沈宏,2019-01-25 12:48:15,-25,5,30,虽然被卡绩了，只有4.5。但是还是感谢老师，沈老师教得不错。
100291,566,沈宏,2019-01-26 02:13:57,0,1,1,每次上课提早半小时到 有一次教师们都没开?\n\n总想着比老师早到一回 却总是失败\n\n期末考试分析化学复习了整整五天（导致C程无力补天）所幸结果不错 努力有收获
100308,566,沈宏,2019-01-26 02:43:21,2,2,0,老师好有礼貌啊，而且很儒雅
100436,566,沈宏,2019-01-26 06:30:49,2,2,0,超喜欢沈老师，虽然预置老师不是沈老师，但还是慕名来听沈老师的分析化学，收获很大。老师讲课清晰，答疑耐心，有些答疑不到位的地方会晚上查资料第二天重新给你讲解一遍，人很儒雅，每节课后都会说“感谢大家认真听讲”。喜欢~
100437,566,沈宏,2019-01-26 06:31:03,2,2,0,老师讲课清晰，答疑耐心，而且人超级nice。每节课下课都会说“谢谢同学们认真听讲”，超儒雅呀
100553,566,沈宏,2019-01-26 09:40:26,0,0,0,老师真的很贴心， 备课讲课很认真，回答问题很细致，十分十分♥
100756,566,沈宏,2019-01-26 17:23:31,0,1,1,老师真的太好了TT 备课太用心了，考试划重点认真听分化就有指望了 感谢老师让我分化上4
100808,566,沈宏,2019-01-27 01:02:10,3,3,0,超级棒的老师
110003,566,沈宏,2019-07-01 22:29:51,6,8,2,助教很垃圾，，平时分极低，作业b，c档一大把。老师上课有条理，讲的也很清楚，就是没有重点，很容易走神。最后，绩杀哦！认认真真复习了一个礼拜，感觉发挥的不错，大题有一道刚好做到了，2.4，历史最低。。
111500,566,沈宏,2019-07-01 23:19:26,5,6,1,这个绩点，感觉不会再爱了，明明自己学的还可以，平时小测也在班级中游水平，结果出来后1.8，什么鬼，?再见
111514,566,沈宏,2019-07-02 00:18:56,4,4,0,老师人很好，讲课也很有条理，但是真的是绩杀啊<(ToT)>
111520,566,沈宏,2019-07-02 03:11:13,11,13,2,woc，，，这个什么辣鸡猪脚，，平时群里有人问问题一点都不回答，，作业随随便便改，随便一下就是b，c档，没见过这么不负责任的助教，您咋不把给个e啊，e显得您多厉害啊~~~不过老师人是好的，绩点不好看，也不能怪老师，沈老师平时上课讲的很细致，回答问题也很细心，只是分析化学这门课太难了，而且期末占比80％，确实是考的不好，给老师10分！
111559,566,沈宏,2019-07-02 03:10:13,2,3,1,老师9分 助教0分，认真复习了一个多星期，考试感觉也不错 3.0
111565,566,沈宏,2019-07-02 03:34:02,2,3,1,老师上课上得很好，每次下课都会说谢谢同学们认真听讲，说实话，是个挺好的老师，但是试卷出的实在恶心，理科硬生生考成文科，绩点实在不敢恭维。此课慎选，除非你把正本书背下来，才有可能的高分
111580,566,沈宏,2019-07-02 04:40:18,6,6,0,老师的专业程度和投入程度你值得拥有；学习前最好对课程的回报程度有一个明确定位：这是一门非常重要的基础性课程，这在学习的时候可以给自己心理暗示的。老师上课很杂，与考试关联度随缘，但复习的时候只要紧扣书本，基本都能复习好的；助教方面，最好有一本习题答案，这样就避免他因懒作恶；最后，请及时并重视小测，我的绩点纯粹死于平时小测作死，至今不知道这扣了我多少分，可能降了2档...祝大家好运！
111613,566,沈宏,2019-07-02 07:17:03,6,6,0,我挺想知道平时分扣了我多少。。。
111644,566,沈宏,2019-07-02 10:04:02,9,9,0,这10分老师的，是真心的关心同学，说实话最后跟着老师的复习提纲把所有提纲上的东西掌握了基本上期末考能上90(其实我做期末考题的时候发现题目很多和最后复习提纲对应，但还是看的不够深入因此最后弟弟3.3，但弟弟只认真看了一半的书)但我认识一高中化竞一奖也只有3.9，心里平衡不少。对于助教，感觉太较真了，动不动给b给c，感觉有点不把学生的成绩当成绩。还有这门课的内容真的很难分清重点主次，所以平常不要去纠结细节，大致理解就行，不要纠结太细。
114633,566,沈宏,2019-07-11 02:01:21,6,7,1,分化甲。唉感觉上课和考试没什么关系。而且为什么听沈老师的课想睡觉？可能是沈老师说话太温柔了吧……最后复习的挺认真的但是不知道方向所以做了太多无用功吧。希望选这门课的同学复习有效率一点，认真理解课本分析方法和仪器原理，考试会比较偏，要做好抄了整张A4纸也没什么用的准备。其实很多东西理解了根本没必要抄。考试计算也不难，多看课本！多看课本！多看课本！
118863,566,沈宏,2019-11-07 06:17:23,2,2,0,既然考完了就来给沈老师打个call～超爱沈老师 撇开功利性的考试和绩点（毕竟都还没出来）沈老师真的是很好的老师 很认真很负责地上课 虽然上课时间很紧张但是老师讲得很细致也会有适当的拓展 感觉不会仅仅为了一场考试去教书 答疑超耐心 老师个人也很有人格魅力 很欣赏老师对人对事的态度 感谢老师～
119034,566,沈宏,2019-11-09 23:35:47,4,4,0,真的很喜欢沈宏老师，老师很博学很儒雅。听老师讲课我都有想转专业去学分化了hhh
119169,566,沈宏,2019-11-11 03:44:34,6,6,0,很棒的老师\n\n就是每次下课听到感谢同学认真听讲都很心虚
119346,566,沈宏,2019-11-12 07:45:13,3,3,0,(分析化学)沈老师是这个学期最喜欢的老师之一了，上课讲得很好，思路很清楚，每次下课都会说“谢谢大家认真听讲”。因为课时覆盖了自己的午觉时间，每次课我都好困好困，要努力阻止自己睡着，不过大部分时候还是认真听课了的！也谢谢老师一直认真上课。
124542,566,沈宏,2020-07-02 13:44:39,2,2,0,出分了竟然没人来评论。。讲得还是挺好的，这学期疫情原因有点乱，考试占80，平时只有20，而且闭卷，感觉分数还是有些吃亏。
129765,566,沈宏,2021-01-12 06:09:57,7,7,0,非常认真的好老师，每次下课都说“谢谢大家认真听讲”
136371,566,沈宏,2021-06-17 04:22:30,0,1,1,我觉得沈宏这学期教的分化教魔怔了 💣
136870,566,沈宏,2021-07-08 03:47:19,-4,1,5,助教好漂亮，脾气又好，爱了爱了。
138081,566,沈宏,2021-07-07 09:30:26,-6,4,10,一点师生情都没有。。。。。。。。。
138539,566,沈宏,2021-07-09 16:22:30,1,2,1,虽然线上上课有点听不清楚，但是老师上的真的很好，感觉线下上课好有趣，每一节上完课都会说“谢谢大家认真听讲”，助教姐姐也很好！
141241,566,沈宏,2021-09-27 05:32:02,0,2,2,太好啦！
142169,566,沈宏,2021-11-08 05:43:13,1,2,1,温文尔雅，孜孜不倦，循循善诱的好老师
144886,566,沈宏,2021-12-25 12:20:15,-3,0,3,非常关心学生的老师，讲课非常认真，重点讲的很详细，考试狠狠捞
145359,566,沈宏,2021-12-29 07:28:05,2,2,0,温文尔雅的沈老师yyds
145859,566,沈宏,2022-01-03 11:38:51,2,2,0,我感觉能教普化的老师教个普物应该没问题（10分）
149877,566,沈宏,2022-01-17 12:34:51,2,3,1,沈宏老师讲课是真心好！但是助教给分是真的拉！一个化竞生不知道为什么普化只拿了4.2的绩点，明明期中考了全班前列，期末出分就不知道为什么巨低。。。
151879,566,沈宏,2022-03-19 01:41:27,0,0,0,绩点很低，讲的还行
153057,566,沈宏,2022-04-24 13:28:44,2,2,0,期中八十三，当时全班平均分七十分左右（好像），总评八十二，…莫名其妙…
154566,566,沈宏,2022-06-02 06:53:28,1,2,1,想要高绩点就快逃，助教给分真的拉！
155308,566,沈宏,2022-06-10 12:47:26,1,2,1,老师讲的很好 但绩杀
156321,566,沈宏,2022-06-19 04:46:28,2,4,2,分化期中第2，作业交齐，展示也好的，期末也差不多的样子，最后4.2属实有点难受；老师的课很好，人也很好，给分这样不是助教的问题，因为普化也是这个样子；低分的会捞，成绩比较均匀；想拿高绩点的同学建议润
156427,566,沈宏,2022-06-19 14:50:08,6,7,1,这个老师真的没有良心啊
157718,566,沈宏,2022-06-24 12:30:25,1,2,1,怎么说呢？老师非常和蔼，而且是非常厉害的老师，但是可能更适合当硕士、博士生导师，给本科生上课的话，就感觉有些平淡无味。而且分析化学这门课本身考试形式和考试的内容就非常无语。作业是交齐的，期中考是89分，但是课堂上总会出现那么几次从来不提醒的小测，然后期末考莫名其妙的74分，最后总评卡在了82分。只能说，老师没有完全发挥他的实力，我也没有发挥出我正常的水平。不过如果想要拿到高绩点，建议还是选别的老师。
158488,566,沈宏,2022-06-29 16:24:58,2,3,1,提醒下想换老师的同学，分化甲只有沈老师上。。。
163166,566,沈宏,2022-12-08 13:10:31,0,0,0,讲得挺好的
170775,566,沈宏,2023-03-09 11:00:57,0,0,0,外瑞古德
178123,566,沈宏,2023-07-07 05:10:06,1,1,0,（上了沈宏老师的分化甲和沈老师负责的大化实验A）是这学期最喜欢的老师！！！很儒雅的一位老师，上课节奏比较慢但是讲的也比较细比较清楚。会在下课的时候说“谢谢大家认真听讲”！问问题也回答的很详细！是从各个方面来讲都非常求是的老师
191026,566,沈宏,2024-03-29 00:26:00,0,4,4,逆天高中班主任，没上课在实验室门口吃三明治bb得整个走廊都听得见
193668,566,沈宏,2024-06-14 23:31:24,1,1,0,人是好人，当老师水平也是很好的，但因为中级化学实验的逆天理论考逆天预习考逆天理论课逆天平时成绩公布需要负直接责任，扣两分，打个八分
195404,566,沈宏,2024-06-28 03:19:45,2,2,0,老师很不错，值得10分，可惜被中化一这门狗屎耽误了。希望老师作为课程的负责人能够对这门比大物实验还烂的课进行大刀阔斧的改进！
195567,566,沈宏,2024-06-28 22:23:37,0,2,2,好求是，分析化学应该是一分不调，小测应该也没赋分，考多少就是多少。我期中考98，小测平均差不多85，期末只有一两个填空不会，最后总评92，仅供参考
213413,566,沈宏,2025-01-17 08:51:05,-2,0,2,分化乙，老师讲课非常细致，深入浅出，节奏偏慢，非常友好，还会记住大家的脸（有位朋友不上课去交作业，老师问他为什么不怎么来上课）。随堂可能会有总共3次左右的小测，不会提醒；考试方面，至少拿今年来说，不太需要太多的准备，做好微雕基本可以完全覆盖，而且今年计算题和作业没一点关系。\n\n绩点的话，老师明确说了这门课过程化给分，平时小测蛮重要，另外貌似真的不会调。
221199,566,沈宏,2025-06-22 02:33:22,0,0,0,其实老师人是很好的，讲课也讲的很细致，但是老师的声音有点催眠，平时看着也是一个很儒雅有礼的人，之前他还很有礼貌地问我，在实验中心看到我，是在做什么实验，但是分化甲实在是难/哭，而且一张a4抄不下什么东西，抄的都没考，是我上课没好好听，给分比较求是吧
95,587,张帼奋,2015-03-14 15:49:50,3,6,3,好老师
155,587,张帼奋,2015-03-14 16:14:41,13,19,6,老师很严谨，有一种呆萌的感觉，平易近人～非常认真
160,587,张帼奋,2015-03-14 16:16:53,32,40,8,非常认真的老师！讲课很好～
163,587,张帼奋,2015-03-14 16:18:15,4,7,3,脑残粉
224,587,张帼奋,2015-03-14 17:05:18,10,14,4,讲的超级好！！上课有例题一道道讲解，尤其好的是会给你留自己做的时间，不用担心跟不上（虽然有时候还是有点跟不上:P）
246,587,张帼奋,2015-03-14 18:04:17,16,16,0,好老师，赞
274,587,张帼奋,2015-03-14 23:53:51,8,10,2,讲的特别好！
532,587,张帼奋,2015-03-15 04:23:49,2,2,0,思路清晰，老师平易近人。
542,587,张帼奋,2015-03-15 04:39:41,-4,4,8,没怎么听过课……
645,587,张帼奋,2015-03-15 09:58:00,2,2,0,讲得很清楚
1202,587,张帼奋,2015-03-21 16:35:28,0,0,0,给班主任个
2292,587,张帼奋,2015-04-16 11:43:08,-7,5,12,不注重学生体验。
3510,587,张帼奋,2015-06-17 01:24:47,2,2,0,清楚有条理
5230,587,张帼奋,2015-07-06 03:01:11,3,4,1,讲课很清楚 答疑很亲切
5478,587,张帼奋,2015-07-08 00:50:53,5,6,1,超喜欢
5575,587,张帼奋,2015-07-08 11:45:59,25,26,1,好老师。 另，学弟学妹作业注意整洁。
5786,587,张帼奋,2015-07-09 10:56:14,1,1,0,教的很好
9156,587,张帼奋,2015-10-14 16:19:12,2,2,0,很好的老师
9716,587,张帼奋,2015-11-05 07:06:08,1,1,0,炒鸡好老师
10117,587,张帼奋,2015-11-16 10:07:28,2,2,0,讲课清楚
10167,587,张帼奋,2015-11-17 05:44:49,2,2,0,很不错啊
10316,587,张帼奋,2015-11-18 05:16:17,4,5,1,讲得很清楚，口齿也清晰，感觉很好
10842,587,张帼奋,2015-11-23 07:00:56,2,2,0,老师讲的很棒～
10965,587,张帼奋,2015-11-23 13:38:01,1,1,0,超级棒！！不喜欢数学的我听的很舒服
11401,587,张帼奋,2015-11-30 06:26:23,1,3,2,很Nice\n\n
13209,587,张帼奋,2015-12-25 07:35:34,4,4,0,老师讲课很详细，人很呆萌，口齿很清晰
17865,587,张帼奋,2016-01-21 03:06:43,-20,0,20,超级严肃的一位老师，面无表情，讲课很枯燥。
19455,587,张帼奋,2016-01-24 09:08:42,3,3,0,超级棒\n\n
19472,587,张帼奋,2016-01-24 09:57:29,1,2,1,点了一次名，还是抽着点，还被抓到了
19477,587,张帼奋,2016-01-24 10:22:59,1,3,2,期中会点一次名，讲课挺好的，速度不快，都是例题
19518,587,张帼奋,2016-01-24 12:58:25,1,2,1,讲的真的很好
20027,587,张帼奋,2016-01-26 02:31:32,2,2,0,认真负责，但是本身对数学不感冒所以觉得一般
20442,587,张帼奋,2016-01-27 14:42:14,0,1,1,讲得很好然而没有满好难过
23659,587,张帼奋,2016-04-12 01:11:48,2,2,0,概率论很简单 注意复习就好 老师给分也好
26806,587,张帼奋,2018-12-25 12:10:08,37,47,10,毕竟教材的编者，一下就能抓住重点。反正楼主上课虽然只能听懂不到一半的内容吧，但还是坚持听，下去认真写作业，考前刷刷题就满了。ps楼主可是微积分线代从没上四的回头浪子。
26814,587,张帼奋,2016-06-21 07:15:20,6,10,4,讲的特别好，只要智商正常，认真听课，认真复习，绝对能满绩，因为老师讲的太好了
27966,587,张帼奋,2016-06-28 07:51:30,12,12,0,第一个5.0
28585,587,张帼奋,2016-06-28 10:38:56,-7,1,8,怎么说呢 给分还是看卷面的 平常作业都是a也没用
29207,587,张帼奋,2016-06-29 11:58:43,1,1,0,炒鸡好
29763,587,张帼奋,2016-06-30 09:44:03,0,5,5,给分很好   虽然每次都去上课  但基本上一节没听过   考前过了遍课本刷了几年的卷子 就满了   只能说老师给分太好了  ps:期中测验的时候我还是0分
33512,587,张帼奋,2016-09-20 01:48:34,154,163,9,老师是女的
36124,587,张帼奋,2016-11-10 13:05:00,5,5,0,上课睿智清晰，下课慈祥耐心，调理清楚，逻辑特别让人跟得上，就特别顺的感觉…我们有问题张老师都是笑眯眯回答的，感觉特别暖~这样的老师也是不可多得呀
39733,587,张帼奋,2016-12-27 07:52:18,6,8,2,想问一下概统导论的课给分怎么样啊？概统导论和概统两门课难度相差大吗
43355,587,张帼奋,2017-01-16 07:33:56,1,1,0,老师讲的很好
46446,587,张帼奋,2017-06-20 07:34:14,0,2,2,讲课很不错
46454,587,张帼奋,2017-01-21 15:15:01,0,2,2,什么给分.......
46457,587,张帼奋,2017-01-21 15:25:48,1,1,0,老师讲的很细
46460,587,张帼奋,2017-01-21 16:21:08,-8,4,12,给分超低，不建议选
46467,587,张帼奋,2017-01-21 23:24:50,2,2,0,老师超级好！思路清晰 口齿清晰 像播音员一样 讲的不快 都能跟上 认真听讲一定成绩不会差！
46483,587,张帼奋,2017-01-22 00:53:04,4,7,3,给分好，轻松满绩
46593,587,张帼奋,2017-01-22 03:29:03,2,2,0,是我学的不好
46622,587,张帼奋,2017-01-22 04:18:52,6,7,1,讲课风格有点像我微一的老师何延，比较基础但很认真，抓重点。老师人也很好，给分也好，跪谢满绩。
46795,587,张帼奋,2017-01-22 10:23:20,1,2,1,老师课讲的是不错，但是好像不怎么调分。今年考试贼难，不少人给分不是很好。
46876,587,张帼奋,2017-01-22 15:11:25,3,3,0,给分好，有做思维体操的感觉
46905,587,张帼奋,2017-01-23 01:08:09,2,2,0,讲解很详细的老师，赞
51143,587,张帼奋,2017-05-18 12:11:30,19,20,1,如果说能把学生讲懂是一种技能，张老师技能点大概是点满了。真的很清晰，微一3.3微二已经放弃的数学渣到现在为止还对概统充满了兴趣。而且老师真的很负责，期中考过后一节课对着名单找成绩不理想的同学，很认真的说想帮助他们提高成绩，希望大家都能考过考好，哪怕是单独帮助补习也没关系。这门课的慕课也是老师讲的，可以听听看，保证思路清晰。有师如此，夫复何求，不管考多少都要给老师满分！
51737,587,张帼奋,2017-06-09 02:29:39,8,8,0,数理统计 既生张帼奋 何生黄炜
55565,587,张帼奋,2017-07-02 02:21:47,1,1,0,没有学过微积分线代，但是听张老师的课一点障碍都没有，老师讲课是真的很不错，逻辑条理很清晰，考点也基本上都顾及到了。
55614,587,张帼奋,2017-07-02 05:05:47,1,1,0,老师超棒！每次上课从东区跑到西区，这样也很少迟到。期末会整理知识点，每次上课前也会梳理上节课的内容。给分很好！
55615,587,张帼奋,2017-07-02 05:06:04,2,2,0,老师讲课很棒，有条理，而且人也很温柔和蔼～
55766,587,张帼奋,2017-07-02 10:42:34,2,3,1,没有满?也给10分好评.上课节奏把握的很好，只是本人太菜，期中，期末都考得不好分才低.
56088,587,张帼奋,2017-07-03 04:51:15,1,4,3,老师很棒，把知识解释的特别清楚，问问题也很耐心解答，让人很安心的感觉。大学第一个满绩，谢谢老师！
88788,587,张帼奋,2018-11-08 05:29:26,1,1,0,超级细心，人也很善良，上课虽然没有什么激情但是从来不会困。好老师。
90775,587,张帼奋,2018-11-26 03:27:18,6,6,0,我怎么觉得mooc讲得跟黄炜没法比呢……
91733,587,张帼奋,2018-12-19 03:40:20,5,5,0,没觉得像思维体操 像思维按摩，按着按着就睡着了………
92019,587,张帼奋,2018-12-25 12:11:24,1,1,0,老师很好，课有点难\n\n
93251,587,张帼奋,2019-01-08 11:33:46,4,4,0,老师的书编得真清楚，讲课讲得也清楚
93254,587,张帼奋,2019-01-08 12:16:41,23,23,0,隔壁张南松班的前来感谢老师，是老师的网课教会了我概统，在张南松班里简直痛不欲生，就在我绝望的时候看到了老师的网课，这才绝处逢生
93324,587,张帼奋,2019-01-09 04:21:19,6,7,1,虽然是隔壁班过来蹭课的同学，但是觉得老师思路很清晰，节奏也适度。线上小测有问题发邮件的时候回复得时间也很快
97877,587,张帼奋,2019-06-18 06:28:52,-165,5,170,\n\n概统满绩好气哦，为什么期末不出难的难一点，都没有发挥的空间
98323,587,张帼奋,2019-01-23 10:18:59,3,3,0,概统看张老师网课就好啦!
100076,587,张帼奋,2019-06-18 06:28:39,-137,9,146,期末考出这么简单干嘛咯?让那些菜鸡考的和我差不多，这个满绩含金量不大，好气啊
100456,587,张帼奋,2019-01-26 06:58:54,16,16,0,只想问老师什么时候出成绩……
101037,587,张帼奋,2019-01-27 09:52:43,3,6,3,苍天鸭，怎么会有这么好的老师！人生第一个满绩！老师上课有一种高中老师的感觉，知识点讲得特别细，超级耐心！人还特别好！发邮件都回得很快！
101042,587,张帼奋,2019-01-27 10:09:02,8,8,0,这成绩出得我怀疑人生，我期末考计算错误率是得有多高能考成这样，不过老师还是很好的，讲得很细
101043,587,张帼奋,2019-01-27 10:09:25,-14,4,18,人生第三个满绩
101046,587,张帼奋,2019-01-27 10:28:55,2,3,1,看着评论里一堆满?大佬真可怕。本人没有满?，但老师是真心好，很少这么认真地听一节数学课。
101049,587,张帼奋,2019-01-27 10:31:00,3,7,4,均绩低了0.2，你们自己感受吧
101052,587,张帼奋,2019-01-27 10:45:59,5,6,1,我从没想过概统会和数分一个绩点，只能说在我这给分很不好吧
101061,587,张帼奋,2019-01-27 11:18:46,3,3,0,怪我卷面分低吧 没想到概统和微积分一个分
101138,587,张帼奋,2019-01-27 15:48:46,2,3,1,我要是到了隔壁班可能就是60分了吧
101140,587,张帼奋,2019-01-27 15:58:05,3,4,1,不知道为什么只拿了2.4
101194,587,张帼奋,2019-01-28 01:51:58,8,10,2,大家千万不要忙着复习生化只复习一天概统，不然很可能1.5?
101307,587,张帼奋,2019-01-28 03:56:10,-23,1,24,老师真的很棒！虽然一学期没坚持下来听课 感觉很亏 作业全抄被老师拉到4.2?
101441,587,张帼奋,2019-01-28 08:07:09,0,1,1,特别好！！！
101466,587,张帼奋,2019-01-28 09:00:24,3,4,1,老师很好呀，上课思路很清晰，真的是把重点拎出来讲，个人感觉听课比自学更高效，认真听课把握重点不管题目怎么变化都能做，对付考试肯定没问题，重在平时好好学鸭(=^・ω・^=)
