评论id,老师id,老师姓名,发表时间,点赞减去点踩数量,点赞量,点踩量,内容
4741,2,李铁风,2015-06-27 05:00:13,5,11,6,你觉得呢-_-#-_-#-_-#
4763,2,李铁风,2015-06-28 03:02:30,9,20,11,没有重点 不知道在干嘛 布置作业也是随机看 极坑\n\n
4777,2,李铁风,2015-06-28 14:35:11,-3,11,14,极坑！最大的问题是还以为自己讲得很好啊。悲哀啊！
10463,2,李铁风,2015-11-19 03:22:37,8,17,9,连期末考的内容都不知道。
23854,2,李铁风,2016-04-19 01:15:05,2,6,4,这么年轻的副教授 有点厉害的
26269,2,李铁风,2016-06-16 12:51:13,4,7,3,期末考搞错了考试内容，导致了低分
31779,2,李铁风,2016-07-05 02:03:28,3,5,2,作业布置得好随意
38540,2,李铁风,2016-12-08 06:05:27,12,18,6,老师人挺热心的，我觉得不错
52104,2,李铁风,2018-03-12 23:25:51,-1,5,6,到考试了还不讲材料力学？考试复习什么\n\n
52838,2,李铁风,2017-06-23 06:58:13,6,11,5,老师很好，会给你讲一些有用的东西，会分享他在浙大的事，平时从不点名，给分也好
53032,2,李铁风,2017-06-25 03:49:55,7,11,4,蛮好的，心里有一套自己想教会大家的东西，考试重点也尽量都告诉大家，以前怎样不知道，就觉得今年的铁风哥肥肠棒。
54983,2,李铁风,2017-06-30 14:14:46,7,10,3,就像一个有经验有套路的老学长。\n\n给风哥点赞
82159,2,李铁风,2018-07-15 04:51:49,1,7,6,大恩大德 没齿难忘 强推 必选
82174,2,李铁风,2018-07-07 10:20:11,11,20,9,上课真一般，基本自学。是个奇葩，他立志不成为像其他老师那样的所谓的PPT player，结果嘛……一学期下来只学到些什么“拉压弯扭、说学逗唱”。考前复习下dota火枪1v5视频的话，过应该没问题?（大作业重要
85030,2,李铁风,2018-07-15 04:54:14,1,5,4,铁风老师浓浓师生情
85031,2,李铁风,2018-07-15 04:55:33,3,8,5,男神老师！哈佛学霸！
85034,2,李铁风,2018-07-15 05:00:41,-1,3,4,还不错
85043,2,李铁风,2018-07-15 05:48:10,1,7,6,给分满分
91609,2,李铁风,2018-12-15 13:07:06,1,5,4,男神老师
94733,2,李铁风,2019-01-18 04:06:21,-1,3,4,可以说是很男神了
104309,2,李铁风,2019-03-17 13:45:06,4,6,2,希望老师能把作业交的方式和小组研讨说清楚一点
110486,2,李铁风,2019-06-27 06:36:50,3,6,3,浙大流传着风哥火枪1v5的传说
114589,2,李铁风,2019-07-10 23:16:11,6,9,3,社会我风哥！每次布置作业都是关于下一节课的内容，导致每次要完成作业必须自学掌握下节课要讲的内容～平时作业思考题就很迷～大作业占比50%，大型人类迷惑行为表演现场～考前复习ppt会像泄题一样的画重点～给分超好不卡绩～
114693,2,李铁风,2019-07-11 04:09:21,-1,4,5,被卡绩了
125989,2,李铁风,2020-09-16 10:22:45,0,4,4,谁能想到平时邮件都不回复的李老师给分那么好呢 考完以及格为目标的我被捞上4.2
125992,2,李铁风,2020-09-16 10:28:12,2,7,5,这给分！有被吓到！高的没道理！李老师就是我干爹！
133735,2,李铁风,2021-03-04 09:58:34,24,36,12,浙江大学航空航天学院交叉力学中心李铁风教授团队联合之江实验室，与合作单位开展跨学科交叉研究，率先提出机电系统软-硬共融的压力适应原理，成功研制了无需耐压外壳的仿生软体智能机器人，首次实现了在万米深海自带能源软体人工肌肉驱控和软体机器人深海自主游动。这种环境自适应的仿生软体机器人和智能系统，将为深海探索科考、环境监测与资源勘探提供解决方案，为复杂环境与任务下机器人及智能系统设计提供新思路。\n\n\n\n登上《自然》封面！浙大团队成功“打卡”马里亚纳海沟\n\nhttps://mp.weixin.qq.com/s/EjP8_aV8nMeUoSCfJZxoxw
141391,2,李铁风,2021-10-05 14:50:13,-2,5,7,是一位好老师
156839,2,李铁风,2022-06-21 05:40:10,7,8,1,上课不讲考试范围内的东西，我学尼玛
157887,2,李铁风,2022-06-25 10:29:39,9,12,3,就凭一学期两次早八都一声不吭放我们鸽子，其中一次课还没补没解释原因来看，我真不敢打高分。最后一次课讲大作业要求，考试发现有一块知识点没讲......
173372,2,李铁风,2023-05-22 03:38:57,2,4,2,李教授科研实力很强，成果大家有目共睹。李老师口才也很好，讲得小故事很有意思。但总觉得上课还是得踏踏实实来上。如果李老师上的是某些通识课，尤其是面向低年级、甚至中学生，我认为效果应该会不错。\n\n本学期是杨老师和李老师一起带的课，李老师出差或有重要的事情，就有杨老师来上。杨老师更年轻，可能没有李老师那么多的台上经验也没有很好的口才，但至少踏踏实实一个知识点一个知识点说清楚了、考试重点与形式也给同学们提了。\n\n李老师给分如何，不太清楚，还没经历那个阶段。不过我还是觉得能让学生在课堂上学到东西的老师才是好老师。\n\n虽然第一节课很惊喜，带着挺多的兴致来听李老师的课。但从实际教学效果来看，真的没办法给李老师高分。
220108,2,李铁风,2025-06-15 04:00:54,2,2,0,请千万要注意材料力学老师有一章不讲，需要自己看一下（考前前一天晚上才发现那章也考，别的班都有讲，虽然这次考试没考到哈哈
13990,26,朱林利,2016-01-03 11:33:18,14,16,2,挺好的，听详细。
13993,26,朱林利,2016-01-03 11:36:54,14,14,0,很严格的老师，给分不错！
14225,26,朱林利,2016-01-05 13:15:56,9,9,0,大师级人物，不仅可以学到知识，还有一段人生。
14648,26,朱林利,2016-01-08 05:29:50,6,6,0,老师挺好的
14756,26,朱林利,2016-01-08 16:50:49,5,5,0,拥有哲学的老师
14795,26,朱林利,2016-01-09 09:08:08,4,4,0,难得的好老师！
15158,26,朱林利,2016-01-12 08:54:23,3,3,0,严谨，专业，求是
15685,26,朱林利,2016-01-16 06:22:42,3,3,0,严谨专注
26971,26,朱林利,2016-06-22 02:59:47,2,4,2,沉醉于自己的世界，并不关心考试。
27911,26,朱林利,2016-06-28 04:42:15,3,3,0,给分真不错，我考下来觉得都要挂了结果还上了80，满意
28551,26,朱林利,2016-06-28 10:04:10,3,4,1,作业和上课进度永远不同步
30098,26,朱林利,2016-07-01 02:24:56,0,0,0,讲的还可以，但是感觉给分比较随意，低分会拉到80左右，有的感觉考的不错的也会被拉到80左右
32984,26,朱林利,2016-09-09 07:56:15,-5,1,6,每天上课先照着名单提问半节课。讲课一般，不过PPT做的很好。半开卷的考试，考前把PPT上的公式都抄下来，最后竟然满绩了。
51829,26,朱林利,2018-04-27 13:50:50,-8,3,11,变态神经病
52397,26,朱林利,2017-06-19 15:03:53,6,6,0,随堂点名，两节课有三十分钟都在提问，ppt做的不错，但课经常讲着讲着就把他自己给绕进去的...
53932,26,朱林利,2017-06-28 05:10:49,1,1,0,很关心同学。给分很不错
56043,26,朱林利,2017-07-03 03:29:47,3,3,0,朱林利老师再次印证了工力系老师都是大神这一普遍定律，上课讲得很好，课前抽同学们回顾上一堂课内容虽然有些同学不喜欢但我觉得还好，毕竟老师也是为了我们更好地巩固。给老师发邮件问问题或者微信群里老师都会回复。考试写错正则方程是我没学好，唉～愧对老师给的高分
72730,26,朱林利,2018-01-31 03:52:38,1,1,0,很负责的老师，人也超级好，会给我们讲故事讲自己的经历！ppt做的也很良心！
98192,26,朱林利,2019-01-23 07:26:40,3,3,0,老师很好是我太菜了
147165,26,朱林利,2022-01-09 03:07:08,2,2,0,老师上课会点人起来回答问题或者回扣上一堂课内容，但是点了人没来也无所谓，PPT做的非常好，其实只看PPT复习就行了，zll我的男神
152306,26,朱林利,2022-04-02 11:34:51,1,1,0,我是kuozizheng，朱老师对学生特别好
183583,26,朱林利,2023-11-27 12:53:53,2,2,0,塑性力学好好好
189139,26,朱林利,2024-01-22 05:58:00,3,3,0,（工程力学）老师上课很认真！！！ppt做的也很好，课堂教学和复习的时候都很好用～（不过老师不会提前放ppt在xzzd 因为上课会抽同学提问）\n\n朱老师不点名的，虽然每堂课都会叫同学复习上节课内容、回答问题，但是答不出来也没关系，老师很儒雅温柔。\n\n工程力学这门课，知识深度上不难，但知识面很广，建议大家还是要认真听课。刚出分，我了解下来班里同学的均绩还是不错的。欢迎大家选朱老师哇！
189144,26,朱林利,2024-01-22 06:59:49,1,1,0,给分非常好yyds
213168,26,朱林利,2025-01-16 07:50:32,1,1,0,好好好
215468,26,朱林利,2025-02-26 11:04:01,1,1,0,朱老师人非常好，看得出他有非常高的学术追求，课程也相对轻松，是一个好老师
32550,211,金仲和,2016-07-07 14:29:56,-1,2,3,金老师很和蔼，上课内容也很多，就是略无聊
32605,211,金仲和,2016-07-08 04:41:37,-1,2,3,很和蔼，内容很多，但不难，给分也不错，好老师
30010,226,王惠明,2016-06-30 17:20:02,11,12,1,比应祖光还讲得透彻的老师( ˘▽˘)4学分材力全靠王老师了
30046,226,王惠明,2016-07-01 00:56:42,2,3,1,条理清晰人也萌～
30649,226,王惠明,2016-07-02 06:45:39,5,5,0,考试没有考好，不过老师也手下留情了，基本都能拿到比较好的结果
51444,226,王惠明,2018-11-06 03:46:04,1,2,1,肥肠和善的老师，讲课也很好。能有这样的理工科老师夫妇何求。有两次巨简单的小测
75714,226,王惠明,2018-03-15 10:38:06,2,2,0,非常赞，讲得很详细
111695,226,王惠明,2019-07-02 14:28:57,5,5,0,老师讲的非常透彻！神级ppt！！而且还专门发邮箱给学生解答！！上大学来遇到最好的老师
113471,226,王惠明,2019-07-06 17:50:03,4,4,0,男神!
113484,226,王惠明,2019-07-06 18:17:20,3,3,0,老师真的很好 讲的好 人也很好\n\n是我对不起老师 我没有好好学 希望重修仍能选到老师的课 会好好上课的 也很想好好听老师的课
113490,226,王惠明,2019-07-06 18:33:46,3,3,0,人贼好
113504,226,王惠明,2019-07-06 20:55:47,5,5,0,老师水平很高，回答问题特别耐心，课上得特别好，主要是逻辑很清晰，能把复杂的问题简单化。材力选他没问题的。期末没考好我的锅，不能怪他。。（材力还是比较难的，平时还是要花点功夫的）
113505,226,王惠明,2019-07-06 21:13:18,4,4,0,无敌好老师，能把很复杂的问题简单化，能把很难的材力上的非常通俗易懂，老师的逻辑非常清晰，非常善解人意，这么好的老师选到就是赚到了，作业布置也不多，而且作业答疑讲解透彻。
115425,226,王惠明,2019-07-23 03:18:51,3,3,0,非常好
139129,226,王惠明,2021-07-13 03:49:31,0,0,0,绝绝子的老师！！！！
142180,226,王惠明,2021-11-08 08:24:26,0,0,0,老师真的好！很耐心，讲的非常好！
152170,226,王惠明,2022-03-29 10:01:45,1,1,0,王老师真的好温柔\n\n讲课也很清楚，很好的老师
152474,226,王惠明,2022-04-12 11:49:57,2,2,0,逻辑超顺畅的老师 讲的很透彻很容易理解\n\n感觉比理论力学学得都轻松 whm老师yyds\n\n而且对学生特别好 肉眼可见的对学生的关心和照顾 特别温柔而且好说话 很少见的讲课水平又好对学生又认真的老师
156741,226,王惠明,2022-06-21 01:08:43,4,4,0,考前给老师打波满分\n\n很温柔的老师，对学生非常非常关心\n\n课件和上课逻辑都很通顺
157822,226,王惠明,2022-06-25 03:31:52,3,3,0,讲课真的很有条理而且很温柔，也是一个很负责的老师，成绩还没出先给老师打个10分，不管结果如何，老师绝对教的没问题，成绩差也只能怪自己水平不够了
158041,226,王惠明,2022-06-27 11:58:59,3,7,4,真的是很好很好的老师！！！96来答谢啦！！！
158189,226,王惠明,2022-06-27 11:22:26,4,4,0,永远的神，斩杀线可能还低一点，硬是拉到2.7
174843,226,王惠明,2023-06-19 03:12:03,4,4,0,还没考试也没出分，最后一节课结束来评价一下王老师。真的是一位非常好的老师，温柔、教学能力极强，认真上他的课，认真看他的PPT一定是有收获的。不得不说航院开的课的力学老师真的都很厉害，在这里再夸一夸理论力学的应祖光老师。点名的话主要以雷达点名和纸质小测点名为主，大概5-6次吧。反正王老师人真的超级超级好，我真的很爱他呜呜呜呜呜，但是估计之后上不到老师的课了
174913,226,王惠明,2023-06-19 16:16:10,5,5,0,先生风骨
193507,226,王惠明,2024-06-12 03:42:40,2,2,0,不管考得怎样先给老王一个10分。真的是好老师，上课很有条理，脾气也很好，楼下的“先生之风”所言极是。看到最后一堂课最后一张ppt的“祝大家学业顺利”真的挺感动的。\n\n也希望自己能考出一个好成绩哈哈哈~
193797,226,王惠明,2024-06-18 09:39:21,2,2,0,老师上课很好，考试前一天来给老师打一个10分
193855,226,王惠明,2024-06-20 08:48:34,3,3,0,上课讲得很仔细很明白，老师人也很好很和蔼，考完还没出分，先给个10分
195400,226,王惠明,2024-06-28 03:08:00,0,0,0,好好好
197196,226,王惠明,2024-07-09 02:25:57,1,1,0,为人风雅，逻辑清晰，循循善诱，这学期遇见的最好的老师！（给分也很好）\n\n如果你的材料力学预置了王惠明老师或是张文普老师，你真的是中了大奖
220464,226,王惠明,2025-06-18 04:58:09,2,2,0,王老师课件超级清晰，上课讲的超级有逻辑，总之，nice
192499,279,孟华,2024-05-22 04:12:31,1,1,0,推进课，老师上课还是挺认真的，但是PPT都是手写的😱完全看不清，如果上课不认真听话课后很难自学
22393,311,石兴,2016-03-04 05:52:06,4,5,1,故作姿态
47880,311,石兴,2017-02-27 01:45:12,3,3,0,我赌5毛，均绩没有上2.5
49300,311,石兴,2017-04-03 09:45:52,3,3,0,千万千万别选 除非必修没办法 大作业弄搞死你
49610,311,石兴,2017-04-20 07:37:09,3,3,0,大作业太坑，给分太低
110332,311,石兴,2019-06-25 16:13:57,0,0,0,
122458,311,石兴,2020-02-28 14:00:18,15,15,0,楼上说不要选的问题，他上的课都是hang /院必修课，躲不过的\n\n平时分压分严重，考试基本给最低分，均绩有2.0就不错了
122508,311,石兴,2020-03-02 13:32:01,3,3,0,算了不想多说
123287,311,石兴,2020-05-29 12:53:35,-24,2,26,老师很好哦！
131573,311,石兴,2021-01-28 05:03:12,3,3,0,考的什么玩意
135254,311,石兴,2021-05-07 02:02:37,6,6,0,大作业逆天，千万别选计算空气动力学，大二的赶紧学电类课跑路
172737,311,石兴,2023-05-11 15:52:36,7,9,2,我计算空气动力学92分，应该算高的。这门课的90%的难度在于老师上课不知所云，大作业也没有给出合理的提示。\n\n给后面选这个的学弟学妹一点提示，大作业建议使用NND或者L-W方法，若是一定想用weno方法要用muscl限制斜率，而且要加虚拟点。边界条件就是入流边界为给定值，出流边界和里面一层一样，壁面和出流边界大致相同，但是法向速度设成0。激波的初始速度=ma1c1-ma2c2。大作业难点应该就这几个。\n\n平时作业程序的话网上都有的，只要交了就不会扣分。这个老师是肯定会点名的，而且后半程点的多，前面可以适当旷一点。考试的话看PPT即可，每个ppt都会有要考的概念。有计算题，计算的话只要泰勒公式用的6就行了。今年出的极其偏难怪，因为去年有人看了历年卷普遍考得高，就改题目了。所以不必太过在意历年卷这个东西，主要还是看概念背的熟不熟。\n\n虽然这个课槽点很多，但是必修的同学也不必过于惊慌。如果有良好的程序设计基础大作业大概十个小时内是可以完成的。我当时大部分时间都花在了改初始条件上（没错就是我提到的激波速度公式），其他的部分花了七八个小时就做完了。\n\n希望大家都能取得好成绩！
188217,311,石兴,2024-01-18 12:22:56,5,5,0,空气动力学基础，其实是偏科普类的课程，建议是开学前找学长学姐要份PPT，每次上课之前看懂先，上课的时候不会那么枯燥，不然我是真的不想听。然后我们这一届最后考试是半开卷，带一张a4纸，平时学的时候其实就可以开始写了，最后考试周轻松些。老师就不多说了，本来上课质量就不行，考试题型也不愿意说，好像说了要命一样，考前一天晚上问他常数给不给，第二天考前半小时说不给。
189927,311,石兴,2024-02-02 16:38:12,11,11,0,垃圾中的垃圾，出生中的出生。讲课航院垫底，还喜欢每周至少点一次名，讲课不行，屁事还贼多，大作业折磨死人，问问题有时过好几天才回，考试几种题型都不讲，以为自己很牛逼，期末打开了个贼寒颤的思维导图就算复习了。给分也是极品中的极品，三年历史最低分。
193776,311,石兴,2024-06-18 03:14:53,-6,2,8,我不配评价石教授，在此仅分享我作为一个学生的想法。石教授是严谨治学的研究者，对空气动力学的教学也有自己的一套思路，课程除了基本的流体力学知识以及空气动力学基础之外，最后几节还延申了一些，如果分成两个长学期的课可能有更好的效果。平时作业在书上都可以找到，尤其是安德森那本英文书。大家吐槽很多的大作业，这么多年来似乎也是在下调难度，今年都给了“参考文档”了。我自己基本上干完了整组的活，这个作业的工作量只有两百行左右matlab，个人浅见是都够不上计算空气动力学的门槛。考试中很多都是工程流体力学的内容，还是开卷。我最后拿了高于总GPA的成绩，虽然对于排在前面的同学算是拉均绩了。现在大家都想学电类，嵌入式、信号和数电等课学弟学妹们也都上了，或许会对未来方向的选择有新的思考。
200474,311,石兴,2024-10-17 11:55:19,4,5,1,你妈什么时候死
200533,311,石兴,2024-10-18 09:43:12,6,7,1,这tm的小组互评是尼玛人能想出来的？
200543,311,石兴,2024-11-19 07:10:43,7,8,1,不知道怎么想出来的小组互评方案。。。。在石教授的眼里学生的平均水平就是及格呵呵哒。。完完全全智障和完完全全邪恶，甚至对班级成员区别对待。。。
208798,311,石兴,2025-01-02 04:46:39,6,6,0,出的什么鸟卷？？？监考还一直在上面bb，这卷子出出来好意思bb吗？？
213550,311,石兴,2025-01-28 04:31:59,7,7,0,一学期四学分的空气动力学，内容是真的多，光光掌握作业题是完全考不出来的，考试题虽然有很多可以抄到的简答，但是计算很多都没讲过没见过。还没出分，先给老师磕一个，非常害怕，希望可怜可怜孩子们给好点。\n\n\n\n二编：除夕上午出分的，终于等到你还好我没放弃
214190,311,石兴,2025-01-28 05:22:32,2,2,0,除夕出分真有你的。。。👍👍👍
214201,311,石兴,2025-01-28 04:43:19,3,3,0,考完25天拖到年三十出分...从开学抽象到最后一刻
214202,311,石兴,2025-01-28 04:43:17,3,3,0,考完25天拖到年三十出分...从开学抽象到最后一刻
82,525,应祖光,2015-03-14 15:43:29,3,16,13,好老师!
103,525,应祖光,2015-03-14 15:52:57,8,21,13,真的好老师！
176,525,应祖光,2015-03-14 16:25:07,22,33,11,萌萌的 讲课还很细致
4664,525,应祖光,2015-06-26 00:54:50,16,22,6,可爱哭了
4944,525,应祖光,2015-07-01 08:33:31,4,10,6,好老师
5451,525,应祖光,2015-07-07 15:09:17,4,10,6,棒！
5657,525,应祖光,2015-07-09 04:19:08,5,10,5,老师炒
5663,525,应祖光,2015-07-09 05:01:35,4,15,11,人很和蔼，讲课清晰，偶尔讲讲冷笑话，好老师^ω^
8520,525,应祖光,2015-09-22 05:04:24,1,6,5,萌萌哒
13847,525,应祖光,2016-01-01 08:55:53,-6,11,17,水平和叶神差远了！
13987,525,应祖光,2016-01-03 11:40:09,5,16,11,傻乎乎的老师
14128,525,应祖光,2016-01-04 16:33:31,11,19,8,三排以后听不见他在讲什么……
14172,525,应祖光,2016-01-05 06:41:42,8,20,12,基本自学
14193,525,应祖光,2016-01-05 08:13:16,7,15,8,一般般吧
14265,525,应祖光,2016-01-06 03:02:39,0,7,7,不好。
14404,525,应祖光,2016-01-07 02:06:20,-4,4,8,什么鬼啊！
14758,525,应祖光,2016-01-08 16:53:22,0,1,1,什么?_?
14796,525,应祖光,2016-01-09 09:09:54,0,0,0,...
15310,525,应祖光,2016-01-13 13:31:18,7,11,4,好萌的老师，听课特别开心，虽然是下午678的课但从来没有打过瞌睡。\n\n
15311,525,应祖光,2016-01-13 13:34:40,2,2,0,前几天还十分呢嘿
15460,525,应祖光,2016-01-14 13:05:58,8,15,7,全靠自学233333
15683,525,应祖光,2016-01-16 06:21:08,0,0,0,vb
15789,525,应祖光,2016-01-16 09:17:24,4,4,0,人超级好
16821,525,应祖光,2016-01-19 04:30:00,1,2,1,讲的挺不错的
16824,525,应祖光,2016-01-19 04:40:58,10,10,0,不错的老师\n\n
16891,525,应祖光,2016-01-19 07:38:58,-3,3,6,听不进去，自顾自讲
16905,525,应祖光,2016-01-19 08:30:08,1,2,1,好老师，给分好
17177,525,应祖光,2016-01-19 23:52:13,1,2,1,赞，高水平
19883,525,应祖光,2016-01-25 13:38:56,3,5,2,考试比较简单，老师人挺好，给分也还好，上课感觉比较水
20810,525,应祖光,2016-02-01 04:56:47,1,1,0,看人的
21701,525,应祖光,2016-03-01 00:16:05,-3,2,5,无聊的时候很多
23775,525,应祖光,2016-04-16 10:33:43,0,1,1,必须超级赞
24445,525,应祖光,2016-04-30 14:09:37,1,1,0,不错的
26325,525,应祖光,2016-06-17 02:05:03,-8,3,11,个人观点，关键缺点是：回答同学提问的时候不够耐心，心态急躁，不能以平等相视的状态来解答。给学生极不好的提问体验。\n\n对于规定比较死板。
28727,525,应祖光,2016-06-28 13:17:22,1,1,0,老师不错，讲得细，人很善良，给分不错
29249,525,应祖光,2016-06-29 13:34:27,-1,0,1,挺好的，上课可能讲得一般般，给分不错
33042,525,应祖光,2016-09-11 00:55:39,0,0,0,给分太良心了
37818,525,应祖光,2016-11-21 07:39:02,1,1,0,给分好 讲课也不错
44705,525,应祖光,2017-01-18 06:35:49,1,1,0,萌(๑• . •๑)
44729,525,应祖光,2017-01-18 07:10:53,1,1,0,蛮好的老师
49498,525,应祖光,2017-04-17 06:09:37,4,5,1,很好的啊！如果还有其他课就好啦～
53685,525,应祖光,2017-06-27 10:01:45,5,5,0,赞赞赞，考完试一度以为我要挂了，最后成绩很良心啊！祖光爷爷?
53717,525,应祖光,2017-06-27 10:57:26,12,13,1,舒服，各种自我吐槽，每次上课都笑声不断，强烈建议祖光爷爷再开一门结构力学
53958,525,应祖光,2017-06-28 06:13:55,3,3,0,人挺好的
54154,525,应祖光,2017-06-28 14:39:03,9,9,0,为什么！为什么没有10分啊！！！不多说了学弟学妹们挤破头也要选祖光爷爷呀???真正做学问的典范，视野开阔！
54298,525,应祖光,2017-06-29 04:05:56,4,4,0,上了应老师的理力材力，能不能再开一门结力
54551,525,应祖光,2017-06-29 15:10:48,3,3,0,谢祖光爷爷
57745,525,应祖光,2017-07-13 15:37:38,2,2,0,如果你想学到东西，就请往前坐，应老师对很多问题都有自己的想法，开的小灶也特别有趣，好评。
59711,525,应祖光,2017-09-26 05:43:00,1,1,0,非常怀念
59713,525,应祖光,2017-09-26 05:48:15,1,1,0,现在已经在上结构力学课程了，一直特别怀念祖光爷爷的课堂。
61982,525,应祖光,2017-11-22 04:21:50,0,0,0,很萌的老师
62016,525,应祖光,2017-11-22 07:16:14,1,1,0,时不时有冷笑话，视野开阔，灰常喜欢
64914,525,应祖光,2017-12-28 02:44:00,4,4,0,管得不太严的，但老师绝对是学识很丰富的，具体学得怎么样要看自己了
65540,525,应祖光,2018-01-05 12:24:49,0,0,0,非常好的感觉
66269,525,应祖光,2018-01-14 11:03:30,0,0,0,很好的老师！！！
75242,525,应祖光,2018-03-08 06:49:22,0,0,0,怀念啊
79297,525,应祖光,2018-05-30 07:30:32,0,0,0,非常好！
84302,525,应祖光,2018-07-12 13:20:11,1,1,0,虽然讲课有点平淡的，但是集中精力听还是很有意思，而且给分真的太太太良心，容易低空飘过的各位推荐选，只要你最后不是交了白卷这么难看，基本都能给你拉过
99182,525,应祖光,2019-01-24 11:22:57,5,5,0,我！永！远！都爱祖光爷爷！！！！！
99339,525,应祖光,2019-01-24 15:04:22,-1,0,1,太感谢祖光爷爷了！
99949,525,应祖光,2019-01-25 10:33:36,4,4,0,能上应老师的理力课真的是超级幸运，可惜下学期他不开材料力学了。老师讲课思路很清晰，让我这样一个力学渣渣都拿了98分，真的是感动哭了
99984,525,应祖光,2019-01-25 11:41:25,3,3,0,老师人是真的超级好，是我见过最真实，最不装的老师，推荐大家选
117853,525,应祖光,2019-10-05 16:24:31,0,0,0,太棒呀！大爱祖光爷爷
121842,525,应祖光,2020-01-22 10:22:45,0,0,0,神仙老师应爷爷
122374,525,应祖光,2020-02-26 01:29:00,0,0,0,其实我觉得还是自学，主要老师音量催眠，而我力学又是渣渣
127114,525,应祖光,2020-11-09 03:51:20,1,1,0,上课很认真负责，循序渐进，偶尔会搞笑\n\n总之就是非常友善
132352,525,应祖光,2021-02-01 04:18:42,2,2,0,老师的手太长了，能捞的都捞了
139150,525,应祖光,2021-07-13 03:59:27,0,0,0,啊啊啊
