105599,2005,吴旧生,2019-04-25 12:07:21,0,7,7,收到成绩再答一波～平时上课认真听课（后面几周有点水），每次点名都在，课后思考题当周一定会交掉，实验课不水。期末考前花了两天半的时间复习，完整的看了一遍课题ppt，一遍自己的课后思考题（后来画出重点又看了两遍）（我觉得没有强背？）最终4.5，感觉就挺好的hh
105801,2005,吴旧生,2019-04-23 04:41:22,0,8,8,这个老师真实给十分，并且我烧香拜佛祝您长命百岁，一定要让子子代代学弟学妹们好好体会一下这门课的魅力，几十万字的书说背就背，说忘就忘，这么玩学生真的太有意思了，谢谢您，我亲爱的吴老师，我去给您烧香了。
105855,2005,吴旧生,2019-04-22 03:29:26,7,9,2,几十万字的内容能不能给划个重点啊！！
105901,2005,吴旧生,2019-04-23 02:09:52,3,3,0,真实难受
105904,2005,吴旧生,2019-04-23 02:16:51,6,8,2,老师人海星，但点名特别认真，考试真的心态爆炸，还记得考了的名解和问答有，肺泡，心传导，胆小管，类骨质，肠腺，精子发生，血胸腺屏障\n\nps 有时间的话还是建议把课本四十三万字都背一遍呢?
105911,2005,吴旧生,2019-04-23 03:55:04,11,14,3,老师人很好，上课认真负责。考试范围太广了，但这是课程要求没办法。课后要及时复习，内容太多了，我光靠考前看了几天，记不住。
105942,2005,吴旧生,2019-04-23 11:24:12,0,1,1,一点点难受
105962,2005,吴旧生,2019-04-23 15:16:08,0,4,4,辣鸡儿
106166,2005,吴旧生,2019-04-25 11:42:10,-2,3,5,有时间写思考题不如拿打字时间背书或学姐学长整理好的复习资料
106168,2005,吴旧生,2019-04-28 10:17:53,4,10,6,有的同学说老师不回答复习思考题的问题，我的问题老师是有回复的，但是也是过了大概两三周，可能是因为交作业的同学太多了，老师没办法及时回复，但是和很多老师相比，吴老师真的是很负责了。考试内容说实话是有些多的，但从周五开始看的话完全是看的完的，而且不管是书还是复习思考题都能看完、背完一到两遍。关于不画范围的问题，这些知识都是学习这个专业的我们应该掌握的基本内容啊，为什么一定要老师画范围呢（大家有时候只怪老师不划范围让自己背起来轻松一些，为什么不能想一想其实不划范围才是正常的啊，而且有些同学那样评价老师真的有些过分了，那已经算是人身攻击了吧。）
106177,2005,吴旧生,2019-04-25 12:06:47,3,5,2,就说考试吧，想走捷径的看思考题就可以了...虽然思考题答案详细点的也有四万多个字呢：）实验附加部分照着要求的那张看完就差不多了。
106178,2005,吴旧生,2019-04-25 12:22:21,3,8,5,讲讲学长学姐资料的事情，什么话张口就来吗？那些资料是前几届的提纲，就是我们的思考题，每年考试都不一样。真的，要想有个好点的成绩就不要懒
106180,2005,吴旧生,2019-04-25 12:20:42,0,4,4,不想讲话几十万字背尼玛呢
106182,2005,吴旧生,2019-04-25 12:25:21,3,5,2,我觉得上课没问题啊……………老师也很耐心也尽力开玩笑讲的生动一些了考的也是很基础的东西考前看看就行了
106186,2005,吴旧生,2019-04-25 12:37:11,2,3,1,虽然内容很多，背了也忘记了很多，但是老师还是挺好的，中规中矩吧
106187,2005,吴旧生,2019-04-25 12:41:33,-5,3,8,垃圾老师，想考好这门课，几十万字背完吧，不然就看他心情了
106193,2005,吴旧生,2019-04-25 13:05:01,7,8,1,老师人很好，讲课也挺好的，就是考试成绩占比实在太大了一些，占了90％，背的东西又多，考前就很慌，本来算算成绩可能是及格不了的，老师还是给拉上来了，虽然绩点不高，但能过就好，给老师比心
106218,2005,吴旧生,2019-04-25 16:02:32,3,14,11,怎么说呢，还是给10分吧，动科院开课老师本来就少，而老师也一定是本着认真负责的态度对待学生，对待这门课程，作为大学老师，不可能再像中学老师一样天天督促学生学习，检查平时学习成果，只能通过考试的方式呀，说老师不画重点的人，冷静理智地想一想，组织学与胚胎学那么多内容，哪个不是从事相关专业的重点？老师不给画，只是想让大家多学习一点，难道只临时背一下所谓重点就可以应对将来面临的专业性问题了吗？学这门课不只是为了通过最后的考试呀，说到这儿，可能有人又会有稀奇古怪的想法，说高绩点的人才会这么说，才会装清高，装高尚，真不是，我也是属于一次次被动科院多个老师救起来的差生，说这么多只是想告诉后面即将修读这门课程以及其他专业课程的学弟学妹们，第一印象很重要，动科院的老师们其实都很好，爱动物更爱人，以坦然的心态去面对，去接受自己的专业课，面对上课的老师吧，就算老师再不合你的胃口，但这并不能改变你依然要学习这门课的事实，大学生了，自学能力更重要！只有你不再像个小孩子一样想方设法地去挑刺，嫌弃这里不好吐槽，那里也不对，你才能愉快度过这门课，是的，不敢说轻松，但一定更愉快！
106224,2005,吴旧生,2019-04-25 22:51:23,1,6,5,？可是老师不都已经给了范围了吗，几乎没有超出提纲内容啊，说背几十万字书的同学估计思考题内的几万字都没背下来吧（笑）
106350,2005,吴旧生,2019-04-26 13:24:50,10,15,5,一码归一码，不否认楼上的需要自己认真学没错，但是如何引导学生学好，喜欢上这门课不也是老师的职业吗？不要把“自学”当成老师可以不认真教学的借口。(我并不针对吴老师，吴老师上课很认真，只是就楼上同学的想法提出反对意见)。我给7分，说说老师的缺点和优点。\n\n优点:上课不是单纯的念屏幕内容，可以看出老师很认真的备课并且花了很多心血做切片图(你看他那1T的硬盘就知道)。回答问题也很亲切，你问他他尽可能回答。实验课变相让你坐满3个小时(我认为是优点。\n\n缺点:奇葩的作业要求(说是说每次思考题发到他邮箱有加分，但是到底加到哪儿不知道了，看没看也不知道，也从来不回信)。过高的考试占比，期末考强行120分，并且多出来的20分不知道怎么折算到总评分里了(但是估计这次考试给分普遍高了点，老师可能调低了占比)。上课还是缺少一点兴趣调动了，毕竟也是老教师，对这种死板的课程也法做什么创新了。\n\n总结来说，老师挺不错的！专必的老师其实都很认真，只不过是学生接受度的问题，和有些真的心思不在教学的老师比好到哪里去都不知道，希望学弟学妹不喜欢也要认真背，不要辜负自己！\n\n
106399,2005,吴旧生,2019-04-27 05:19:50,0,6,6,客观一点吧，老师人很好!真的很认真，人也很亲切，真的很负责任。缺点也有，上课稍微无聊了一点，我每次都犯困真的对不起了。。。课程内容真的多（也不一定能怪他。。。组胚本来就挺无聊的吧，把这么多内容讲得有趣着实困难\n\n(´-ι_-｀)\n\n关于考试，考前真是背得要疯了。但是，这课真特么实在，你付出多少就有多少分，也不用太担心，不是绩杀。这种课总比一些玄学坑货水课要好太多了。\n\nPS：学弟学妹考前一定要好好看思考题，一定。。。有人酸别人有前辈复习资料。。。我想说用处不大，还得靠自己整理。
106588,2005,吴旧生,2019-04-28 08:24:59,1,7,6,老师人明明很和蔼很好 前面对老师人身攻击的什么鬼  怎么不说老师是大长腿呢
134072,2005,吴旧生,2021-03-15 05:13:15,16,16,0,作业20道题限时5min，内容还都是下节课才讲的东西，实验课进度比理论课快，你这老师当的是真🐮
134211,2005,吴旧生,2021-03-19 11:45:45,3,5,2,垃圾老师
134947,2005,吴旧生,2021-04-24 13:32:23,2,2,0,36000+
151339,2005,吴旧生,2022-03-01 01:03:14,5,5,0,收敛到1吧
152139,2005,吴旧生,2022-03-28 12:57:15,9,9,0,首先是课程安排上属实是有一点问题2和1一起上还先上2。然后，我觉得这个老师吧，不能说不好，但是PPT逻辑确实没有书上的清晰，然后作业安排属实是不合理（我个人认为每个人的学习方式是不一样的，不能用同一种方式来限定学生），还有一种感觉是，这个老师不是想让我们掌握知识的，而是想让我们卷起来【“所以我最后统计座位号时，低轨道、中轨道、高轨道时区别对待的/龇牙/龇牙/龇牙”】，在每一个点都设置分数，我真的不知道100分怎么分出这么多环节的（上课点到，笔记作业，翻译讨论，几十个上课视频，每一个章节的小测，还有期末考试）。最后我的评分也是有高低轨道的哦/龇牙/龇牙/龇牙
152313,2005,吴旧生,2022-04-03 08:37:07,17,19,2,这测试真的是过分了吧，开始还好，后面25道题8分钟甚至6分钟，最后是不是要4分钟了。连做过的试题都不让我们查看，连错了什么题都不知道，这样有什么效果吗？老师一边说着评分评论他都看过，但真的不好好改进下吗？教与学一直都是个相互尊重的过程而不是老师来过分地为难学生，还有这课堂笔记，我想任何一个必修课的老师都不想看到讲课时下面的学生都是低着头的吧。
152503,2005,吴旧生,2022-04-13 11:33:20,1,5,4,fw。
152974,2005,吴旧生,2022-04-22 16:47:05,-7,1,8,好好看PPT，总共看了5遍，最后4.8
153215,2005,吴旧生,2022-04-26 23:33:07,2,5,3,joeson变了，现在给分巨好。\n\n\n\n他真的 ，我哭死
153223,2005,吴旧生,2022-04-27 00:57:10,2,5,3,josen真的是很好的老师，虽然期末背的多，但他划的重点真的有用了！！而且给分巨捞（120分卷子分可以捞人的）。给分真的好，人也真的好！
171887,2005,吴旧生,2023-04-11 05:18:56,0,0,0,666
172776,2005,吴旧生,2023-05-06 14:47:58,3,3,0,自测题15分钟100题，不让看答案不让看分数
175179,2005,吴旧生,2023-06-22 07:15:06,1,2,1,不能说老师人不好，但是对于这门课的设计大家都是有一定怨言的，首先，给的PPT比较凌乱，不是特别有规整性，有点像课本上选了几段比较重要的话放在PPT上，其次老师虽然上课不能说是念PPT，但是确实是比较死板的，其次组培二作为一门一学分的课程，比免疫学3学分的课程作业多很多。其次，在作业布置上来说，首先每周交笔记，这个我没什么好说，就是有点像形式上的抄PPT。但是小测10分钟但有50道题，而且小测不会给答案（指全部结束后），每周一次到三次不等，在这样的形式下，我个人认为小测没有起到实质上帮助同学们学习的作用。其次，实验课实质上很多同学根本就不会观察样本，实验课很水。最后实际上的给分标准没有很明确。
175310,2005,吴旧生,2023-06-23 14:09:45,3,4,1,楼上的还是太委婉了，吴处就是吴处，没什么好说的，你不改你那恶心人的课程设计我每学期都过来踩你，还是必修课，跑都跑不了，真的恶心到家了
175832,2005,吴旧生,2023-06-27 02:01:24,0,1,1,现在给分真的挺好的，但课程安排包括作业自测就比较恶心人…\n\n组胚2选择题很多来自平时自测题，复习的时候可以看看（完全没看自测题的大冤种路过）
191985,2005,吴旧生,2024-05-07 00:54:54,6,6,0,23年组胚客观评价\n\n【点名】点名方式很奇葩，让大家在微信群接龙座位号然后拍照一一核对；但是合理的请假老师都会同意的，并不刁钻，之前阳了请假，还和我开玩笑。\n\n【关于小测】23年的小测结束已经可以看题目了，而且有三次机会，个人觉得从小测题目里面可以巩固不少知识，而且考试选择题基本也是和小测一个类型\n\n【关于考试】上课讲的内容确实很细碎，但重点可以通过小测推断，其实没有太抽象，23年的体验下来感觉还好\n\nps.组胚课内容多是这门课本身的设置问题，但我认为吴老师真的是个好老师，无论是课件还有他的装备（bushi，都可见他上课准备非常认真，而且问他问题也会非常耐心的解答
193969,2005,吴旧生,2024-06-21 06:43:08,-1,2,3,sm晚意
194081,2005,吴旧生,2024-06-22 06:36:29,2,2,0,平时测试10min50题，做完不给答案。平时分应该是提高容错的，这小测容错率挺低
216730,2005,吴旧生,2025-03-23 06:30:25,4,4,0,非常好的组培课，作业可以做到朝令夕改，必修课逃也逃不掉，让心之怪盗团帮忙悔改一下
217398,2005,吴旧生,2025-04-09 15:35:12,0,2,2,孩子们，动科院的课是屎，动科院的老师是什么呢，动科院的学生是什么呢？
217640,2005,吴旧生,2025-04-14 11:10:42,0,0,0,joson在上课与教学方面其实还算不错的，但和这个课程安排与要求绑在一起就很难评了，只能说低分不冤，但不至于一无是处
217706,2005,吴旧生,2025-04-15 10:31:24,0,0,0,事情贼多，给分又似烂
217722,2005,吴旧生,2025-04-15 13:12:49,0,0,0,老师人很好很耐心，组胚这门课的内容实在是太多了，整个春学期都花在这门课了。考试的话选择题都来自小测，名词解释和大题都来自思考题，joson最后一节课会给思考题划重点，大部分都在里边了，节省了不少复习时间，识图题很标准很好认的图不像小测里这么抽象。所以好好复习，分不会差的。喔PPT的英文词汇表要背，选择里有十几道英文题的，形式参考小测。祝大家都能取得理想的成绩，老师也不会为难大家的。
217788,2005,吴旧生,2025-04-16 12:37:24,0,0,0,课很傻逼，老师真的很好
107,2135,姜中其,2015-03-14 15:54:57,6,11,5,不忍直视…上过的人都懂…
461,2135,姜中其,2015-03-15 02:47:25,7,8,1,就是那种自己错了还不让学生说的。上过他的药理就几乎没人选他的毒理了
28194,2135,姜中其,2016-06-28 08:14:44,7,7,0,小树枝真的是有毒...
46261,2135,姜中其,2017-01-21 05:24:40,6,6,0,可能是个假的药理学课吧，都不知道自己到底学到了什么
73680,2135,姜中其,2018-02-02 15:54:15,-3,3,6,老师还可以，但是希望平时成绩和考试成绩的比例可以调整一下
73718,2135,姜中其,2018-02-06 16:46:17,7,7,0,挺好的，就是人有点撒比给分有点撒比上课学不到东西平时事还贼鸡儿多，嗯。
75689,2135,姜中其,2018-03-15 06:55:42,4,5,1,浙大垃圾 浪费时间
88073,2135,姜中其,2018-10-21 12:19:32,3,3,0,呵\n\n不能给零分真的可惜
116875,2135,姜中其,2019-09-17 02:44:43,2,2,0,线上部分25\n\n实验15\n\n期末考30\n\n你敢信?\n\n能不能调一下比例呀实在有点不合理
119293,2135,姜中其,2019-11-12 03:20:24,3,3,0,妈的 怎么能这么无聊？？
120177,2135,姜中其,2019-11-18 03:07:15,2,2,0,给2分，一分看在他人还不错的份上\n\n但上课怎么能这么???破事儿多，什么都学不到，太痛苦了，浪费生命\n\n“为什么要学药理学”这种问题撒币问题他都能问的出来?我好奇被喷成这样他就不能有点B数?怎么9012年了还没点长进?
129389,2135,姜中其,2021-01-05 02:53:59,1,1,0,哈哈哈哈
133641,2135,姜中其,2021-03-03 05:40:18,6,6,0,看到楼上都在负面评价有点难过，小树枝老师确实教学风格独树一帜，思维导图和线上课程繁琐、耗时，投入产出比很低，但是老师人真的很好，对待学生真诚又耐心，也希望同学们学有所得。希望大家能全面地去评价一位老师。
133670,2135,姜中其,2021-03-03 12:07:01,3,3,0,后天就要上老师的课了，先来打个十分鼓励一下老师💪 老师加油(ง •̀_•́)ง
135621,2135,姜中其,2021-05-17 05:20:51,0,2,2,太喜欢姜老师了，上了毒理学，课程只有四个人，享有很多资源，上课很随意舒服，每个人都分很高
141466,2135,姜中其,2021-10-10 16:22:45,3,3,0,任务繁琐，上课啰嗦，英文自我感觉良好
172376,2135,姜中其,2023-04-25 14:58:41,0,0,0,雨课堂扫码点名，毒理学上到后面人越来越少，有点心疼老师\n\n感觉老师其实还是挺想让同学学到知识的，其实思维导图也是为了加深理解吧（虽然是我觉得毒理学1.5短学期课还要那么多作业。。。）\n\n实验报告连实验步骤错别字也会认认真真看，批改的很细致，本来拿c的后来自己努努力认真写还有A\n\n毒理学实验课一般都是自主实验，有一定的考验性，老师也会上课提问并且主动激励学生提问来激发讨论性和兴趣，但可能大部分沉默。。。。。希望这种情况少一点，老师上课可能更欣慰？\n\n总而言之，课程任务较为繁琐QAQ，但是认真学还是学到了的！还有冷幽默。
51762,2138,吴小锋,2017-06-09 07:14:44,8,14,6,实验报告打分全看老师心情
75734,2138,吴小锋,2019-04-17 01:13:02,0,8,8,恶 心
75956,2138,吴小锋,2019-04-17 03:31:07,12,17,5,你们上课是可以随便进出的？
75958,2138,吴小锋,2018-03-23 01:34:30,4,8,4,
76238,2138,吴小锋,2018-03-30 00:36:37,1,8,7,一个完全不懂得和学生相处的老师\n\n非常吊同学的学习胃口
76404,2138,吴小锋,2018-04-08 00:23:27,7,13,6,“上我的课就是来学英语的”
76547,2138,吴小锋,2018-04-13 11:22:34,1,5,4,真的无语
76808,2138,吴小锋,2018-04-23 16:47:48,4,5,1,
76809,2138,吴小锋,2018-04-29 20:14:09,4,5,1,
80428,2138,吴小锋,2018-06-26 11:12:54,2,9,7,不知所云 PPT烂到一种境界 没有逻辑 就是一堆东西东拼西凑旧弄起来了
80680,2138,吴小锋,2018-06-29 04:57:15,0,4,4,老师还是挺好的，就是有代沟
84161,2138,吴小锋,2018-07-12 07:05:53,5,9,4,实验报告要写字好看才满分?
84222,2138,吴小锋,2019-06-29 09:03:36,-41,13,54,我操你麻了个碧\n\n“我的职责就是点一下合格和不合格”\n\n搞我有意思吗傻逼东西\n\n以为多拖我几年就会好好学你的傻逼鬼课了？\n\n英语那么牛逼你怎么不去国外当专家呢\n\n崇洋媚外也要有点水平好不好\n\n所以让我挂两次延毕来衬托你的课水平高吗\n\n早点退休回家安享晚年吧\n\n别让你的祖宗十八代子孙儿女因为你被人骂那么多年\n\n我可记你一辈子了
84241,2138,吴小锋,2018-07-12 10:24:33,6,7,1,实验报告的一个小tip是要多拍照记录哦，浑水摸鱼自然是没有高分的。
84301,2138,吴小锋,2018-07-12 13:11:59,8,11,3,没有一定水平就很难跟上课程，基本上只要第一次挂了就能一直挂到大四，大五大六也有可能，不过Jane老师挺好的
103798,2138,吴小锋,2019-03-06 00:26:46,2,4,2,。。。
103799,2138,吴小锋,2019-05-31 07:23:40,-12,6,18,傻B老师
103800,2138,吴小锋,2019-03-06 00:50:57,2,6,4,大学英语7老师？
104135,2138,吴小锋,2019-03-13 00:36:53,1,10,9,我寻思这老师普通话跟英语都说不好为什么要听写呢？我求求学校感觉换个老师教这门课吧，师生之间教学极度僵硬...老师觉得他觉得的，学生相当一部分听不懂。实在不行学校派个老师来听听看呢？
104404,2138,吴小锋,2019-03-20 00:34:32,2,9,7,我寻思着我来上这门课是来学习分子生物学知识而不是来学英语的，关键您的英语还让人听不懂好吧。真正要学的分生知识一带而过，课程重点放在英语上，是不是有些本末倒置了呢？
105564,2138,吴小锋,2019-04-17 03:33:28,16,30,14,老师太可爱了八哈哈哈哈讲的挺好的啊
105565,2138,吴小锋,2019-04-17 00:59:59,4,13,9,哈哈哈老师也太可爱了，我觉得讲得挺好的别听他们，英语的内容也不是很难，完全在接受范围内啊?口语可能不太好，但是不影响啊|･ω･｀)\n\n那些听不懂的是什么情况。。。。。。
105566,2138,吴小锋,2019-04-17 01:02:00,2,6,4,延毕是自己没水平还来喷老师？.....老师很好啊！
105567,2138,吴小锋,2019-04-17 01:03:00,4,6,2,日语优秀
105568,2138,吴小锋,2019-04-17 01:03:21,1,4,3,下面说脏话的同不配浙大人的称号。老师真的很可爱哈哈哈哈哈哈哈
105569,2138,吴小锋,2019-04-17 01:07:34,2,3,1,嘻嘻嘻怎么能说没学到什么呢？岡崎おかざき片段晓得吗？嘻嘻嘻嘻
105570,2138,吴小锋,2019-04-17 01:04:19,0,3,3,哈哈哈老师太可爱了，之前评论那个本末倒置是觉得附近几个同学上课做笔记都是在记单词有点怪怪的，不过这课本来也没啥特别难的地方，说跳过重点确实有失偏颇了。
105572,2138,吴小锋,2019-04-17 01:04:31,4,5,1,我寻思着这老师也太可爱了8，上课挂查老师评论哈哈哈哈哈哈！
105573,2138,吴小锋,2019-04-17 01:05:47,6,16,10,好惨一老师。老师别哭了我来夸你了！\n\n\n\n我上个月和班主任聊天还夸老师的课挺好的，至少都是干货，能真正学到东西。老师对大家比较严格，课间还会给我们分享音乐。希望老师不要受到一些评论的影响，坚持原来好的教学方式。\n\n\n\n
105575,2138,吴小锋,2019-04-17 01:07:00,12,16,4,老师人挺好的，上课重点也有讲，专业英语也能学到一些。看到评论里有骂他的感觉心里不是很舒服，老师英语口语虽然不好，但是也不是听不懂，而且都有解释。那些说听不懂的不是没有好好学就是在玩手机。最后英语卷子英语答题要求是有点高，但是掌握英语不也是以后想要发展的基础吗？还有评论里一些脏话满篇的人，你们根本对不起浙大学生的学历和身份，尊重老师是做人基本的事，你们做的事和网络喷子没有任何区别，伤害别人并不能让自己获得进步，为什么不想想自己会反复挂科原因去改进呢？
105577,2138,吴小锋,2019-04-17 01:10:11,0,1,1,
105578,2138,吴小锋,2019-04-17 01:15:42,11,15,4,老师应该还会来看，这么说吧，老师截图这里的评论放到课上讲，然后说你们提出的建议就跟我提嘛，我虚心接受。然后针对评论里说的英语口语不好，回答说上世纪的老师就这么教，难改了;针对评论里说的本末倒置，回答说我不觉得呀，学英语挺好的;针对评论里说的希望学校派老师来，回答说这是我们学院自己开的课，要生科院来上还要更难，我就疑惑了，然而不应该是横向对比吗，这一学期我们学的课多且杂，生统，组胚，生理，还有这门分生，我问过前几届的，挂的最多就是这门课，生统也挺难的但是英语试卷中文作答，剩下其他课就算上英文，结合中文也能很好理解，但分生我就不是很理解了，英文试卷英文答题，如果老师真的能虚心接受学生的建议，还是有些实际行动较好。好老师大家就算用脚也会投票，（同样是大课，李剑老师的评论就又多又好分又高）一般的老师学吧学吧一学期也就过去了，真的，同学不瞎。
105579,2138,吴小锋,2019-05-31 07:23:41,-19,9,28,那些骂老师的你TM才是傻逼蠢货呢，我真的怀疑你脑子是不是进屎了，嘴巴里装的都是屎吗，智商不高，情商也不高，又没教养，家里也没权，啥啥都不行，和我在一个学校真是侮辱了我，我估计你这辈子是没有任何前途了，讨饭的时候麻烦离浙大远一点，你这种人真是活着浪费空气，死了浪费土地。
105580,2138,吴小锋,2019-04-17 01:29:02,15,22,7,不能因为是匿名评论就可以口无遮拦，作为浙大学子最基本的教养去哪了？有的人自甘堕落却怪罪于老师(虽然老师在教学方面是存在一点小问题)，要知道不是所有课水水就能过的。
105581,2138,吴小锋,2019-04-17 01:35:07,2,4,2,这么骂老师真的好吗？\n\n老师很可爱啊，还会和我们分享他的歌单
105592,2138,吴小锋,2019-04-17 03:35:47,0,1,1,老师个性很可爱哇
105594,2138,吴小锋,2019-04-17 03:37:33,2,3,1,我觉得老师上课很有趣呀，学习英语本来就是为了我们好啊，学不好的那是自己没努力没用心。支持老师！
105595,2138,吴小锋,2019-04-17 03:43:02,4,6,2,老师挺有趣的 但上课一言难尽
105735,2138,吴小锋,2019-04-19 08:55:49,2,2,0,日久见人心，算是很不错的老师了。
105807,2138,吴小锋,2019-04-21 03:21:54,-1,0,1,
108688,2138,吴小锋,2019-05-31 07:28:18,2,2,0,我觉得老师其实挺负责的，作业和听写也是希望我们及时复习和预习、这样的要求可能和其他大学老师放任自流的态度不一样，但不知道乱骂的同学是什么心理、？！
113133,2138,吴小锋,2019-07-06 00:08:21,0,0,0,选择题这种东西。。还是少出吧
