80339,2941,徐晓虹,2018-06-25 08:54:33,2,2,0,我就想知道ppt地址是什么啊？谁能发一下
82765,2941,徐晓虹,2018-07-09 05:30:18,4,5,1,怎么说呢，总之就是很难从课上学到点什么。虽然老师很和善，但又不是那种让人平生亲近的长者风范。主要想说的就是，不知道怎么才能拿到这么课的高绩点，反正本人上了六门通识了，这是第一门没上4的，整个学习反馈过程严格按照大纲进行，但是没有用。说实话，有点难受
86552,2941,徐晓虹,2018-09-17 06:59:38,4,6,2,很推荐选这门课，事情不多，有一次展示，给分还行。考试考10个课本思考题（想要答案整理的加QQ3402783729  考试直接抄就好了！）
86770,2941,徐晓虹,2018-09-18 13:17:32,4,5,1,拖堂25分钟，服了服了，从没见过这样的
90724,2941,徐晓虹,2018-11-25 11:49:59,3,3,0,老师温柔也很关心学生呀～课程内容还是比较多的，可能老师上课的风格大家不是特别喜欢，但老师真的很认真地在授课呀～只要认真完成老师给的任务，好好写论文、准备考试，肯定没问题哒！最后还是感谢老师秋学期的授课！
90741,2941,徐晓虹,2018-11-25 13:59:35,2,2,0,事情比较多，第二节课就要交读书报告，还有一次论文和展示。讲课的时候气氛非常枯燥，什么都没学到，绩点3.3
90751,2941,徐晓虹,2018-11-25 15:56:37,2,3,1,说实话，给分是我意料之外的高，老师跟同学互动很多，课下也会聊一些家长里短，上课气氛很好，想学东西的同学来这里就对了，只想水课没拿到高分的同学，你们也没必要这样诋毁老师吧？
107964,2941,徐晓虹,2019-05-12 13:45:48,-2,1,3,真糟糕
108009,2941,徐晓虹,2019-05-13 00:01:45,1,1,0,讲不清楚
108190,2941,徐晓虹,2019-05-16 06:14:18,5,5,0,没有那么差
114335,2941,徐晓虹,2019-07-09 22:39:00,1,1,0,老师讲话声音小，PPT老旧并且密密麻麻都是字，每节课都要签到，说是第一节课就要交读书报告，其实拖到最后一节也行，小组作业只能看运气，做的怎么样和随机选的组员有很大关系。老师对时间的掌控不是很准，有拖堂15分钟的历史，讲不完课就请同学们自己回去看PPT。考试题目就五道，除了书上零几年的知识点之外可能有不少需要更新补充的，课后思考题可以做一做，能押到三四道。总而言之，这门课看似简单可水，实际劳动量较大，结果不一定成正比，选课需慎重考虑。
124782,2941,徐晓虹,2020-07-09 05:31:10,4,4,0,挺累的一门课，但可以学到许多东西，尤其是每节课的开头，其实从第一节课开始老师就在教如何好好写论文，格式和内容排布一类的。后面一些知识就看林毅夫教授的同话题课本就好，不用花太多时间。\n\n自己是机械大类，学过一小点经济学基础和计量，但不太用得好，这方面如果论文大作业吃力应该可以私下找老师问，定性也能写好（但不要想偷懒）\n\nPPT展示因为本届远程授课，所以很多小组莫名地做得很水，自己所在的小组算是认真的，可能是侥幸（？\n\n顺带多看看经济学史，尤其是西方发展经济学或产业经济学或区域经济学一类，还有林毅夫新结构经济学的提出背景。。。应该能理解老师为什么要红专。。。看菜下饭吧。。。\n\n论文比较重要（因为这届没有考试）\n\n上课声音催眠，黑板上字都看不清，就记得讲索罗模型什么的（感谢回放功能），不过不看这方面还是很认真负责的。\n\n\n\n自己别的科目不怎么好，所以本着能上一门上一门的无谓心态来上课，前期也不在意，后来稍微认认真真学了一通，最后竟然上90了。想刷分的我就不知道了。
141138,2941,徐晓虹,2021-09-24 08:36:38,1,1,0,老师讲课比较枯燥
141205,2941,徐晓虹,2021-09-26 06:25:28,-5,0,5,不怎么样
148720,2941,徐晓虹,2022-01-13 09:59:20,0,2,2,1.徐老师每节课都要签到，但是只要不缺课太多问题不大，她并不会因为几次没来就直接淦人\n\n2.区域经济学事情不少。大概有三样，一是三四千字的文献阅读报告，二是小组展示，三是五六千字的期末论文，对于一个2.0学分的课来说稍有点多，但这毕竟是个经济学必修专业课\n\n3.徐老师讲课是真的催眠，太瞌睡了，她讲得东西过于枯燥，而且喜欢提一些非常非常老的梗，代沟有点大\n\n4.综合其他同学的情况来看，徐老师是少见的把高分留给中国学生的老师。本学期徐老师给中国学生的分数较高，给留学生的分数较低，可能是因为本学期留学生摆烂过多，感觉本学期一部分留学生的小组展示有点过于水\n\n5.她长得有点像蛤蛤，而且经济学思想也非常具有蛤蛤特点
152731,2941,徐晓虹,2022-04-19 04:17:03,0,0,0,老师真的挺好的，拉高一点分
158767,2941,徐晓虹,2022-07-02 02:46:18,1,1,0,老师人真的挺好的，但是上课很无聊
159031,2941,徐晓虹,2022-07-05 01:34:45,-2,1,3,上课烂，事情多，给分差，建议别听讲别对她所说的任何观点报以认真的态度
159428,2941,徐晓虹,2022-07-19 02:51:44,0,0,0,修完了区经，蛮好和轻松的课程。平时：一篇文献综述，小组答辩展示，期末一篇5K字的论文。整个学期很少听课，论文认真写，最后得 4.开头。老师不是绩杀，对留学生很关心。好推荐！
160083,2941,徐晓虹,2022-09-13 05:25:54,0,0,0,楼上说事多的，上过别的课吗，徐老师已经是事少给分好了，为老师正名
167637,2941,徐晓虹,2023-01-18 02:21:53,1,1,0,事少给分好
25723,3019,张小茜,2016-06-05 04:27:06,15,34,19,这个老师，从国外回来，口口声声中国教育有问题，中国学生不行，他自己不是中国学生？而且还在用签到签出这种无能的方式，真的是无语，从来没有正常下过课，事情还多。慎选！
30827,3019,张小茜,2016-07-02 14:54:22,19,28,9,糊里糊涂，荡头荡脑。给分不错！
31341,3019,张小茜,2016-07-03 16:32:34,21,36,15,不能同意一楼更多 每次上课 必谈哥大的学生多么优秀 必比较周二班和周五班各种好坏 夏学期上的第一节课 就崇洋媚外到让人受不了……平心而论给分不错 但是真心对这个老师喜欢不起来 对学生就是各种嫌弃……心塞
31609,3019,张小茜,2017-03-22 03:49:42,-22,8,30,张老师给分是真的好，不过平时要求很严格就是了，如果课程不是很忙的话可以选择逼迫自己一下，看看case做做search什么的
32883,3019,张小茜,2016-07-21 09:14:37,-12,24,36,越上到后来越发现，其实老师还是很喜欢学生的，而且态度越来越好。
39045,3019,张小茜,2016-12-21 00:51:07,-31,6,37,大爱张老师！
42100,3019,张小茜,2017-01-13 14:50:09,-18,17,35,考前客观评论：特别可爱的老师 虽然要求会有些严格但其实特别温和 上课也特别有意思
42798,3019,张小茜,2017-01-15 07:15:49,-21,10,31,考前评论一波，我真的太爱张小茜了?
46339,3019,张小茜,2017-01-21 09:15:05,17,24,7,讲课不怎么好，稀里糊涂，考前讲重点。
46574,3019,张小茜,2017-01-22 03:05:25,-20,9,29,老师给分真的很好……人也不错 蛮可爱的
46576,3019,张小茜,2017-01-22 03:06:30,-17,6,23,给分好
46612,3019,张小茜,2017-01-22 03:57:57,-14,7,21,考前画“重点”，给分好，楼下应该是research
49493,3019,张小茜,2017-04-17 03:53:57,44,61,17,非常智障了 上课ppt不给 私人联系方式也不给\n\n不管是教学内容还是作业要求 全都表达不清楚\n\n思路乱七八糟
51977,3019,张小茜,2017-06-30 11:53:26,33,41,8,讲的不好。。。
52802,3019,张小茜,2017-06-23 03:27:14,4,18,14,平心而论老师初心是很好的，但上课表述以及教学方式并不能良好传达出这种心意
58179,3019,张小茜,2017-08-15 13:36:33,-24,4,28,非常好
65695,3019,张小茜,2019-09-12 02:22:09,39,46,7,表里不一的老师 表面上说中国教育应该怎么怎么改进，但实际上自己还是践行老一套 表面上说关心同学，但是你去找她时态度极差 记得最后一次复习课一定去上就行
66244,3019,张小茜,2018-01-14 04:06:18,32,41,9,充分把崇洋媚外体现到极致
69686,3019,张小茜,2018-01-25 08:11:21,-18,8,26,很可爱的老师啊，但是为什么。。。（为中计祈祷）
72428,3019,张小茜,2018-01-30 06:03:44,-48,9,57,张老师是宇宙第一老师不接受任何反驳！漂亮，温柔，博识，可爱！下学期金融工程学继续约！超爱您滴！给您小心心～＞.＜
72460,3019,张小茜,2018-01-30 07:09:05,-16,10,26,非常可爱 老师上课特别认真 虽然刚开始感觉要求比较高 但是她都会很认真指导学生的 看得出来老师对学术特别热爱 最后中计卷面达的这么差给分也这么好……感动?
72464,3019,张小茜,2018-01-30 07:10:45,-20,11,31,张老师给分真的宇宙良心吧！上课虽然总是碎碎念有点好笑，但是真的超级超级可爱啊！！而且期末最后真的是 给分也太好了！为张老师疯狂打电话！！
72514,3019,张小茜,2018-01-30 09:21:42,-14,10,24,给分真的良心
72712,3019,张小茜,2018-01-31 02:54:14,-32,5,37,老师人很好，给分很棒，关键是在她的课上可以学到很多东西，当然前提是课下自己也要努力多看文献
72801,3019,张小茜,2018-01-31 05:49:16,30,38,8,中计不调分的话期末卷面怕是没几个人能上80。调分是好，但是原因在于上课的内容我们班都没学而其他班都学了，时间序列就学了一节课，还是朱老师代课，然后考了30分，建议学弟学妹多去隔壁蹭课。最后成绩都取决于调分的话，依据会不会很主观，大家卷面都差不多谁被正太谁满绩呢？反正最后和老师关系好的都满绩了，为什么不能好好考学过的内容，把成绩的决定权留给学生而不是调分。
72817,3019,张小茜,2018-01-31 06:25:10,44,62,18,同样是中英混杂的教课，感觉来代课的一位老师思路清晰很多，传达的也很好，但张老师的表达方式确实有欠缺，废话也很多，导致最后时间序列和内生性都来不及讲，还是请别班老师代课，还都是一节课讲完…最后中计全靠自学。以及她的课会激发恶竞…具体自己体会
74045,3019,张小茜,2018-03-08 06:24:09,-19,3,22,中华有神功
74088,3019,张小茜,2018-02-05 03:57:26,-24,5,29,张老师真的很认真负责（不过换个角度也可以说是要求高啦哈哈），论文评价力求客观公正，深夜还在群里和我们细心解释评分标准，个人认为在科研方面有所追求的同学可以多与张老师交流。另一个个人感受是，张老师心里住着一个温柔天真的小女孩呢！
74224,3019,张小茜,2018-02-07 06:25:44,-21,4,25,很认真
74258,3019,张小茜,2018-02-08 07:03:44,58,69,11,她的能力支撑不起她的想法
76461,3019,张小茜,2018-04-19 05:49:58,79,96,17,希望老师分清楚自己在上什么课。ppt不要搞混，上课不要讲的一半一半的觉得另一门课讲了这个课就不讲了，不是所有人都同时上金工和期货好么？
76909,3019,张小茜,2018-04-26 00:23:25,56,64,8,做pre的前一天深夜十一点半突然（全班都不知道的那种突然）说第二天十一点之前要发个什么word到她邮箱，然后人就不见了。第二天早上才说你们不应该只有ppt，还应该有个word记录你们的详细内容。自己感受一下。\n\n反正就是一个想法瞬息万变，前后矛盾，莫名其妙的老师（我不只一次听到这样的评价）。\n\n另外，她只是哥大访问了一下，又不是哥大毕业……至于那么天天攀关系么，感觉就像和某个大人物合了个影到处显摆一样，感觉幼稚的不行…
78015,3019,张小茜,2018-05-09 04:56:48,40,47,7,记得第一次课之后，旁边外专业过来旁听的小哥说：你们专业的课这样的么？\n\n我严厉地纠正他的看法后，给他推荐了cqb wyz zyj等等老师，并表明我们专业也是有好的老师的...
79937,3019,张小茜,2018-06-15 13:13:27,12,17,5,一个坚定的认为成绩代表了学生的一切的老师
80192,3019,张小茜,2018-06-21 09:21:30,-9,13,22,这位老师对学生投机取巧的行为是零容忍的。大学是学校，老师应该对学生有所要求。不要因为自己达不到高要求就在这b老师，更不要因为其他老师放弃了对大学生行知要求就瞎比较。\n\n课外链接，文献阅读准备的最全的。按时上下课。主动安排补课。给学生争取企业参观的机会。\n\n不足：讲话风格跳跃，导致表达不明确。
80204,3019,张小茜,2018-06-21 12:58:06,-15,4,19,好好好
80535,3019,张小茜,2018-06-27 13:45:55,7,9,2,每个星期都有灵光一现的task，一开始说考试pre好几个星期后（已经来不及退课的时候）又说考试…合作方给的提纲也不肯发给学生…不知道是老师的沟通能力有问题还是根本就觉得学生可以当猴耍
80840,3019,张小茜,2018-07-02 02:40:37,-9,4,13,金工考砸了……只能寄希望于老师手下留情了 为什么查老师上金工均绩会这么高QAQ不过老师平时分给的还蛮高的
81524,3019,张小茜,2018-07-05 09:30:13,7,10,3,把两门课混着讲，上课思路有点乱，把同学们都当预习过的教。最重要的是，课程群风气太差，一水的谢谢老师和奉承话，有营养的讨论倒是基本没有。其他课程群可不是这样的。
82118,3019,张小茜,2018-07-10 08:07:35,21,27,6,以下内容可能引起不适，慎入：\n\n上过老师的两三门课，觉得老师学术水平确实非常高，对待工作也确认一丝不苟，但是讲课的的确确不敢恭维。中计思维混乱且容易跑偏，想到哪讲到哪，中间穿插介绍文献和大牛，导致课堂内容重点、条理均不清晰。而且考试的内容大部分都感觉没讲，也不知道时间都去哪了。金工课感觉类似，实际的知识性内容让人摸不到头脑。而且鼓励班内竞争，各种课前展示读书报告回答问题听讲座加分项。这种课堂个人认为不利于大部分平时默默学习的同学，当然了喜欢和老师聊天谈学术套近乎的另当别论，被老师认识绝对有buff。至于给分，我只能说并不比别的老师好，甚至可能还差，毕竟老师调分都调给谁了大家心里清楚，对于自己认真学习且不愿跟老师套近乎的同学，建议选那种真正教授知识的老师。一开始我也不信这个邪，后来我信了，别问我为什么。
82794,3019,张小茜,2018-07-09 06:52:02,4,7,3,一学期云里雾里，最后全部需要自学一遍。给分糟心。
84221,3019,张小茜,2018-07-12 09:14:58,9,11,2,没有什么收获，思路表达不清，上课总是跑偏。还有种把教学备课视作浪费自己科研时间的感觉，跟学生的关系也只是停留在表面上的“好”而已，金工建议选别的老师。
84534,3019,张小茜,2018-07-13 05:53:25,6,8,2,慎选，太喜欢跟自己套近乎的学生了，而且上课真的感觉很浪费时间，建议选别的老师的课，经济学院还是有很多优秀的老师的！！
85206,3019,张小茜,2018-07-16 04:52:01,13,14,1,学习帝存在的重要意义就是让某些老师不要在课程群的一水奉承的漂亮话中看不到多数学生对自己最真实的评价。\n\n（另外为什么她评分还是10啊，是被锁定了吗）
85234,3019,张小茜,2018-07-16 10:08:06,49,55,6,客观评价一下老师吧，这学期上了老师的期货。先说优点吧：1.喜欢学生，虽然很多人说道阿谀奉承，不过还是感觉到老师本质还是喜欢学生的，也挺为学生着想的人 2.会调分，给分好 \n\n缺点：1.请老师正视作为教师的职责，第一次听见有老师说“抽出我宝贵的时间来给你们画重点（这是第一次见到读了PPT标题就算提纲的，不是花在科研上的时间才是宝贵的，您教书育人，总该懂为人师表的道理。2. 想法颇多，没有调理。老师上课想到什么讲什么，感觉没有用心备课，同时关于期货课考核方式的问题，真的不想吐槽了，老师总是摆出一副，不怪我，我也不知道的样子，这可是您自己的课堂，不要把责任都推卸给别人。\n\n3.态度奇奇怪怪…这一点和老师私下交流过的同学应该都有体会。综合来看…老师您进步的空间还有很多…（希望大家顶上去，让老师看到
92343,3019,张小茜,2018-12-28 02:18:15,12,16,4,语言暴力一流，感到敬畏的应该是施暴者，施暴者会因自己的行为受到惩罚，人在做天在看，好自为之吧
93888,3019,张小茜,2019-01-14 07:22:15,5,6,1,一言难尽
99218,3019,张小茜,2019-01-24 12:23:08,-1,2,3,中计好难啊呜呜呜
100416,3019,张小茜,2019-01-26 05:49:59,-15,5,20,张老师人非常有趣和好玩 也常会讲一些课本外的经验性的干货 学到了很多哩 不过对学生要求比较严格 但还是非常喜欢张老师 不过中计卷面应该是实在考的不好 出分前来评价 担心出分成绩影响了对老师的中肯评价!期待下学期的金融工程!
102383,3019,张小茜,2019-02-01 10:28:37,-14,5,19,特意来给老师美言，老师最棒！
102384,3019,张小茜,2019-02-01 10:32:33,-6,3,9,老师写论文的干货讲的比较多，中计的话，吃透ppt吧，毕竟大学考试，都靠考试周(*￣m￣)
102385,3019,张小茜,2019-02-01 10:38:03,-8,3,11,老师人很可爱～想到什么都会讲出来哈哈哈 然后课堂上会分享很多自己科研的心得 感觉这些东西是很难得的 也是很多课堂上或许没有的 然后给分超好啊！
102388,3019,张小茜,2019-02-01 11:00:36,-10,5,15,总的来说除了课上的不够好其他都很好。老师人非常好，给分也非常好，中计作业也不算多，不过就是听完一次课，知识点很难有太多印象，讲的比较散和随意（ppt也是），倒是科研上的内容还挺多干货的，就是这些内容能集中讲不要影响上课进度就好了。总的来说还是比较推荐的！
102391,3019,张小茜,2019-02-01 11:24:32,-6,4,10,给分好！
102424,3019,张小茜,2019-02-01 16:19:47,-17,3,20,中计。为什么会有这么多评论说老师不好，老师到底做错了什么啊，你们要这样说她？她是讲课不备课了，还是给分刁难你了，还是上课讲有违学校规定的内容了？我觉得老师没有做错什么，不应该受到这样的人身攻击。
103409,3019,张小茜,2019-02-28 03:02:12,11,11,0,？？？？作业要求没听懂，讲课内容没听懂，不知道她在糊糊弄弄说什么？？？
103751,3019,张小茜,2019-03-05 03:52:14,7,8,1,这节课也没说是专业课啊，明明有那么多其他学院学生选，老师你非要把金融工程和中计的一起讲吗？你说你很纠结不知道讲还是不讲，同学们要在查老师上骂你，那你不想想是不是你自己的原因吗？
104094,3019,张小茜,2019-03-12 02:34:42,3,4,1,请老师真的不要把金融工程带入这门课，听课体验很差，本来这门课就没有说是金融工程的续章，么意思，且老师的逻辑真的挺混乱的，无奈...
104290,3019,张小茜,2019-03-16 16:06:58,8,9,1,无语了 布置任务不知所云 自以为在外网上布置作业很牛逼吧可能 实际上除了给学生添一大堆麻烦屁用没有 自己用的上课程序自己搞不清楚 问问题也不回全推给助教 还课上说查老师学生怎样怎样说搞得她不知道怎么上课 服了
105971,3019,张小茜,2019-04-24 01:21:01,-13,9,22,大家没觉得张老师是大学中，为数不多的能像高中老师一样关心学生的老师吗？虽然有时候会cue学生，可是老师的初心绝对是好的!大家的阅读材料，课外的网站学习，是我们没做，这些对我们的学习有帮助嘛?我想是有的，毕竟老师是过来人，从前总是抱怨学习没门道，后来门道来了，又开始抱怨老师作业多，作业布置不清楚。其实大学之大，本就已不拘泥于课本之中了，希望各位宽容，也希望各位能有所收获!
105982,3019,张小茜,2019-04-24 03:29:09,5,6,1,我已联系腾讯总部，走着瞧（狗头）
107301,3019,张小茜,2019-05-03 08:18:52,4,5,1,觉得下面听的学生都懂得很了，所以就不给你好好讲点货，几堂课下来飘在天上，一会这一会那，能具体一点么老师
107570,3019,张小茜,2019-05-07 01:56:51,-2,7,9,开课蒙明伟，点名四十分，上课发早餐，开车出去玩，你还不来选，满绩再不见
107572,3019,张小茜,2019-05-07 02:04:34,-3,3,6,发早餐可还行
110136,3019,张小茜,2019-06-23 14:30:22,-4,3,7,老师很好，如果期末可以再给个复习重点就更好了，内容很多感觉复习不过来，好希望老师可以讲一下复习要点
110950,3019,张小茜,2019-06-28 16:58:59,10,11,1,张小茜是真的牛逼，平常把重点讲的非常到位，就是和考试内容没关系
114892,3019,张小茜,2019-07-12 13:20:11,-11,4,15,说实话张老师还是挺真心关心学生的，给分也挺好的，比起大二的某些专业课老师真的好多了
115515,3019,张小茜,2019-07-31 12:27:44,6,6,0,实在受不了，还觉得自己牛得不行。彻底歧视外专业的同学。
117573,3019,张小茜,2019-09-26 06:01:19,7,7,0,思路不清醒，废话多，喜欢东拉西扯。希望她早日明白学生并不感兴趣她开了什么会得了什么奖带的研究生怎么样
118010,3019,张小茜,2019-10-18 11:11:07,-25,4,29,已经毕业的老学长来说一句，之前其实我也蛮抵触张老师的讲课方式的，原因就像你们发表的那些评论一样。但是后来第二次选上老师的课，逐渐觉得小茜老师是一个非常可爱，朴实的老师，尤其是现在在国外每周被一堆reading埋没的时候，我就会想起张老师的理念与国外教育的确有那么一些的共通之处，当然和国内那种高密度的讲课方式的确不一样，不适应也正常。但是对我而言张老师教的那两门课也是我最后掌握的最好的课程。另外，大家不适应老师的授课方式正常，可是质疑老师人品什么的，还是希望能够更好的去认识老师，老师真的很好。
122643,3019,张小茜,2020-03-11 04:01:04,13,14,1,英语好像也不咋好，却总是要用英语秀优越感。我总觉得这样的老师特别可悲，到学生面前找存在感。辅修的同学表示真的听的云里雾里，每周三节课听的不知道她到底想讲什么，三节课就在拐着弯秀啊秀，我还听不懂她秀点啥？？？
122798,3019,张小茜,2020-04-08 01:58:57,17,18,1,“我始终很强调哈 要严师才能出高徒哈”我想说首先你要是个老师 像个老师 才能做严师\n\n天天叫同学们点赞 我都不知道又什么东西可赞的 辣鸡老师\n\n
122800,3019,张小茜,2020-04-08 02:24:22,23,24,1,讲课么不讲，疯狂分享自己的经历，我tm是来上课的，不是来听有声小说的，简直nc。
122802,3019,张小茜,2020-04-08 03:27:33,15,15,0,回来了回来了回来了回来了回来了回来了回来了回来了回来了回来了回来了回来了回来了回来了回来了回来了回来了回来了回来了回来了回来了回来了回来了回来了回来了回来了回来了回来了回来了回来了回来了回来了回来了回来了回来了回来了回来了回来了回来了回来了回来了回来了回来了回来了回来了回来了回来了回来了回来了回来了回来了回来了回来了回来了回来了回来了回来了回来了回来了回来了回来了回来了回来了回来了回来了
123210,3019,张小茜,2020-05-20 02:11:18,13,14,1,宽于律己，严于待人。喜欢在很细节的地方给人挑刺，但自己讲课漏洞百出。
123224,3019,张小茜,2020-05-21 09:49:21,8,10,2,我就没见过一门课提交课程照片和反馈表的次数占总成绩30%的，关键是你也不早说，真是欠骂
123597,3019,张小茜,2020-07-06 13:09:51,8,9,1,什么鬼
123599,3019,张小茜,2020-06-10 11:02:29,31,33,2,老师让我想到了小学五年级的自以为是的小心眼事儿精公主病女同学
124578,3019,张小茜,2020-07-03 07:13:48,22,25,3,私下接触的感觉是，其实并不是真的关心学生
124696,3019,张小茜,2020-07-06 12:29:02,15,15,0,期末论文没有特定要求\n\n然后边改论文边在群里逼逼赖赖，“很多同学的论文都是混混，好难过”，“改论文的感觉就像过山车“，把不同学生的论文截图发在群里拿来对比。如此师德怎能承担此任？如此水平怎能为人师表？
124711,3019,张小茜,2020-07-06 16:06:48,28,29,1,不排除有精神疾病
124829,3019,张小茜,2020-07-11 11:38:01,5,6,1,说给分好的那位同学你是认真的吗
125268,3019,张小茜,2020-09-05 05:01:16,16,18,2,自私虚伪，在课上秀自己怎么虐待研究生，服了服了……
125984,3019,张小茜,2020-09-16 08:23:58,6,8,2,预置的是她的课，退了选朱的没选上，只好来补选。今天第一次上课。早就听闻风评不行，现在看来果然如此。说一下第一节课的感受吧，正事不说，复习没有，新课不上。就瞎扯自己多么多么牛逼，自己带的学生多么多么优秀，wind多么多么好用。废话一堆，真尼玛辣鸡！！！
126073,3019,张小茜,2020-09-17 05:45:59,4,6,2,多少沾点
